Look Number,Designer,Season,Gender Presentation,Garments,Accessories,Silhouette,Style Keywords,Notes
1,Antonio Marras,Spring 2016,Feminine,Sleeveless printed gown,Floral hair accessory,"Flowy, relaxed","Bohemian, intricate",Rich tapestry-like print
2,Antonio Marras,Spring 2016,Feminine,"Printed coat, striped shorts","Earrings, handbag, ankle boots","Structured, layered","Eclectic, ornate",Mix of prints and textures
3,Antonio Marras,Spring 2016,Feminine,One-shoulder printed dress,"Wide belt, headpiece, earrings","Asymmetrical, cinched","Artistic, bold",Playful draping and bold accessories
1,Antonio Marras,Spring 2016,Feminine,"Metallic coat, embellished dress","Black handbag, headpiece","A-line, oversized","Opulent, textured",Mix of metallic and embellishments
2,Antonio Marras,Spring 2016,Feminine,"Fur-trimmed top, metallic skirt","Color-block handbag, headpiece","Voluminous, cinched waist","Eclectic, luxurious",Textured fur with metallic sheen
3,Antonio Marras,Spring 2016,Feminine,"Embroidered vest, wide-leg trousers",Headpiece,"Relaxed, layered","Artistic, intricate",Detailed embroidery with satin bow
1,Antonio Marras,Spring 2016,Feminine,"Floral embellished blouse, metallic skirt","Embellished headpiece, beige handbag","Structured, A-line","Eclectic, artistic",Mix of textures and patterns
2,Antonio Marras,Spring 2016,Feminine,"Double-breasted vest, tailored shorts","Embellished headpiece, two-tone handbag","Tailored, boxy","Modern, androgynous","Sleek lines, menswear-inspired"
3,Antonio Marras,Spring 2016,Feminine,"Striped jacket, satin shorts, embellished top",Embellished headpiece,"Relaxed, layered","Bohemian, vintage","Soft stripes, intricate detailing"
