Look Number,Designer,Season,Gender Presentation,Garments,Accessories,Silhouette,Style Keywords,Notes
1,Arthur Arbesser,Spring 2023,Feminine,"Red graphic sweater vest, gray blouse, red polka dot skirt",White sandals,"Fitted, straight","Playful, graphic",Bold floral pattern on vest
2,Arthur Arbesser,Spring 2023,Masculine,"Red striped sweater vest, black and white striped shirt, blue pants",Gray hat,"Relaxed, layered","Eclectic, bold","Contrasting stripes, oversized hat"
3,Arthur Arbesser,Spring 2023,Feminine,"Red polka dot top, black polka dot skirt",None,"Flowy, A-line","Elegant, whimsical",Mix of polka dot patterns
1,Arthur Arbesser,Spring 2023,Feminine,"Floral print top, striped skirt","Gray bucket hat, white heeled sandals","A-line, flowy","Eclectic, vibrant","Mix of prints, playful layering"
2,Arthur Arbesser,Spring 2023,Masculine,Black sleeveless top with yellow graphic,None,"Slim, fitted","Bold, graphic","Striking floral motif, minimal styling"
3,Arthur Arbesser,Spring 2023,Androgynous,"Striped shirt with yellow graphic, blue wide-leg pants",Silver shoes,"Relaxed, oversized","Casual, artistic","Contrasting colors, artistic print"
1,Arthur Arbesser,Spring 2023,Feminine,"Blue and white striped dress, houndstooth top",Wooden belt,"Oversized, relaxed","Graphic, bold","Mix of patterns, statement piece"
2,Arthur Arbesser,Spring 2023,Masculine,"Black and white striped sleeveless top, red polka dot pants",None,"Slim, fitted","Playful, contrasting",Bold color and pattern contrast
3,Arthur Arbesser,Spring 2023,Feminine,"Red polka dot top, black polka dot jumpsuit",Red headscarf,"Loose, flowing","Eclectic, layered","Mix of polka dots, vibrant headwear"
