Look Number,Designer,Season,Gender Presentation,Garments,Accessories,Silhouette,Style Keywords,Notes
1,Blumarine,Fall 2008,Feminine,"White embellished dress, white cardigan","Gold ankle-strap heels, white clutch","Flowy, relaxed","Romantic, delicate","Embellished details, soft textures"
2,Blumarine,Fall 2008,Feminine,"Pink slip dress, pink cardigan",Gold ankle-strap heels,"Fitted, soft","Romantic, delicate","Lace trim, soft textures"
3,Blumarine,Fall 2008,Feminine,"Lilac slip dress, lilac cardigan",Gold ankle-strap heels,"Fitted, soft","Romantic, delicate","Lace trim, soft textures"
1,Blumarine,Fall 2008,Feminine,"Pink slip dress, orange fuzzy coat",Gold ankle-strap heels,"Flowy, relaxed","Romantic, soft",Lace trim on dress
2,Blumarine,Fall 2008,Feminine,"Blue slip dress, blue fuzzy coat",Gold ankle-strap heels,"Flowy, relaxed","Romantic, soft",Lace trim on dress
3,Blumarine,Fall 2008,Feminine,"Yellow slip dress, yellow fuzzy coat",Gold ankle-strap heels,"Flowy, relaxed","Romantic, soft",Lace trim on dress
1,Blumarine,Fall 2008,Feminine,"Beige strapless dress, beige fur coat",Gold strappy heels,"A-line, flowing","Elegant, embellished",Floral embellishments on dress
2,Blumarine,Fall 2008,Feminine,"Floral print dress, mauve fur coat","Gold clutch, gold strappy heels",Fit and flare,"Romantic, floral",Soft floral pattern with gold accents
3,Blumarine,Fall 2008,Feminine,"Beige cardigan, floral textured skirt","Fur clutch, black heels","Layered, textured","Chic, delicate",Textured floral skirt with soft knit cardigan
