Look Number,Designer,Season,Gender Presentation,Garments,Accessories,Silhouette,Style Keywords,Notes
1,Chalayan,Fall 2012,Feminine,Red long-sleeve gown,Red shoes,"Fitted, floor-length","Elegant, minimalist","Bright color, simple design"
2,Chalayan,Fall 2012,Feminine,Red long-sleeve dress with textured panel,Red shoes,"Fitted, knee-length","Modern, sleek",Textured panel detail
3,Chalayan,Fall 2012,Feminine,"Red short-sleeve tunic, textured pants",Red shoes,"Straight, layered","Contemporary, layered","Color blocking, texture contrast"
1,Chalayan,Fall 2012,Feminine,"Red textured blazer, matching pants",None,"Tailored, sleek","Bold, structured",Contrasting orange cuffs
2,Chalayan,Fall 2012,Feminine,"Orange and red coat, red pants",None,"Streamlined, fitted","Vibrant, modern",Color-blocking with bold hues
3,Chalayan,Fall 2012,Feminine,"Orange and gray top, dark green pants",None,"Layered, fitted","Colorful, contemporary",Short-sleeve over long-sleeve layering
1,Chalayan,Fall 2012,Feminine,"Charcoal coat with neon green cuffs, gray turtleneck, teal pants",Blue heels,"Oversized, straight","Modern, bold","Neon accents, minimalist design"
2,Chalayan,Fall 2012,Feminine,"Neon green and charcoal zip-up dress, gray turtleneck",Teal heels,"Fitted, straight","Contemporary, sleek","Color blocking, structured"
3,Chalayan,Fall 2012,Feminine,"Teal cropped jacket, teal layered dress, teal pants",Blue heels,"Layered, tailored","Chic, refined","Monochrome layering, clean lines"
