Look Number,Designer,Season,Gender Presentation,Garments,Accessories,Silhouette,Style Keywords,Notes
1,Chufy,Spring 2022,Feminine,Red floral print dress,Red headscarf,"Flowy, relaxed","Bohemian, beachy","Lightweight fabric, vibrant print"
2,Chufy,Spring 2022,Feminine,"Patterned vest, knit cardigan, white bikini bottom",Beaded necklace,"Layered, bold","Eclectic, textured","Mix of patterns, structured shoulders"
3,Chufy,Spring 2022,Feminine,"Blue patterned wrap top, matching skirt",Gold necklace,"Flowy, cinched waist","Bohemian, romantic","Soft colors, subtle print mix"
1,Chufy,Spring 2022,Feminine,"Floral print blouse, high-waisted shorts",None,"Relaxed, casual","Bohemian, beachy","Mix of patterns, lightweight fabric"
2,Chufy,Spring 2022,Feminine,Wrap dress,None,"Flowy, elegant","Minimalist, natural","Subtle print, high slit"
3,Chufy,Spring 2022,Feminine,"Floral tie-front blouse, printed skirt",Necklace,"Relaxed, bohemian","Eclectic, vibrant","Bold patterns, tied waist"
1,Chufy,Spring 2022,Feminine,Floral print dress,None,"Flowy, relaxed","Bohemian, natural","Lightweight fabric, nature-inspired print"
2,Chufy,Spring 2022,Feminine,"Colorful smocked top, denim shorts",Beaded necklace,"Casual, fitted","Casual, vibrant","Playful patterns, street style"
3,Chufy,Spring 2022,Androgynous,"Printed sleeveless top, patterned pants",Headscarf,"Relaxed, eclectic","Eclectic, artistic","Mix of patterns, casual footwear"
