Look Number,Designer,Season,Gender Presentation,Garments,Accessories,Silhouette,Style Keywords,Notes
1,Daryl K,Fall 2008,Androgynous,"Gray oversized hoodie, layered tunic, cropped leggings",Gray ankle boots,"Relaxed, layered","Casual, sporty",Layered tunic with contrasting neckline
2,Daryl K,Fall 2008,Feminine,"Black tunic dress, red leggings",Gray ankle boots,"Loose, straight","Casual, chic",Drawstring details on tunic
3,Daryl K,Fall 2008,Feminine,"Gray biker jacket, matching pants",Gray ankle boots,"Fitted, structured","Edgy, modern",Asymmetrical zipper on jacket
1,Daryl K,Fall 2008,Feminine,"Gray oversized tunic, black leggings",Gray ankle boots,"Relaxed, oversized","Casual, modern","Belted waist, minimalistic"
2,Daryl K,Fall 2008,Feminine,"Pink dress, plaid hooded jacket","Gray ankle boots, long socks","Layered, cozy","Casual, layered","Contrasting textures, playful"
3,Daryl K,Fall 2008,Feminine,"Black blouse, black mini skirt, black leggings",Gray ankle boots,"Slim, fitted","Chic, urban","Monochrome look, sleek lines"
1,Daryl K,Fall 2008,Feminine,"Black jacket, blue top, black pants",Gray ankle boots,"Relaxed, casual","Edgy, urban",Layered look with a pop of color
2,Daryl K,Fall 2008,Feminine,"Gray plaid dress, black leggings","Gray ankle boots, black belt","Loose, comfortable","Casual, chic",Plaid pattern with a cinched waist
3,Daryl K,Fall 2008,Feminine,"Blue tunic, black leggings",Gray ankle boots,"Flowy, relaxed","Casual, modern",Bright color with a loose fit
1,Daryl K,Spring 2012,Feminine,Sleeveless printed dress,"Bracelet, ankle boots","Loose, draped","Colorful, abstract",Bold print with a mix of colors
2,Daryl K,Spring 2012,Feminine,"Printed blouse, black cropped pants","Necklace, bracelet, strappy heels","Relaxed, casual","Colorful, abstract",Mix of structured and relaxed elements
3,Daryl K,Spring 2012,Feminine,Printed dress,"Necklace, red ankle boots","Straight, fitted","Colorful, abstract",Vibrant print with striking footwear
1,Daryl K,Spring 2012,Feminine,"Black blazer, black top, white loose pants",Red strappy sandals,"Relaxed, fluid","Chic, modern",Monochrome with a pop of color
2,Daryl K,Spring 2012,Feminine,"Purple top, gray shorts","Brown crossbody bag, red strappy sandals","Relaxed, casual","Effortless, contemporary","Belted waist, vibrant footwear"
3,Daryl K,Spring 2012,Feminine,Multicolored jumpsuit,Black sandals,"Relaxed, fluid","Artistic, bold","Abstract print, vibrant colors"
1,Daryl K,Spring 2012,Feminine,"Black sheer knit top, gray shorts","Gray fedora, silver necklace","Relaxed, casual","Effortless, chic","Layered textures, casual elegance"
2,Daryl K,Spring 2012,Feminine,White dress with black accents,Black shoulder bag,"Fitted, sleek","Modern, graphic","Bold red shoes, graphic print"
3,Daryl K,Spring 2012,Feminine,Black draped dress,,"Draped, fluid","Minimalist, sophisticated","Asymmetrical draping, bold footwear"
1,Daryl K,Fall 2011,Feminine,"Camouflage print cape, white shirt, black leather pants",Black leather bag,"Loose top, fitted bottom","Eclectic, layered","Nature-inspired print, contrast textures"
2,Daryl K,Fall 2011,Feminine,"Black tunic, white shirt, black leather pants",None,"Layered, structured","Monochrome, modern","Minimalist color palette, sleek silhouette"
3,Daryl K,Fall 2011,Feminine,"Camouflage print jacket, black top, black trousers",None,Relaxed fit,"Casual, chic","Nature-inspired print, relaxed tailoring"
1,Daryl K,Fall 2011,Feminine,"Olive coat, black top, khaki pants",Silver necklace,"Tailored, straight","Casual, chic","Earth tones, autumnal feel"
2,Daryl K,Fall 2011,Feminine,"Black embroidered cardigan, orange top, floral shorts",Black belt,"Relaxed, layered","Eclectic, playful","Mix of textures, vibrant colors"
3,Daryl K,Fall 2011,Feminine,"White tunic, faux fur vest, black leggings",Silver necklace,"Slim, elongated","Modern, edgy",Monochrome with texture contrast
1,Daryl K,Fall 2011,Feminine,"Black dress, black leggings","White tote bag, black ankle boots","Straight, fitted","Minimalist, chic",Simple black ensemble with a pop of white from the bag
2,Daryl K,Fall 2011,Feminine,"Black sweater, olive mini skirt","Chain cap, black crossbody bag, sheer tights","Layered, fitted","Edgy, urban",Mix of textures with leather accents and sheer tights
3,Daryl K,Fall 2011,Feminine,"Black top, olive jacket, leather pants",Black ankle boots,"Relaxed, tapered","Casual, modern",Olive and black color palette with a focus on comfort and style
