Look Number,Designer,Season,Gender Presentation,Garments,Accessories,Silhouette,Style Keywords,Notes
1,Dundas,Spring 2023,Feminine,Yellow and orange cutout mini dress,None,Fitted,"Bold, vibrant","Color-blocking, cutouts"
2,Dundas,Spring 2023,Feminine,White cutout gown,Metallic pointed heels,Fitted,"Elegant, modern","Asymmetrical cutouts, high slit"
3,Dundas,Spring 2023,Feminine,Blue and yellow cutout top and skirt,None,Fitted,"Sporty, futuristic","Color-blocking, off-shoulder"
1,Dundas,Spring 2023,Feminine,Yellow and orange cutout mini dress,None,"Fitted, bodycon","Bold, vibrant","Color-blocking, geometric cutouts"
2,Dundas,Spring 2023,Feminine,Black cutout jumpsuit,None,"Fitted, sleek","Edgy, modern","Intricate cutouts, monochrome"
3,Dundas,Spring 2023,Feminine,Yellow and white striped cutout mini dress,None,"Fitted, bodycon","Playful, fresh","Striped pattern, circular cutouts"
1,Dundas,Spring 2023,Feminine,Black one-shoulder cutout mini dress,None,"Fitted, bodycon","Edgy, modern",Strong cutout details
2,Dundas,Spring 2023,Feminine,"Black cutout crop top, black mini skirt",None,"Fitted, bodycon","Edgy, modern",Asymmetrical top design
3,Dundas,Spring 2023,Feminine,"Black and yellow cutout top, blue mini skirt",None,"Fitted, bodycon","Color-blocked, modern",Bright color contrast
