Look Number,Designer,Season,Gender Presentation,Garments,Accessories,Silhouette,Style Keywords,Notes
1,Eytys,Spring 2021,Feminine,"Light gray jacket, white top, light blue jeans",None,"Loose, relaxed","Casual, streetwear",Fringe details on sleeves
2,Eytys,Spring 2021,Masculine,"Light gray jacket, white shirt, light blue jeans",Necklace,"Loose, relaxed","Casual, streetwear",Layered shirt under jacket
3,Eytys,Spring 2021,Feminine,"Gray oversized blazer, blue jeans",None,"Structured, oversized","Casual, chic","Bare midriff, structured blazer"
1,Eytys,Spring 2021,Masculine,"Black leather jacket, black t-shirt, gray sweatpants",White headband,"Relaxed, oversized","Streetwear, casual","Contrasting textures, sporty elements"
2,Eytys,Spring 2021,Feminine,"Silver bomber jacket, white t-shirt, gray pants",Pink shoes,"Loose, oversized","Casual, sporty","Pop of color with shoes, monochrome outfit"
3,Eytys,Spring 2021,Feminine,"Lilac blazer, gray t-shirt, light wash jeans",Black sandals,"Relaxed, structured","Casual, modern","Layered look, subtle color palette"
1,Eytys,Spring 2021,Masculine,"Black tank top, blue wide-leg pants","Silver sunglasses, black belt","Relaxed, elongated","Urban, edgy","High-waisted pants, minimal top"
2,Eytys,Spring 2021,Feminine,Off-shoulder knit dress,Reflective sunglasses,"Fitted, asymmetrical","Textured, modern","Fringe details, one-sleeve design"
3,Eytys,Spring 2021,Androgynous,"Gray vest, white t-shirt, blue pants",None,"Casual, straight","Minimalist, casual","Layered vest, tonal look"
