Look Number,Designer,Season,Gender Presentation,Garments,Accessories,Silhouette,Style Keywords,Notes
1,Gauchere,Fall 2024,Feminine,"Pinstripe oversized blazer, pinstripe skirt","Black leather clutch, black gloves","Oversized, relaxed","Minimalist, androgynous","Deep V-neck, monochrome pinstripe"
2,Gauchere,Fall 2024,Feminine,"Black leather shirt, pinstripe trousers",None,"Tailored, straight","Sleek, modern","Leather texture, monochrome contrast"
3,Gauchere,Fall 2024,Feminine,"Black sleeveless top, leather skirt",None,"Layered, fluid","Edgy, contemporary","Textured top, leather layering"
1,Gauchere,Fall 2024,Feminine,"Gray pinstripe coat, black turtleneck bodysuit","Black clutch, black gloves","Long, tailored","Minimalist, sleek","High-cut bodysuit, monochrome"
2,Gauchere,Fall 2024,Masculine,"Black leather coat, black leather shirt, black leather pants",None,"Relaxed, oversized","Edgy, modern","All-leather ensemble, shiny texture"
3,Gauchere,Fall 2024,Feminine,"Camel coat, camel turtleneck bodysuit","Black clutch, black gloves","Tailored, structured","Chic, neutral","Monochrome camel look, high-cut bodysuit"
1,Gauchere,Fall 2024,Feminine,"Gray oversized coat, gray pants",None,"Oversized, draped","Minimalist, cozy",Scarf integrated into coat design
2,Gauchere,Fall 2024,Feminine,"Gray long coat, beige bodysuit","Black belt, black gloves","Relaxed, elongated","Minimalist, sleek",Contrasting textures with coat and bodysuit
3,Gauchere,Fall 2024,Feminine,"Yellow knit sweater, yellow knit skirt",Black clutch,"Fitted, streamlined","Bold, textured",Bright color contrast with black accessories
