Look Number,Designer,Season,Gender Presentation,Garments,Accessories,Silhouette,Style Keywords,Notes
1,Halston,Fall 2008,Feminine,"Gray cape, gray dress",,"Flowing, layered","Minimalist, elegant",Monochrome look with a focus on texture
2,Halston,Fall 2008,Feminine,"Gray dress, long vest",Fur scarf,"Slim, elongated","Chic, sophisticated",Use of fur for texture and contrast
3,Halston,Fall 2008,Feminine,"Silk shirt dress, turtleneck",Large shoulder bag,"Relaxed, fluid","Modern, sleek",Silk fabric adds a touch of luxury
1,Halston,Fall 2008,Feminine,"Gray coat, knee-high boots",,"A-line, tailored","Minimalist, classic","Clean lines, muted color"
2,Halston,Fall 2008,Feminine,"Brown turtleneck, purple high-waisted pants","Gold pendant necklace, brown clutch","Slim, fitted","Chic, modern","Long necklace, sleek silhouette"
3,Halston,Fall 2008,Feminine,"Gray draped dress, thigh-high boots","Large tote bag, black belt","Loose, belted","Effortless, elegant","Soft draping, monochrome look"
1,Halston,Fall 2008,Feminine,"Gray blazer, matching skirt, blue top",Gray scarf,"Fitted, layered","Sophisticated, elegant",Monochrome look with a pop of color
2,Halston,Fall 2008,Feminine,"Gray trench coat, lime green turtleneck",,Tailored,"Chic, classic",Contrasting color under a neutral coat
3,Halston,Fall 2008,Feminine,Gray maxi dress,Long pendant necklace,Flowy,"Minimalist, relaxed",Draped fabric with a statement necklace
1,Halston,Fall 2010,Feminine,Red mini dress,Beige ankle boots,"A-line, fitted","Chic, bold",Structured shoulder details
2,Halston,Fall 2010,Feminine,Burgundy dress,"Burgundy hat, burgundy knee-high boots, belt","Boxy, tailored","Sophisticated, modern",Asymmetrical hat design
3,Halston,Fall 2010,Feminine,Gray dress,"Gray hat, burgundy knee-high boots, belt","Boxy, tailored","Elegant, sleek","Asymmetrical hat design, cuffed sleeves"
1,Halston,Fall 2010,Feminine,"Gray fur top, gray mini skirt",Black belt,"A-line, fitted","Chic, modern","Textured fabric, monochrome look"
2,Halston,Fall 2010,Feminine,Burgundy draped dress,"Black belt, statement ring","Draped, loose","Elegant, sophisticated","Asymmetrical neckline, rich color"
3,Halston,Fall 2010,Feminine,Brown embellished dress,None,"A-line, fitted","Glamorous, edgy","Studded details, deep V-neckline"
1,Halston,Fall 2010,Feminine,Beige embellished mini dress,Furry sandals,A-line,"Elegant, modern","Geometric embellishments, draped detail"
2,Halston,Fall 2010,Feminine,"Teal draped top, teal trousers","Silver bracelet, metallic heels",Fitted,"Chic, sophisticated","Asymmetrical draping, monochrome look"
3,Halston,Fall 2010,Feminine,Black cut-out mini dress,"Black sandals, statement earrings",A-line,"Edgy, sleek","Velvet texture, cut-out details"
