Look Number,Designer,Season,Gender Presentation,Garments,Accessories,Silhouette,Style Keywords,Notes
1,Issey Miyake,Fall 2024,Feminine,Blue ribbed knit dress,"Green and blue knit hat, matching scarf","Fitted, flowing","Textured, layered","Playful color blocking, elongated sleeves"
2,Issey Miyake,Fall 2024,Feminine,White ribbed knit dress,"Purple and white knit hat, matching scarf","Fitted, flowing","Textured, layered","Soft color palette, elongated sleeves"
3,Issey Miyake,Fall 2024,Feminine,Dark blue ribbed knit dress,"Matching knit hat, scarf","Fitted, flowing","Textured, layered","Monochrome look, elongated sleeves"
1,Issey Miyake,Fall 2024,Feminine,"Navy draped cape, matching skirt",,"Voluminous, layered","Avant-garde, sculptural","Innovative use of fabric, dramatic draping"
2,Issey Miyake,Fall 2024,Feminine,"Black turtleneck, purple layered skirt",,"Relaxed, layered","Modern, eclectic","Contrasting colors, casual elegance"
3,Issey Miyake,Fall 2024,Feminine,"Blue draped cape, matching skirt",,"Voluminous, layered","Avant-garde, sculptural","Bold color choice, architectural design"
1,Issey Miyake,Fall 2024,Neutral,"Navy draped top, purple wide-leg pants",,"Flowing, asymmetrical","Avant-garde, artistic","Layered draping, bold color contrast"
2,Issey Miyake,Fall 2024,Neutral,"Black sheer turtleneck, white draped skirt",White draped fabric,"Voluminous, layered","Minimalist, elegant","Sheer layering, monochrome contrast"
3,Issey Miyake,Fall 2024,Neutral,"Navy oversized coat, black turtleneck, navy wide-leg pants",,"Oversized, structured","Modern, sophisticated","Monochrome layering, exaggerated proportions"
1,Issey Miyake,Fall 2021,Feminine,Black smocked dress,Statement earrings,"Loose, flowing","Minimalist, elegant","Textured fabric, monochrome"
2,Issey Miyake,Fall 2021,Feminine,"Gray pleated coat, black turtleneck, gray pants",,"Structured, voluminous","Architectural, modern","Innovative pleating, layered look"
3,Issey Miyake,Fall 2021,Feminine,"Rust pleated tunic, matching pants",Wide-brim hat,"Flowing, asymmetrical","Textured, earthy","Dynamic pleats, warm tones"
1,Issey Miyake,Fall 2021,Neutral,"Black textured top, black textured skirt",,"Flowing, sculptural","Monochrome, pleated",Emphasis on texture and form
2,Issey Miyake,Fall 2021,Neutral,"White printed oversized shirt, white printed pants",,"Loose, relaxed","Artistic, contemporary","Abstract print, fluid silhouette"
3,Issey Miyake,Fall 2021,Neutral,"White printed belted coat, white printed pants",,"Tailored, relaxed","Artistic, modern","Abstract print, belted waist"
1,Issey Miyake,Fall 2021,Neutral,"Brown belted coat, beige draped pants",Brown suede boots,"Relaxed, draped","Cozy, layered","Textured fabric, earthy tones"
2,Issey Miyake,Fall 2021,Neutral,"Dark brown long coat, patterned pants",Brown suede boots,"Oversized, structured","Minimalist, classic","Contrasting textures, muted palette"
3,Issey Miyake,Fall 2021,Neutral,"Gray oversized coat, black turtleneck",Black boots,"Voluminous, enveloping","Chic, modern","Soft textures, monochrome look"
1,Issey Miyake,Fall 2017,Feminine,"Striped oversized coat, matching trousers",,"Relaxed, layered","Textured, geometric","Rich color palette, draped layers"
2,Issey Miyake,Fall 2017,Feminine,"Striped dress, leggings",,"Loose, straight","Textured, geometric","Asymmetrical pattern, minimal accessories"
3,Issey Miyake,Fall 2017,Feminine,"Hooded top, layered skirt, leggings",,"Relaxed, layered","Textured, geometric","Contrasting hood lining, casual elegance"
1,Issey Miyake,Fall 2017,Feminine,"Burgundy coat, brown blouse, striped trousers",,"Oversized, relaxed","Layered, textured","Rich color palette, draped outerwear"
2,Issey Miyake,Fall 2017,Feminine,"Purple hooded tunic, matching trousers",,"Loose, comfortable","Sporty, casual","Contrasting inner lining, hooded design"
3,Issey Miyake,Fall 2017,Feminine,"Blue double-breasted coat, striped trousers",Gloves,"Voluminous, structured","Chic, modern","Contrasting colors, layered hood"
1,Issey Miyake,Fall 2017,Feminine,"Patterned oversized dress, leggings",Headband,"Loose, relaxed","Geometric, casual","Color-blocked pattern, comfortable fit"
2,Issey Miyake,Fall 2017,Feminine,"Patterned coat, matching pants",,"Structured, tailored","Geometric, coordinated","Color-blocked pattern, matching set"
3,Issey Miyake,Fall 2017,Feminine,"Blue belted cape, pants",Hood,"Dramatic, voluminous","Bold, statement","Rich color, oversized cape with hood"
1,Issey Miyake,Spring 2016,Feminine,"Fringed poncho, black shorts","Colorful platform sandals, tassel earrings","Relaxed, layered","Playful, vibrant","Bold color blocking, fringe details"
2,Issey Miyake,Spring 2016,Feminine,"Fringed sleeveless top, fringed skirt",Colorful platform sandals,"Straight, layered","Eclectic, textured","Contrasting textures, fringe accents"
3,Issey Miyake,Spring 2016,Feminine,Fringed sleeveless dress,"Colorful platform sandals, tassel earrings","Straight, fitted","Dynamic, colorful","Fringe embellishments, bold stripes"
1,Issey Miyake,Spring 2016,Feminine,"Color-block sleeveless top, fringed wrap skirt",,"A-line, relaxed","Colorful, playful",Bold color blocking with fringe details
2,Issey Miyake,Spring 2016,Feminine,"Color-block top, fringed plaid skirt",Fringed necklace,"Straight, fitted","Eclectic, vibrant",Mix of textures and colors with a statement necklace
3,Issey Miyake,Spring 2016,Feminine,Fringed plaid dress,"Wide-brimmed hat, fringed earrings","Straight, relaxed","Textured, natural",Natural tones with fringe accents and a matching hat
1,Issey Miyake,Spring 2016,Feminine,"Color-blocked shirt, patchwork skirt",Platform sandals,"Asymmetrical, fitted","Eclectic, vibrant","Fringe details, bold color blocking"
2,Issey Miyake,Spring 2016,Feminine,"Orange top, wide-leg pants",Platform sandals,"Relaxed, flowing","Casual, colorful","Contrasting textures, playful layering"
3,Issey Miyake,Spring 2016,Feminine,Pink and yellow sleeveless dress,Purple sandals,"Straight, loose","Bold, youthful","Color blocking, minimalistic design"
1,Issey Miyake,Spring 2014,Feminine,"White oversized coat, white cropped pants",White sandals,"Oversized, structured","Minimalist, modern","Perforated details, monochrome"
2,Issey Miyake,Spring 2014,Feminine,"White structured jacket, white skirt",White sandals,"Structured, tailored","Minimalist, modern","Perforated details, monochrome"
3,Issey Miyake,Spring 2014,Feminine,"White blouse, white wrap skirt",White sandals,"Flowy, asymmetrical","Minimalist, modern","Perforated details, monochrome"
1,Issey Miyake,Spring 2014,Feminine,"White blouse, black asymmetrical skirt",Black sandals,"A-line, structured","Minimalist, modern",Subtle perforated details on skirt
2,Issey Miyake,Spring 2014,Feminine,"Black structured jacket, black cropped pants",Black sandals,"Boxy, relaxed","Futuristic, edgy",Contrasting stitching on jacket
3,Issey Miyake,Spring 2014,Feminine,"Black draped top, black asymmetrical skirt","Black sandals, black bracelet","Draped, angular","Avant-garde, sleek",Textured fabric with perforated details
1,Issey Miyake,Spring 2014,Feminine,"Blue satin coat, white cropped pants",White sandals,"Boxy, oversized","Futuristic, sleek",Bold color contrast
2,Issey Miyake,Spring 2014,Feminine,"White sheer top, metallic silver skirt","White sandals, silver bracelet","Fitted, structured","Modern, minimal","Metallic sheen, asymmetrical skirt"
3,Issey Miyake,Spring 2014,Feminine,White coat dress,White sandals,"A-line, tailored","Clean, crisp","Monochrome, minimalist design"
