Look Number,Designer,Season,Gender Presentation,Garments,Accessories,Silhouette,Style Keywords,Notes
1,Issey Miyake,Fall 2024,Feminine,Blue ribbed knit dress,"Green and blue knit hat, matching scarf","Fitted, flowing","Textured, layered","Playful color blocking, elongated sleeves"
2,Issey Miyake,Fall 2024,Feminine,White ribbed knit dress,"Purple and white knit hat, matching scarf","Fitted, flowing","Textured, layered","Soft color palette, elongated sleeves"
3,Issey Miyake,Fall 2024,Feminine,Dark blue ribbed knit dress,"Matching knit hat, scarf","Fitted, flowing","Textured, layered","Monochrome look, elongated sleeves"
1,Issey Miyake,Fall 2024,Feminine,"Navy draped cape, matching skirt",None,"Voluminous, layered","Avant-garde, sculptural","Innovative use of fabric, dramatic draping"
2,Issey Miyake,Fall 2024,Feminine,"Black turtleneck, purple layered skirt",None,"Relaxed, layered","Modern, eclectic","Contrasting colors, casual elegance"
3,Issey Miyake,Fall 2024,Feminine,"Blue draped cape, matching skirt",None,"Voluminous, layered","Avant-garde, sculptural","Bold color choice, architectural design"
1,Issey Miyake,Fall 2024,Neutral,"Navy draped top, purple wide-leg pants",None,"Flowing, asymmetrical","Avant-garde, artistic","Layered draping, bold color contrast"
2,Issey Miyake,Fall 2024,Neutral,"Black sheer turtleneck, white draped skirt",White draped fabric,"Voluminous, layered","Minimalist, elegant","Sheer layering, monochrome contrast"
3,Issey Miyake,Fall 2024,Neutral,"Navy oversized coat, black turtleneck, navy wide-leg pants",None,"Oversized, structured","Modern, sophisticated","Monochrome layering, exaggerated proportions"
