Look Number,Designer,Season,Gender Presentation,Garments,Accessories,Silhouette,Style Keywords,Notes
1,J. Mendel,Fall 2009,Feminine,"White fur vest, black top, black pants",Black gloves,"Slim, elongated","Chic, elegant",Contrasting textures with fur and fabric
2,J. Mendel,Fall 2009,Feminine,"Black leather jacket, black top, black pants",Black gloves,"Slim, tailored","Sophisticated, sleek",Monochrome look with leather detailing
3,J. Mendel,Fall 2009,Feminine,"Black textured jacket, black top, black pants",Black gloves,"Slim, fitted","Modern, minimal",Textured jacket adds depth to monochrome outfit
1,J. Mendel,Fall 2009,Feminine,"Fur jacket, black pants",Black gloves,"Fitted, sleek","Elegant, luxurious","Dark palette, texture contrast"
2,J. Mendel,Fall 2009,Feminine,"Fur jacket, black pants",Black gloves,"Fitted, sleek","Elegant, luxurious","Dark palette, texture contrast"
3,J. Mendel,Fall 2009,Feminine,"Fur cape, black pants",Black gloves,"Fitted, sleek","Elegant, luxurious","Dark palette, texture contrast"
1,J. Mendel,Fall 2009,Feminine,"Black textured coat, leggings",Black gloves,"Structured, tailored","Elegant, sophisticated","High collar, sleek lines"
2,J. Mendel,Fall 2009,Feminine,"Black fur coat, leggings",Black gloves,"Structured, tailored","Luxurious, chic","Fur texture, leather accents"
3,J. Mendel,Fall 2009,Feminine,"Gray tweed coat, leggings",Black gloves,"Structured, tailored","Classic, refined","Contrast trim, high collar"
