Look Number,Designer,Season,Gender Presentation,Garments,Accessories,Silhouette,Style Keywords,Notes
1,Jaeger London,Fall 2011,Feminine,"Black oversized coat, mustard sweater, gray trousers",Green open-toe heels,"Relaxed, oversized","Chic, contemporary","Contrasting textures, muted palette"
2,Jaeger London,Fall 2011,Feminine,Orange coat dress,"Yellow knee-high boots, brown belt","Tailored, structured","Bold, modern","Monochrome look, statement color"
3,Jaeger London,Fall 2011,Feminine,"Yellow double-breasted jacket, olive sweater, black cropped trousers","Brown clutch, green ankle-strap heels","Boxy, relaxed","Eclectic, layered","Playful color mix, casual elegance"
1,Jaeger London,Fall 2011,Feminine,Black midi dress with sheer sleeves,"Black headband, brown clutch, orange tights, yellow sandals",A-line,"Chic, modern",Contrasting bright accessories
2,Jaeger London,Fall 2011,Feminine,"Olive green top, red skirt","Brown belt, white clutch, brown boots",Fit and flare,"Bold, contemporary","Deep neckline, color-blocking"
3,Jaeger London,Fall 2011,Feminine,"Black dress, oversized shearling coat","Black tights, beige shoes","Layered, voluminous","Luxurious, dramatic","Statement outerwear, textured contrast"
1,Jaeger London,Fall 2011,Feminine,"Orange sleeveless coat, sheer brown blouse, brown skirt",Brown belt,A-line,"Chic, layered",Bold color contrast with orange and brown
2,Jaeger London,Fall 2011,Feminine,"Mustard double-breasted coat, orange turtleneck","Red gloves, brown and green shoes",Structured,"Classic, retro",Warm color palette with layered textures
3,Jaeger London,Fall 2011,Feminine,"White coat with black lapels, yellow top, brown trousers",Blue and orange shoes,Relaxed,"Modern, eclectic",Contrasting lapels with a mix of relaxed and structured elements
1,Jaeger London,Spring 2011,Feminine,"White coat with black trim, white blouse, white textured pants","Brown belt, black open-toe shoes","Long, tailored","Chic, monochrome","Crisp lines, contrasting trim"
2,Jaeger London,Spring 2011,Feminine,"White textured tunic, gold mini skirt","Sunglasses, white platform sandals","A-line, relaxed","Minimalist, modern","Textured fabric, asymmetrical line"
3,Jaeger London,Spring 2011,Feminine,"White blazer with black trim, black crochet top","Black handbag, black loafers","Tailored, sleek","Sophisticated, monochrome","Bold contrast, structured blazer"
1,Jaeger London,Spring 2011,Feminine,"Black open-knit cardigan, beige tank top, black skirt","Sunglasses, gold necklace","Relaxed, layered","Chic, casual",Textured layering with oversized sunglasses
2,Jaeger London,Spring 2011,Feminine,"Black and white sleeveless blazer, white top, light gray pants",Black bracelet,"Tailored, sleek","Modern, sophisticated",Asymmetrical blazer design
3,Jaeger London,Spring 2011,Feminine,Black sleeveless tunic dress,"Sunglasses, beige bag","A-line, loose","Minimalist, edgy",Monochrome look with oversized bag
1,Jaeger London,Spring 2011,Feminine,"Metallic top, cropped jacket, black pants",Brown belt,"Slim, structured","Chic, modern","Metallic sheen, casual elegance"
2,Jaeger London,Spring 2011,Feminine,"Beige hooded jacket, black shorts",Sunglasses,"Relaxed, oversized","Sporty, urban","Hood detail, casual layering"
3,Jaeger London,Spring 2011,Feminine,Sleeveless dress,"Crossbody bag, thin belt","Fitted, sleek","Minimalist, elegant","Subtle shimmer, clean lines"
