Look Number,Designer,Season,Gender Presentation,Garments,Accessories,Silhouette,Style Keywords,Notes
1,KTZ,Fall 2014,Feminine,"Black and white embroidered top, sheer overlay, striped leggings",Silver earrings,"Voluminous, layered","Graphic, bold","Intricate patterns, strong contrast"
2,KTZ,Fall 2014,Feminine,"Black and white embroidered tunic, striped leggings",Silver earrings,"Loose, oversized","Graphic, bold","Asymmetrical hem, monochrome"
3,KTZ,Fall 2014,Feminine,"Embroidered poncho, shiny black pants","Gold statement necklace, gold earrings","Boxy, relaxed","Graphic, bold","Metallic accents, intricate detailing"
1,KTZ,Fall 2014,Feminine,"Black puffer jacket, black and white fringe skirt, black lace top","Gold statement necklace, gold cuffs, black gloves","Layered, voluminous","Avant-garde, tribal","Bold textures, intricate patterns"
2,KTZ,Fall 2014,Feminine,"Black and white fringe top, black embellished skirt","Gold hoop earrings, gold cuffs, black gloves","A-line, dramatic","Eclectic, tribal","Textured layers, geometric patterns"
3,KTZ,Fall 2014,Feminine,"Black and white patterned coat, black leather leggings","Black clutch, black and white sneakers","Oversized, structured","Graphic, monochrome","Bold prints, layered outerwear"
1,KTZ,Fall 2014,Feminine,"Geometric patterned hooded cape, black leather top, metallic leggings","Black gloves, black boots","Layered, elongated","Futuristic, tribal","Intricate patterns, metallic accents"
2,KTZ,Fall 2014,Feminine,"Embellished bomber jacket, pleated skirt, black turtleneck","Black gloves, statement earrings, black boots","Structured, layered","Urban, edgy","Bold embellishments, monochrome"
3,KTZ,Fall 2014,Feminine,"Embellished bomber jacket, full skirt, black leggings","Metallic gloves, statement earrings, black boots","Voluminous, structured","Gothic, avant-garde","Contrasting textures, detailed embroidery"
