Look Number,Designer,Season,Gender Presentation,Garments,Accessories,Silhouette,Style Keywords,Notes
1,Malo,Fall 2008,Feminine,"White structured dress, gray leggings","Beige cap, long beige gloves","Fitted, structured","Futuristic, sleek","Monochrome palette, strong shoulders"
2,Malo,Fall 2008,Feminine,"White fur vest, beige skirt, gray leggings",Gray cap,"Layered, voluminous","Luxurious, cozy","Textured layers, neutral tones"
3,Malo,Fall 2008,Feminine,"White embellished vest, white skirt, gray leggings",White ankle boots,"A-line, layered","Elegant, embellished","Intricate detailing, soft textures"
1,Malo,Fall 2008,Feminine,"Beige textured turtleneck sweater, beige skirt","Black cap, crossbody bag","A-line, fitted","Textured, chic","Circular patterns, monochrome look"
2,Malo,Fall 2008,Feminine,"White textured sweater, black and white patterned skirt",Long beige gloves,"Boxy, layered","Elegant, modern","Textured knit, contrasting patterns"
3,Malo,Fall 2008,Feminine,"White embellished cardigan, black skirt","Beige cap, long beige gloves","Structured, voluminous","Luxurious, sophisticated","Fur details, sequin embellishments"
1,Malo,Fall 2008,Feminine,"Patterned dress, black belt, tights","Black cap, long black gloves","A-line, layered","Chic, elegant","Intricate patterns, cinched waist"
2,Malo,Fall 2008,Feminine,"White oversized sweater, white skirt, gray tights",Beige gloves,"Voluminous, cocoon","Minimalist, modern","Textured knit, soft palette"
3,Malo,Fall 2008,Feminine,"White fur coat, beige tights",Black strap bag,"Boxy, oversized","Luxurious, sophisticated","Fur texture, monochrome look"
