Look Number,Designer,Season,Gender Presentation,Garments,Accessories,Silhouette,Style Keywords,Notes
1,Maxhosa,Fall 2024,Feminine,Black and red patterned dress,"Blue fur collar, colorful beaded necklace, red fluffy shoes","Straight, relaxed","Cultural, vibrant","Geometric patterns, bold colors"
2,Maxhosa,Fall 2024,Feminine,Multicolored striped dress,"Yellow fur collar, brown fluffy shoes",A-line,"Eclectic, colorful","Button details, bold stripes"
3,Maxhosa,Fall 2024,Feminine,Blue and red patterned dress,"Red beaded clutch with black feathers, blue patterned tights, pink platform shoes",Fit and flare,"Playful, bold","Feather details, intricate patterns"
1,Maxhosa,Fall 2024,Gender Neutral,"Patterned sleeveless top, patterned skirt","Yellow pom-pom earrings, colorful socks, fluffy shoes","Layered, A-line","Eclectic, vibrant",Mix of patterns and textures
2,Maxhosa,Fall 2024,Masculine,"Rainbow patterned jacket, matching pants","Patterned handbag, orange shoes","Relaxed, oversized","Playful, bold",Bright colors and graphic prints
3,Maxhosa,Fall 2024,Feminine,"Patterned coat, pleated skirt","Patterned tote bag, platform sandals","Structured, flowing","Chic, geometric",Intricate patterns with a modern twist
1,Maxhosa,Fall 2024,Feminine,"Patterned top, velvet pants",None,"Relaxed, straight","Colorful, graphic",Bold geometric patterns
2,Maxhosa,Fall 2024,Feminine,Crochet dress,"Wide-brim hat, earrings","Fitted, flared","Textured, vibrant",Intricate crochet detailing
3,Maxhosa,Fall 2024,Feminine,"Patterned dress, leggings",Pom-pom shoes,A-line,"Eclectic, layered",Textured poncho with pom-pom trim
