Look Number,Designer,Season,Gender Presentation,Garments,Accessories,Silhouette,Style Keywords,Notes
1,Meadham Kirchhoff,Fall 2013,Feminine,"White coat with black patent details, black ruffled pants",Silver embellished shoes,"Structured, layered","Avant-garde, monochrome",Contrast of textures with patent leather
2,Meadham Kirchhoff,Fall 2013,Feminine,"White coat with black patent details, black ruffled shorts","Silver embellished shoes, black lace socks","Structured, layered","Avant-garde, monochrome",Mix of textures with lace and patent leather
3,Meadham Kirchhoff,Fall 2013,Feminine,"White coat with black patent details, black skirt","Silver embellished shoes, cream knit socks","Structured, layered","Avant-garde, monochrome",Nautical-inspired details with stripes
1,Meadham Kirchhoff,Fall 2013,Feminine,"White cropped jacket, black sequined bralette, black vinyl pants",Silver embellished shoes,"Relaxed, cropped","Edgy, monochrome","Contrast of textures, bold accessories"
2,Meadham Kirchhoff,Fall 2013,Feminine,"Black and white knitted jacket, white pleated dress","Silver embellished shoes, white tights","A-line, layered","Playful, vintage-inspired","Intricate knit patterns, soft silhouette"
3,Meadham Kirchhoff,Fall 2013,Feminine,"White double-breasted dress, black lace veil","Silver embellished shoes, white tights","Fitted, flared","Gothic, romantic","Veil adds drama, monochrome palette"
1,Meadham Kirchhoff,Fall 2013,Feminine,"Polka dot jacket, matching skirt, black shirt","Gold metallic shoes, knee-high socks","A-line, fitted","Eclectic, vintage-inspired","Textured fabrics, metallic accents"
2,Meadham Kirchhoff,Fall 2013,Feminine,"Patterned coat, black leggings",Gold metallic shoes,"Flared, layered","Gothic, baroque","Intricate patterns, bold silhouette"
3,Meadham Kirchhoff,Fall 2013,Feminine,Long coat with vinyl panel,Gold metallic shoes,"Straight, elongated","Avant-garde, futuristic","Contrasting textures, glossy finish"
