Look Number,Designer,Season,Gender Presentation,Garments,Accessories,Silhouette,Style Keywords,Notes
1,Nihl,Fall 2022,Masculine,"Beaded harness top, black leather pants",Studded belt,"Fitted, edgy","Avant-garde, bold","Exposed skin, metallic details"
2,Nihl,Fall 2022,Masculine,"White open shirt, red beaded harness, black leather shorts","Sunglasses, boots","Structured, daring","Punk, experimental","Layered harness, bold accessories"
3,Nihl,Fall 2022,Masculine,"Fringe top, oversized gray jacket, black pants","Sunglasses, necklace","Relaxed, layered","Eclectic, modern","Fringe details, oversized silhouette"
1,Nihl,Fall 2022,Androgynous,"White sheer dress, white pants","Red sunglasses, white belt","Flowy, layered","Futuristic, edgy","Sheer fabric, monochrome look"
2,Nihl,Fall 2022,Masculine,"Black cut-out top, khaki pants",Purple sunglasses,"Fitted, deconstructed","Avant-garde, bold","Cut-out details, asymmetrical design"
3,Nihl,Fall 2022,Feminine,"Green embellished top, black leather shorts","Tinted sunglasses, studded belt","Boxy, structured","Eclectic, retro","Textured embellishments, vibrant color"
1,Nihl,Fall 2022,Masculine,"Black cut-out bodysuit, black pants",Tinted sunglasses,"Fitted, sleek","Edgy, avant-garde",Chunky black boots
2,Nihl,Fall 2022,Feminine,"Sheer top, white shorts, thigh-high boots",None,"Layered, deconstructed","Experimental, bold",Contrasting textures
3,Nihl,Fall 2022,Masculine,"Sheer harness top, gray pants",Beaded chain belt,"Loose, structured","Artistic, unconventional",Subtle color accents
