Look Number,Designer,Season,Gender Presentation,Garments,Accessories,Silhouette,Style Keywords,Notes
1,Preen Line,Fall 2014,Feminine,"Red pleated dress, red sleeveless blouse",Black ankle boots,"Flowy, layered","Bold, monochrome","Ruffled details, vibrant color"
2,Preen Line,Fall 2014,Feminine,"Red and black patterned blouse, black quilted skirt",Fishnet tights,A-line,"Edgy, patterned","Mix of textures, bold print"
3,Preen Line,Fall 2014,Feminine,"Black dress, leopard print coat with colored cuffs",Black boots,"Layered, voluminous","Chic, eclectic","Animal print, color accents"
1,Preen Line,Fall 2014,Feminine,Green plaid dress,Black boots,"Fitted bodice, A-line skirt","Plaid, classic","Button-down front, long sleeves"
2,Preen Line,Fall 2014,Feminine,"Black sleeveless top, green leopard print skirt, black fur coat",None visible,"Layered, voluminous","Eclectic, bold","Mix of textures, animal print"
3,Preen Line,Fall 2014,Feminine,"Black sheer blouse, black patchwork pants",Black shoes,"Slim, fitted","Sheer, edgy","Patchwork details, monochrome look"
1,Preen Line,Fall 2014,Feminine,"Leopard print fur coat, orange top, black leather pants",None,"Relaxed, oversized","Eclectic, bold",Mix of textures and prints
2,Preen Line,Fall 2014,Feminine,"Black leather jacket with fur collar, blue and black checkered dress",Black knee-high boots,"Layered, voluminous","Edgy, modern",Contrasting textures
3,Preen Line,Fall 2014,Feminine,"Green and black checkered jacket, matching skirt",Black knee-high boots,"A-line, structured","Punk, statement",Embroidered text on back of jacket
