Look Number,Designer,Season,Gender Presentation,Garments,Accessories,Silhouette,Style Keywords,Notes
1,Reem Acra,Spring 2011,Feminine,"Embellished top, high-waisted wide-leg trousers","Chain necklace, belt","Wide-leg, structured","Elegant, sophisticated","Intricate embellishments, tailored trousers"
2,Reem Acra,Spring 2011,Feminine,Strapless embellished gown,"Bracelet, belt","Fitted, floor-length","Glamorous, art deco","Geometric patterns, metallic accents"
3,Reem Acra,Spring 2011,Feminine,Plunging neckline gown,"Bracelet, belt","Flowy, A-line","Romantic, ethereal","Soft pleats, deep neckline"
1,Reem Acra,Spring 2011,Feminine,Sequined gown,Choker necklace,"Fitted, flowing","Glamorous, elegant","Intricate sequin pattern, deep neckline"
2,Reem Acra,Spring 2011,Feminine,White pleated gown,Layered necklaces with turquoise pendant,"Flowing, empire waist","Bohemian, ethereal","Statement necklace, soft pleats"
3,Reem Acra,Spring 2011,Feminine,"White tank top, high-waisted trousers","Gold belt, pendant necklace","Tailored, wide-leg","Chic, minimal","Bold belt, clean lines"
1,Reem Acra,Spring 2011,Feminine,"Metallic top, cream skirt","Layered necklaces, brown belt",A-line,"Elegant, sophisticated",Textured top with statement necklaces
2,Reem Acra,Spring 2011,Feminine,Metallic sleeveless gown,"Layered necklaces, brown belt",Flowy,"Glamorous, chic",Long gown with intricate patterns
3,Reem Acra,Spring 2011,Feminine,"Multicolored blouse, sheer striped skirt","Green pendant necklace, brown belt",Flowy,"Bohemian, vibrant",Colorful print with sheer elements
