Look Number,Designer,Season,Gender Presentation,Garments,Accessories,Silhouette,Style Keywords,Notes
1,Richard Chai,Spring 2008,Feminine,"Light gray coat, ruched dress",Black pointed heels,"Flowy, elongated","Minimalist, elegant",Monochrome layering
2,Richard Chai,Spring 2008,Feminine,"Ruched top, loose pants",Black pointed heels,"Relaxed, fluid","Casual, chic",Soft draping
3,Richard Chai,Spring 2008,Feminine,"White blazer, tailored shorts, shirt",Metallic heels,"Structured, tailored","Modern, sophisticated","Crisp lines, monochrome"
1,Richard Chai,Spring 2008,Feminine,"Cream blazer, satin dress",Black heels,"Tailored, elongated","Minimalist, chic",Monochrome look with satin texture
2,Richard Chai,Spring 2008,Feminine,White satin dress,Black heels,"A-line, flowing","Elegant, simple",High neckline with subtle sheen
3,Richard Chai,Spring 2008,Feminine,"Light blue parka, white maxi skirt",,"Relaxed, layered","Casual, sophisticated",Contrast of structured parka with flowing skirt
1,Richard Chai,Ready-to-Wear Fall 2009,Feminine,"Black leather jacket, olive draped pants","Black gloves, black ankle boots","Structured top, loose pants","Edgy, modern","Strong shoulders, contrasting textures"
2,Richard Chai,Ready-to-Wear Fall 2009,Feminine,Sheer black draped dress,Lace-up ankle boots,"Flowy, draped","Romantic, elegant","Sheer layers, soft draping"
3,Richard Chai,Ready-to-Wear Fall 2009,Feminine,"Black textured sweater, gray leather pants",Lace-up ankle boots,"Relaxed, layered","Casual, chic","Asymmetrical zip, mixed materials"
1,Richard Chai,Fall 2007,Feminine,"Black belted jacket, navy pants","Gray gloves, black heels","Structured, tailored","Chic, sophisticated",Textured jacket with cinched waist
2,Richard Chai,Fall 2007,Feminine,"Black and red top, gray high-waisted pants","Gray gloves, black patent boots","Fitted, sleek","Modern, edgy",Color-blocked top with high-waisted silhouette
3,Richard Chai,Fall 2007,Feminine,Teal double-breasted coat,"Gray belt, red heels","A-line, voluminous","Classic, elegant",Coat with flared sleeves and contrasting belt
1,Richard Chai,Fall 2007,Feminine,"Black satin dress, sheer shoulder panels",Blue belt,"Fitted, knee-length","Elegant, modern","Sheer details, cinched waist"
2,Richard Chai,Fall 2007,Feminine,Striped coat,"Black scarf, brown belt","Tailored, structured","Chic, sophisticated","Layered textures, high boots"
3,Richard Chai,Fall 2007,Feminine,"Gray peacoat, red satin skirt","Brown gloves, brown belt","Boxy top, fitted skirt","Classic, polished","Contrasting textures, muted palette"
1,Richard Chai,Fall 2007,Feminine,"Double-breasted jacket, tailored pants","Gray gloves, red heels","Structured, tailored","Chic, modern","Puffed sleeves, sleek lines"
2,Richard Chai,Fall 2007,Feminine,"Satin dress with belt, short-sleeve bolero","Black tights, black heels","Fitted, layered","Elegant, sophisticated",Contrast fabric detailing
3,Richard Chai,Fall 2007,Feminine,"Embellished blouse, high-waisted skirt","Gray gloves, red heels","Classic, cinched waist","Refined, polished",Floral embellishments on blouse
1,Richard Chai,Spring 2007,Feminine,"Light gray blazer, white shirt, light blue trousers",None,"Tailored, relaxed","Chic, casual","Hands in pockets, minimal accessories"
2,Richard Chai,Spring 2007,Feminine,White oversized shirt dress,None,"Loose, flowing","Minimalist, clean","Rolled sleeves, simple elegance"
3,Richard Chai,Spring 2007,Feminine,"Light gray trench coat, white blouse",None,"Structured, fitted","Sophisticated, modern","Layered look, sharp collar"
1,Richard Chai,Spring 2007,Feminine,Light blue satin dress,None,"Loose, draped","Elegant, soft","Gathered neckline, subtle sheen"
2,Richard Chai,Spring 2007,Feminine,"White blouse, cream wide-leg trousers",None,"Relaxed, flowing","Minimalist, crisp","Structured collar, clean lines"
3,Richard Chai,Spring 2007,Feminine,"Light blue coat, white shirt, cream shorts",None,"Tailored, layered","Chic, modern","Oversized collar, casual elegance"
1,Richard Chai,Spring 2007,Feminine,Lilac satin dress,White sandals,"A-line, flowing","Elegant, soft",Delicate pleating on bodice
2,Richard Chai,Spring 2007,Feminine,"Lilac jacket, white blouse, light blue pants",White sandals,"Relaxed, casual","Chic, understated",Large collar on jacket
3,Richard Chai,Spring 2007,Feminine,"Black leather jacket, striped blouse, beige shorts",White sandals,"Boxy, casual","Edgy, modern",Contrasting textures with leather and cotton
