Look Number,Designer,Season,Gender Presentation,Garments,Accessories,Silhouette,Style Keywords,Notes
1,Samuji,Spring 2015,Feminine,Sleeveless printed dress,"Wide-brimmed black hat, tan sandals",A-line,"Playful, graphic","Bold print, minimal accessories"
2,Samuji,Spring 2015,Feminine,Pink printed midi dress,Tan sandals,A-line,"Elegant, graphic","Soft color palette, bold print"
3,Samuji,Spring 2015,Feminine,Short-sleeve printed dress,Tan sandals,A-line,"Casual, graphic","Consistent print, relaxed fit"
1,Samuji,Spring 2015,Feminine,"Pink printed blouse, navy printed skirt",Brown sandals,A-line,"Playful, artistic","Matching prints, casual elegance"
2,Samuji,Spring 2015,Feminine,"White knit top, teal printed wide-leg pants",Black sandals,Relaxed,"Minimalist, bold","Contrast of textures, vibrant print"
3,Samuji,Spring 2015,Feminine,Peach printed dress,Black sandals,Fit and flare,"Chic, graphic","Deep V-neck, striking pattern"
1,Samuji,Spring 2015,Feminine,"Printed strapless top, printed skirt",Black sandals,A-line,"Playful, vibrant","Bold print, coordinated set"
2,Samuji,Spring 2015,Feminine,White shift dress,Black sandals,Straight,"Minimalist, clean","Simple design, subtle texture"
3,Samuji,Spring 2015,Feminine,White gathered waist dress,Black sandals,Relaxed,"Minimalist, effortless","Soft silhouette, understated elegance"
