Look Number,Designer,Season,Gender Presentation,Garments,Accessories,Silhouette,Style Keywords,Notes
1,Sari Gueron,Fall 2007,Feminine,"Gray coat, gray turtleneck, black skirt",,"Layered, structured","Minimalist, modern","Monochrome palette, tailored layers"
2,Sari Gueron,Fall 2007,Feminine,Dark gray dress,,"A-line, fitted","Chic, understated","Hood detail, sleek lines"
3,Sari Gueron,Fall 2007,Feminine,"Gray blazer, black turtleneck, black skirt",,"Tailored, classic","Sophisticated, elegant","Monochrome look, structured tailoring"
1,Sari Gueron,Fall 2007,Feminine,"Gray short-sleeve dress, black leggings",,"A-line, relaxed","Minimalist, elegant",Pleated neckline detail
2,Sari Gueron,Fall 2007,Feminine,"Gray wrap cape, black turtleneck, olive wide-leg pants",,"Oversized, layered","Chic, cozy",Asymmetrical cape draping
3,Sari Gueron,Fall 2007,Feminine,"White sleeveless blouse with embellishments, black trousers",,"Tailored, straight","Sophisticated, modern","Embellished neckline, hands in pockets"
1,Sari Gueron,Fall 2007,Feminine,"Black sleeveless dress, knee-high boots",,"Fitted bodice, A-line skirt","Chic, elegant","Deep V-neckline, minimalist"
2,Sari Gueron,Fall 2007,Feminine,"White dress with black embellishments, knee-high boots",Black belt,"Straight, slightly loose","Sophisticated, detailed",Embellished neckline and cuffs
3,Sari Gueron,Fall 2007,Feminine,"Beige dress, cream cardigan, knee-high boots",,"Relaxed, layered","Casual, cozy","Chunky knit cardigan, neutral tones"
1,Sari Gueron,Spring 2007,Feminine,White sleeveless mini dress,None,"A-line, flowy","Delicate, airy",Floral detail on shoulder
2,Sari Gueron,Spring 2007,Feminine,White sleeveless maxi dress,None,"Flowy, voluminous","Romantic, ethereal","Ruffled hem, high neck"
3,Sari Gueron,Spring 2007,Feminine,"Black sleeveless top, white shorts",None,"Relaxed, casual","Chic, minimal",Contrasting colors
1,Sari Gueron,Spring 2007,Feminine,Sheer maxi dress,None,"Flowy, ethereal","Bohemian, romantic","Layered sheer fabric, subtle stripes"
2,Sari Gueron,Spring 2007,Feminine,"Sheer shirt dress, mini skirt",None,"Relaxed, casual","Bohemian, relaxed","Sheer layered look, soft colors"
3,Sari Gueron,Spring 2007,Feminine,Sheer mini dress,None,"Straight, relaxed","Minimalist, airy","Sheer fabric, subtle stripes"
1,Sari Gueron,Spring 2007,Feminine,Black maxi dress,None,"Flowy, relaxed","Minimalist, elegant","Keyhole neckline, cap sleeves"
2,Sari Gueron,Spring 2007,Feminine,Printed maxi dress,None,"Loose, flowing","Bohemian, natural","Floral pattern, short sleeves"
3,Sari Gueron,Spring 2007,Feminine,Yellow printed maxi dress,None,"Soft, draped","Romantic, airy","Empire waist, spaghetti straps"
