Look Number,Designer,Season,Gender Presentation,Garments,Accessories,Silhouette,Style Keywords,Notes
1,Self-Portrait,Fall 2024,Feminine,"Denim jacket, herringbone skirt","White handbag, black belt","Structured, tailored","Casual chic, modern","Contrast collar, textured skirt"
2,Self-Portrait,Fall 2024,Feminine,"Denim jacket, denim skirt","Red handbag, black belt","A-line, coordinated","Denim on denim, bold","Matching set, statement bag"
3,Self-Portrait,Fall 2024,Feminine,"Black textured jacket, polka dot blouse, denim skirt",Black heels,"A-line, layered","Sophisticated, classic","Textured layers, elegant blouse"
1,Self-Portrait,Fall 2024,Feminine,"Tweed coat, navy hoodie, denim skirt","Red handbag, statement earrings","Structured, layered","Casual, chic","Bow patterns on skirt, contrast textures"
2,Self-Portrait,Fall 2024,Feminine,"Navy jacket, matching skirt",Red handbag,"Tailored, sleek","Sophisticated, elegant",Subtle embellishments on pockets
3,Self-Portrait,Fall 2024,Feminine,"Navy hoodie, polka dot blouse, herringbone skirt",Black handbag,"Layered, classic","Smart, polished","Mix of patterns, bow detail on blouse"
1,Self-Portrait,Fall 2024,Feminine,"Denim cropped jacket, high-waisted denim skirt","White handbag, statement earrings","Fitted, structured","Denim, modern",Asymmetrical jacket cut
2,Self-Portrait,Fall 2024,Feminine,Denim jacket,Statement earrings,Fitted,"Denim, bold","Focus on large, intricate earrings"
3,Self-Portrait,Fall 2024,Feminine,"Navy zip-up hoodie, printed wide-leg jeans","Red handbag, statement earrings","Relaxed, oversized","Casual, chic",Playful bow print on jeans
