Look Number,Designer,Season,Gender Presentation,Garments,Accessories,Silhouette,Style Keywords,Notes
1,Simone Rocha,Fall 2023,Feminine,"Black coat, gold skirt, nude top","Red ribbons, embellished socks, gold shoes","Layered, A-line","Eclectic, romantic","Mix of textures, bold accessories"
2,Simone Rocha,Fall 2023,Feminine,Gold textured dress,"Embellished socks, black platform shoes","Voluminous, structured","Opulent, baroque","Rich textures, metallic sheen"
3,Simone Rocha,Fall 2023,Masculine,"Black textured coat, black leather pants",None,"Oversized, relaxed","Modern, edgy","Textural contrast, monochrome palette"
1,Simone Rocha,Fall 2023,Feminine,Gold metallic dress with puff sleeves,"Gold shoes, embellished socks","A-line, voluminous","Opulent, textured","Intricate detailing, metallic sheen"
2,Simone Rocha,Fall 2023,Feminine,"Gold metallic coat with puff sleeves, matching skirt","Nude platform shoes, embellished socks","Structured, layered","Luxurious, bold","Coordinated set, statement sleeves"
3,Simone Rocha,Fall 2023,Feminine,"Black textured crop top, matching skirt","Black lace-up shoes, long gloves","Fitted, layered","Gothic, intricate","Dark palette, elaborate textures"
1,Simone Rocha,Fall 2023,Masculine,"Black textured coat, white shirt, leather skirt",Black boots,"Structured, elongated","Classic, elegant","Textured fabric, monochrome palette"
2,Simone Rocha,Fall 2023,Feminine,"Brown leather coat, red tie, black skirt","Knee-high socks, platform shoes","Oversized, layered","Edgy, modern","Embellished details, contrast tie"
3,Simone Rocha,Fall 2023,Feminine,"Black textured top, matching pants","Textured bag, gloves","Fitted, streamlined","Chic, sophisticated","Textured fabric, subtle embellishments"
