Look Number,Designer,Season,Gender Presentation,Garments,Accessories,Silhouette,Style Keywords,Notes
1,Susan Fang,Spring 2023,Feminine,Ruffled off-shoulder dress,Transparent statement necklace,"A-line, voluminous","Ethereal, romantic","Layered ruffles, sheer fabric"
2,Susan Fang,Spring 2023,Feminine,Spaghetti strap ruffled dress,Floral earrings,"A-line, flowing","Pastel, delicate","Sheer layers, soft colors"
3,Susan Fang,Spring 2023,Feminine,"Ruffled crop top, layered shorts",White basket bag,"Structured, playful","Bold, eclectic","Contrasting textures, vibrant colors"
1,Susan Fang,Spring 2023,Feminine,"Blue floral crop top, tiered lace mini skirt","Clear floral choker, clear sandals","Fitted, playful","Whimsical, youthful","Cut-out details, ruffled textures"
2,Susan Fang,Spring 2023,Feminine,Pink woven dress with cut-outs,"Clear floral handbag, clear sandals","Sheer, form-fitting","Ethereal, intricate","Asymmetrical neckline, net-like texture"
3,Susan Fang,Spring 2023,Feminine,"Floral crop top, pastel ruffled skirt","Clear floral choker, clear sandals","Flowy, layered","Romantic, dreamy","Sheer fabric, soft pastel colors"
1,Susan Fang,Spring 2023,Feminine,"Floral ruffled top, ruffled shorts","Beaded body chain, floral earrings, small floral handbag, platform clogs","Playful, airy","Ethereal, whimsical","Delicate textures, pastel hues"
2,Susan Fang,Spring 2023,Feminine,Layered ruffled dress,Floral face embellishments,"Voluminous, flowing","Romantic, avant-garde","Textured layers, soft color palette"
3,Susan Fang,Spring 2023,Feminine,Off-shoulder ruffled dress,"Floral earrings, beaded sandals","Dramatic, structured","Bold, artistic","Contrasting textures, monochrome with floral details"
