Look Number,Designer,Season,Gender Presentation,Garments,Accessories,Silhouette,Style Keywords,Notes
1,Tao,Spring 2009,Feminine,"Black fitted top, black leggings",Silver shoes,"Slim, fitted","Avant-garde, dramatic","High hair, bold makeup"
2,Tao,Spring 2009,Feminine,"Black top, striped leggings, blue sheer jacket",Gold shoes,"Layered, eclectic","Playful, bold","Contrasting patterns, statement jacket"
3,Tao,Spring 2009,Feminine,"Striped shorts, blue structured top",Silver shoes,"Structured, playful","Eclectic, bold","Military-inspired top, high socks"
1,Tao,Spring 2009,Feminine,"Striped capri pants, black top, sheer sleeve jacket",Silver platform shoes,"Fitted top, cropped pants","Eclectic, nautical","Bold stripes, layered textures"
2,Tao,Spring 2009,Feminine,"Striped top, pleated cream skirt",White sneakers,A-line skirt,"Nautical, playful","Mix of stripes and pleats, button details"
3,Tao,Spring 2009,Feminine,"Striped top, pleated navy skirt",Black shoes,A-line skirt,"Nautical, modern","Layered stripes, structured pleats"
1,Tao,Spring 2009,Feminine,"Floral sheer blouse, beige shorts","Top hat, black tie, knee-high socks","Fitted, tailored","Eclectic, avant-garde","Playful floral patterns, bold makeup"
2,Tao,Spring 2009,Feminine,"Green floral blouse, beige cropped pants","Top hat, black tie, knee-high socks","Fitted, tailored","Eclectic, avant-garde","Vibrant green print, metallic shoes"
3,Tao,Spring 2009,Feminine,"Orange floral blouse, beige cropped pants","Top hat, black tie, knee-high socks","Fitted, tailored","Eclectic, avant-garde","Bold orange print, cohesive accessories"
1,Tao,Fall 2008,Feminine,Silver patterned dress,"Black headpiece, black gloves","Structured, voluminous","Avant-garde, dramatic","Bold print, statement headpiece"
2,Tao,Fall 2008,Feminine,"Silver patterned dress, textured shawl","Black headpiece, black gloves","Layered, textured","Eclectic, artistic","Mixed textures, layered look"
3,Tao,Fall 2008,Feminine,"Gold and black dress, black textured jacket",Black headpiece,"Structured, layered","Chic, sophisticated","Contrasting textures, elegant layering"
1,Tao,Fall 2008,Feminine,"Black textured dress, layered sleeves",Large black hat,"Structured, layered","Avant-garde, deconstructed","Frayed edges, dark palette"
2,Tao,Fall 2008,Feminine,"Black top, metallic textured skirt",Large black hat,"Layered, voluminous","Avant-garde, eclectic","Mixed textures, dark tones"
3,Tao,Fall 2008,Feminine,"Black top, metallic textured skirt",Large black hat,"Layered, voluminous","Avant-garde, eclectic","Textured layers, dark palette"
1,Tao,Fall 2008,Feminine,"Black top, black shorts, metallic jacket",Large feathered hat,"Structured, layered","Avant-garde, eclectic","Dramatic headpiece, textured layers"
2,Tao,Fall 2008,Feminine,"Black dress, gold metallic shawl",Feathered headpiece,"Straight, fitted","Elegant, bold","Contrasting textures, statement shawl"
3,Tao,Fall 2008,Feminine,Patchwork dress,None,"Loose, relaxed","Playful, colorful","Patchwork design, casual boots"
