Look Number,Designer,Season,Gender Presentation,Garments,Accessories,Silhouette,Style Keywords,Notes
1,Thakoon Addition,Fall 2014,Feminine,"Gray polka dot sweater, matching skirt, blue shirt",Black belt,"Fitted, layered","Playful, modern","Polka dot pattern, layered shirt detail"
2,Thakoon Addition,Fall 2014,Feminine,"Gray oversized cardigan, navy skirt",Brown ankle boots,"Relaxed, cozy","Casual, comfortable","Chunky knit, deep V-neck"
3,Thakoon Addition,Fall 2014,Feminine,"Cream cropped sweater, blue shirt, gray trousers",Brown ankle boots,"Layered, tailored","Chic, contemporary","Cropped knit, layered shirt"
1,Thakoon Addition,Fall 2014,Feminine,"Gray oversized vest, white shirt, black pants",None,"Voluminous, relaxed","Layered, casual","Drawstring waist, structured shoulders"
2,Thakoon Addition,Fall 2014,Feminine,"Navy knit sweater, gray and black mini skirt",Black belt,"Fitted, layered","Textured, modern","Chunky knit, asymmetrical skirt"
3,Thakoon Addition,Fall 2014,Feminine,"Pink textured sweater, gray trousers",Brown ankle boots,"Relaxed, tailored","Cozy, chic","Textured fabric, high-waisted trousers"
1,Thakoon Addition,Fall 2014,Feminine,"Black ribbed sweater, black mini skirt",Black ankle boots,"Slim, fitted","Minimalist, chic","Layered textures, monochrome"
2,Thakoon Addition,Fall 2014,Feminine,"Red patterned blouse, black textured cardigan, black trousers",Black ankle boots,"Relaxed, tailored","Eclectic, sophisticated","Mix of textures, bold print"
3,Thakoon Addition,Fall 2014,Feminine,"Black sweater, black flared skirt",Brown ankle boots,"A-line, flared","Elegant, modern","Subtle pattern, playful hemline"
