Look Number,Designer,Season,Gender Presentation,Garments,Accessories,Silhouette,Style Keywords,Notes
1,Threeasfour,Spring 2010,Feminine,White asymmetrical sheer dress,"Silver scissors, platform heels","Flowy, layered","Futuristic, ethereal","Diagonal stripes, sheer fabric"
2,Threeasfour,Spring 2010,Feminine,Black bodysuit with sheer panels,Platform heels,Form-fitting,"Modern, sleek","Geometric cutouts, sheer detailing"
3,Threeasfour,Spring 2010,Feminine,Black bodysuit with sheer panels,"Platform heels, wire shoulder accessory",Form-fitting,"Avant-garde, bold","Asymmetrical shoulder design, sheer elements"
1,Threeasfour,Spring 2010,Feminine,"Black blazer, sheer bandeau top, black leggings",Silver platform heels,"Fitted, sleek","Futuristic, edgy","Sheer panels, bold eye makeup"
2,Threeasfour,Spring 2010,Feminine,Black mini dress with sheer cutouts,Silver platform heels,Bodycon,"Modern, avant-garde","Asymmetrical design, sheer details"
3,Threeasfour,Spring 2010,Feminine,"Black asymmetrical jacket, black pants",Silver platform heels,"Structured, tailored","Minimalist, contemporary","Unique jacket design, monochrome look"
1,Threeasfour,Spring 2010,Feminine,"Black blazer, sheer leggings",Clear platform heels,"Fitted, sleek","Futuristic, bold","Sheer elements, structured shoulders"
2,Threeasfour,Spring 2010,Feminine,Sheer black dress with swirl details,Clear platform heels,"Fitted, flowing","Avant-garde, ethereal","Translucent fabric, intricate detailing"
3,Threeasfour,Spring 2010,Feminine,Sheer black dress with ruffle details,Clear platform heels,"Fitted, voluminous","Dramatic, textured","Layered ruffles, sheer overlay"
1,Threeasfour,Spring 2014,Feminine,"White lace mini dress, structured cape",White lace platform shoes,"Fitted, sculptural","Futuristic, avant-garde","Intricate lace patterns, exaggerated shoulders"
2,Threeasfour,Spring 2014,Feminine,"White lace mini dress, puff sleeves",White lace platform shoes,"Fitted, sculptural","Futuristic, avant-garde","Intricate lace patterns, structured silhouette"
3,Threeasfour,Spring 2014,Feminine,"White lace skirt, white jacket, lace top",White lace platform shoes,"Flowing, layered","Futuristic, avant-garde","Intricate lace patterns, layered textures"
1,Threeasfour,Spring 2014,Feminine,"White lace dress, lace leggings",Platform shoes,"A-line, fitted","Futuristic, intricate","Laser-cut patterns, geometric design"
2,Threeasfour,Spring 2014,Feminine,White lace gown,Platform shoes,"Column, flowing","Ethereal, geometric","Layered lace, hexagonal motifs"
3,Threeasfour,Spring 2014,Feminine,"White structured jacket, lace pants",Platform shoes,"Tailored, structured","Architectural, modern","Strong shoulders, intricate cutouts"
1,Threeasfour,Spring 2014,Feminine,"Black patterned sleeveless dress, lace leggings",Black platform shoes,"Flowy, asymmetrical","Geometric, avant-garde","Intricate patterns, layered textures"
2,Threeasfour,Spring 2014,Feminine,Black patterned sleeveless mini dress,Black platform shoes,"Fitted, short","Geometric, modern","Bold pattern, sleek silhouette"
3,Threeasfour,Spring 2014,Feminine,Black patterned halter dress,Black platform shoes,"Flowy, layered","Geometric, artistic","Contrasting textures, unique collar design"
