Look Number,Designer,Season,Gender Presentation,Garments,Accessories,Silhouette,Style Keywords,Notes
1,Todd Lynn,Fall 2008,Feminine,"White tailored blazer, white high-waisted trousers",None,"Structured, tailored","Minimalist, monochrome","Deep V neckline, sharp shoulders"
2,Todd Lynn,Fall 2008,Feminine,"Black fitted blazer, black pencil skirt",None,"Hourglass, tailored","Sophisticated, classic","Defined waist, structured shoulders"
3,Todd Lynn,Fall 2008,Masculine,"Black coat with textured lapel, black V-neck sweater, blue trousers",None,"Slim, elongated","Modern, sleek","Contrasting textures, monochrome with pop of color"
1,Todd Lynn,Fall 2008,Feminine,"Blue sleeveless top, black leather skirt",Black heels,"Fitted, sleek","Chic, modern","Textured skirt, minimalist top"
2,Todd Lynn,Fall 2008,Feminine,"Black textured jacket, black pants",Black heels,"Structured, tailored","Sophisticated, edgy","Asymmetrical jacket, monochrome look"
3,Todd Lynn,Fall 2008,Masculine,"Black suit jacket, black trousers",None,"Tailored, sharp","Classic, elegant","Wide lapels, clean lines"
1,Todd Lynn,Fall 2008,Feminine,"Gray trench coat, black trousers",Black belt,"Tailored, structured","Chic, classic","Strong shoulders, monochrome"
2,Todd Lynn,Fall 2008,Feminine,"Blue tailored jacket, matching pencil skirt",Black belt,"Fitted, hourglass","Elegant, professional","Peplum detail, sharp tailoring"
3,Todd Lynn,Fall 2008,Feminine,"Black shirt, white trousers",Black belt,"Slim, sleek","Minimalist, modern","Monochrome contrast, clean lines"
