Look Number,Designer,Season,Gender Presentation,Garments,Accessories,Silhouette,Style Keywords,Notes
1,Trovata,Spring 2009,Feminine,Striped shirtdress,"Woven belt, gold clutch","Relaxed, flowing","Casual, chic","Rolled sleeves, side slit"
2,Trovata,Spring 2009,Feminine,"White shirt, black blazer, sequined shorts",Gold clutch,"Structured, playful","Eclectic, modern","Contrasting textures, belted blazer"
3,Trovata,Spring 2009,Masculine,"Gray blazer, white polo, black shorts",None,"Tailored, casual","Preppy, minimalist","Clean lines, casual footwear"
1,Trovata,Spring 2009,Feminine,"White sheer blouse, white shorts","Beige cap, bracelet","Relaxed, casual","Minimalist, summery","Light and airy fabric, casual elegance"
2,Trovata,Spring 2009,Masculine,"Black jacket, white shirt, gray trousers",None,"Relaxed, casual","Minimalist, modern","Rolled-up pants, clean lines"
3,Trovata,Spring 2009,Feminine,"White dress, black blazer","Straw clutch, necklace","Structured, casual","Chic, sophisticated","Contrasting blazer, elegant accessories"
1,Trovata,Spring 2009,Masculine,"Gray sweater, checkered shirt, gray shorts",White sneakers,"Casual, relaxed","Sporty, laid-back",Frayed edges on shorts
2,Trovata,Spring 2009,Masculine,"Checkered blazer, checkered shorts, white shirt","White sneakers, black glasses","Tailored, structured","Preppy, classic",Matching checkered suit
3,Trovata,Spring 2009,Feminine,"White blazer, white trousers, white top","White sneakers, black glasses, bracelets","Relaxed, tailored","Chic, sophisticated",Rolled-up sleeves and pants
