Look Number,Designer,Season,Gender Presentation,Garments,Accessories,Silhouette,Style Keywords,Notes
1,Wayne,Spring 2013,Feminine,"Black leather jacket, black mini skirt",Studded sandals,"Fitted, structured","Edgy, modern",Asymmetrical jacket hem
2,Wayne,Spring 2013,Feminine,Black sleeveless dress with orange accents,Studded sandals,"Straight, minimal","Chic, contemporary",Bold shoulder accents
3,Wayne,Spring 2013,Feminine,Black sleeveless dress with white collar,Studded sandals,"A-line, simple","Classic, clean",Contrast collar detail
1,Wayne,Spring 2013,Feminine,"Strapless peplum top, cropped pants",Studded sandals,"Fitted, streamlined","Minimalist, modern","Monochrome look, focus on texture"
2,Wayne,Spring 2013,Feminine,"Sleeveless top, leather peplum skirt",Studded sandals,"Fitted, structured","Minimalist, edgy","Contrast of textures, monochrome"
3,Wayne,Spring 2013,Feminine,Wrap dress with tie detail,Studded sandals,"Relaxed, wrap","Minimalist, chic","Simple silhouette, monochrome"
1,Wayne,Spring 2013,Feminine,"Blue sleeveless top, blue mini skirt",Black sandals with gold embellishments,"Straight, relaxed","Minimalist, bold","Monochrome blue, simple lines"
2,Wayne,Spring 2013,Feminine,Blue sleeveless dress with white underlay,Black sandals with gold embellishments,"Straight, relaxed","Minimalist, bold","V-neck detail, monochrome blue"
3,Wayne,Spring 2013,Feminine,"Printed bomber jacket, black top, black pants",Black sandals with gold embellishments,"Relaxed, casual","Sporty, modern","Graphic print, casual layering"
