Look Number,Designer,Season,Gender Presentation,Garments,Accessories,Silhouette,Style Keywords,Notes
1,Willow,Spring 2011,Feminine,"White sleeveless blazer, black cut-out bralette, black and white patterned shorts",Black strappy sandals,"Fitted, sleek","Modern, edgy","Monochrome palette, structured layering"
2,Willow,Spring 2011,Feminine,Black and white patterned dress with cut-out details,Black strappy sandals,"A-line, fitted","Chic, bold","Asymmetric design, textured fabric"
3,Willow,Spring 2011,Feminine,Black and white patterned romper,"Black strappy sandals, black belt","Fitted, playful","Trendy, youthful","Textured fabric, cinched waist"
1,Willow,Spring 2011,Feminine,Black and gray draped dress,Black strappy heels,"Fitted, asymmetrical","Modern, edgy","Unique draping, monochrome pattern"
2,Willow,Spring 2011,Feminine,"White blazer, black and gray jumpsuit",Black strappy heels,"Relaxed, tailored","Chic, contemporary","Contrasting textures, sleek tailoring"
3,Willow,Spring 2011,Feminine,"Black and gray striped top, white skirt",Black strappy heels,"Fitted, layered","Sophisticated, graphic","Bold stripes, monochrome contrast"
1,Willow,Spring 2011,Feminine,White sleeveless dress,"Black cuff bracelets, black strappy sandals","Straight, minimal","Chic, modern",Simple elegance with bold accessories
2,Willow,Spring 2011,Feminine,"White sleeveless top, black and white striped skirt",Black strappy sandals,"Flowy, relaxed","Effortless, contemporary",Contrast in textures with a monochrome palette
3,Willow,Spring 2011,Feminine,"Black and white patterned dress, black vest",Black strappy sandals,"Fitted, layered","Edgy, artistic",Playful use of patterns and layering
