Look Number,Designer,Season,Gender Presentation,Garments,Accessories,Silhouette,Style Keywords,Notes
1,Alainpaul,Fall 2024,Feminine,"Black long-sleeve top, White waistband, Black wide-leg pants",None,"Structured, Elongated","Minimalist, Monochrome",Contrasting waistband adds visual interest
1,Alainpaul,Fall 2024,Androgynous,"White fitted long-sleeve top, Black high-waisted wide-leg pants",None visible,"Fitted top, Wide-leg pants","Minimalist, Modern","Clean lines, Monochrome palette"
1,Alainpaul,Fall 2024,Masculine,"Oversized black wool coat, Black wide-leg trousers",None visible,"Oversized, Structured","Minimalist, Avant-garde","Dramatic high collar, Monochromatic"
1,Alainpaul,Fall 2024,Gender Neutral,"White sleeveless top, Black high-waisted pants",Long black scarf,"Straight, Relaxed","Minimalist, Modern",Monochrome palette with contrasting textures
1,Alainpaul,Fall 2024,Feminine,"Black tailored coat, Black wide-leg trousers",Black gloves,"Structured, Oversized","Minimalist, Monochrome",Sharp lines and clean design
1,Alainpaul,Fall 2024,Feminine,"Pink sheer turtleneck top, Pink camisole, Black maxi skirt",None,"Fitted top, Flowing skirt","Modern, Minimalist",Layered top with contrasting colors
1,Alainpaul,Fall 2024,Unisex,"Navy double-breasted coat, Navy high-neck top",None,"Long, Oversized","Minimalist, Elegant",Monochromatic navy ensemble with a focus on layering and structure.
1,Alainpaul,Fall 2024,Androgynous,"Blue velvet turtleneck top, Blue velvet pants",None,"Fitted top, Loose pants","Luxurious, Monochrome, Elegant",Rich texture with a modern twist
1,Alainpaul,Fall 2024,Androgynous,"Navy structured coat, Navy draped trousers",None,"Oversized, Layered","Minimalist, Avant-garde",Monochrome navy ensemble with clean lines
1,Alainpaul,Fall 2024,Androgynous,"Oversized gray wool coat, Wide-leg gray trousers, Black ribbed knit scarf",None visible,"Oversized, Layered","Minimalist, Monochrome",Dramatic proportions with a focus on texture and layering.
1,Alainpaul,Fall 2024,Gender Neutral,"Pink long-sleeve top, Gray high-waisted wide-leg pants",None,"Structured, Fitted top, Wide-leg pants","Minimalist, Modern","Contrasting colors, Clean lines"
1,Alainpaul,Fall 2024,Feminine,"Gray draped coat, black sleeves, wool",None,"Asymmetrical, long","Avant-garde, minimalist","Structured shoulders, high neck"
1,Alainpaul,Fall 2024,Masculine,"Gray oversized coat, gray wide-leg trousers",None visible,"Oversized, structured","Avant-garde, minimalist","Features an exaggerated scarf-like collar, red shoes add contrast."
1,Alainpaul,Fall 2024,Gender Neutral,"Gray wool cape, Black and gray wide-leg trousers",None,Loose,"Minimalist, Monochrome",Sophisticated and structured ensemble
1,Alainpaul,Fall 2024,Feminine,"Black cape dress, Black pants",None,"Oversized, Flowing","Minimalist, Modern",Monochromatic look with dramatic cape silhouette
1,Alainpaul,Fall 2024,Androgynous,"White silk blouse, Black wide-leg trousers",None visible,"Flowing, Relaxed","Minimalist, Elegant",Monochrome look with a focus on clean lines and simplicity.
1,Alainpaul,Fall 2024,Feminine,"Sheer pink gown, asymmetrical hem",Pink ballet flats,"Flowing, ethereal","Minimalist, ethereal",Delicate sheer fabric with soft draping
1,Alainpaul,Fall 2024,Feminine,"Black ruched dress, Two-tone thigh-high boots",None,"Fitted, Asymmetrical","Minimalist, Edgy",Contrast between dress and boots
1,Alainpaul,Fall 2024,Feminine,"White sheer cape dress, satin hem",White ankle boots,"Flowing, ethereal","Minimalist, elegant",Sheer fabric adds a delicate touch.
1,Alainpaul,Fall 2024,Androgynous,"White asymmetrical shirt, Black wide-leg trousers",Black belt,"Oversized, Relaxed","Minimalist, Avant-garde",Asymmetrical design adds interest
1,Alainpaul,Fall 2024,Unisex,"Black leather cape, Black leather pants",None,"Oversized, Draped","Avant-garde, Minimalist",Monochrome leather ensemble with a futuristic edge.
1,Alainpaul,Fall 2024,Feminine,"Gray ribbed knit top, Gray ribbed knit pants",None,Relaxed,"Minimalist, Cozy","Draped neckline, Monochrome"
1,Alainpaul,Fall 2024,Feminine,"Black leather shearling coat, Black ribbed pants",None,Boxy,"Modern, Minimalist, Cozy",Shearling details add texture and warmth
1,Alainpaul,Fall 2024,Feminine,"Gray draped dress, matching long coat",Thigh-high boots,Fitted,"Monochrome, Minimalist",Elegant and sleek design
1,Alainpaul,Fall 2024,Unisex,"Oversized pink hoodie, Pink drawstring pants",None visible,"Oversized, Relaxed","Casual, Streetwear",Monochromatic pink ensemble with sporty elements
1,Alainpaul,Fall 2024,Androgynous,"Long pink tunic, Pink wide-leg pants",None,Loose,"Minimalist, Monochrome","Soft fabric, Layered look"
1,Alainpaul,Fall 2024,Gender Neutral,"Black long-sleeve dress, layered skirt",None,"Flowy, layered","Minimalist, modern",Monochrome look with a focus on silhouette and texture.
1,Alainpaul,Fall 2024,Unisex,"Denim jacket, Black, Textured; Denim pants, Black, Textured",None,Structured,"Monochrome, Edgy",Denim texture with a glossy finish
1,Alainpaul,Fall 2024,Masculine,"Sleeveless black top, gray textured wide-leg pants",Silver shoes,"Structured, Oversized","Futuristic, Minimalist",Unique pants design with layered effect
1,Alainpaul,Fall 2024,Masculine,"Black leather jacket, Black leather pants",Pink velvet shoes,"Structured, Straight","Futuristic, Edgy",Monochrome leather ensemble with contrasting footwear
1,Alainpaul,Fall 2024,Androgynous,"Gray high-neck coat, Black wide-leg pants",Red shoes,"Long, Layered","Minimalist, Futuristic","Monochromatic palette, Structured design"
1,Alainpaul,Fall 2024,Masculine,"Black embellished blazer, White turtleneck, Black wide-leg trousers",None,Structured,"Elegant, Modern, Minimalist",Subtle sparkle adds texture to classic tailoring
1,Alainpaul,Fall 2024,Feminine,"Black double-breasted coat, White high-neck top",None,"Long, Tailored","Minimalist, Structured",Classic black and white contrast
1,Alainpaul,Fall 2024,Feminine,"Black double-breasted blazer, Pink high-neck blouse, Black pleated skirt",None,"Oversized, Structured","Modern, Elegant",Contrasting colors with a focus on structure and pleats.
1,Alainpaul,Fall 2024,Feminine,"Black long-sleeve gown, pleated texture",None,Flowing,"Elegant, Minimalist","High neckline, floor-length"
1,Alainpaul,Fall 2024,Gender Neutral,"Black long-sleeve gown, fitted, jersey",None,Column,Minimalist,"Elegant, understated design"
1,Alainpaul,Fall 2024,Androgynous,"Sheer black cape, Gray fitted pants",Black choker,"Flowing cape, Fitted pants","Avant-garde, Edgy",Dramatic sheer layering
1,Alainpaul,Fall 2024,Feminine,"Black long-sleeve top with structured shoulders, black pleated skirt",None,"Fitted top, flowing skirt","Elegant, Minimalist",Monochrome look with a focus on texture and structure.
1,Alainpaul,Fall 2024,Feminine,"Black pleated satin gown, one-shoulder",None,"Flowing, Draped","Elegant, Minimalist",Sophisticated use of pleats and asymmetry
1,Alainpaul,Fall 2024,Feminine,"White sheer tulle cape, White pants",,Flowing,"Ethereal, Minimalist","Off-shoulder design, Light and airy"
1,Alainpaul,Fall 2024,Unisex,"Black oversized t-shirt, Black wide-leg pants",None,"Relaxed, Oversized","Minimalist, Monochrome",Casual and understated look
