Look Number,Designer,Season,Gender Presentation,Garments,Accessories,Silhouette,Style Keywords,Notes
1,Alice + Olivia,Fall 2024,Feminine,"Gold tweed jacket, gold tweed mini skirt, black tweed jacket, black tweed shorts","Black knee-high boots, black scarf, gold bracelets","Tailored, structured","Chic, sophisticated, retro",Contrasting textures and colors with a vintage-inspired aesthetic.
1,Alice + Olivia,Fall 2024,Feminine,"Black lace mini dress, pearl embellishments","Pearl necklace, pearl ankle straps, black platform heels",Fit and flare,"Elegant, Sophisticated, Modern",Classic black and pearls combination with a modern twist
1,Alice + Olivia,Fall 2024,Feminine,"White tweed jacket with black trim, White tweed mini skirt with black trim","Black platform heels, Black neck scarf, Gold rings","Structured, Fitted","Chic, Monochrome, Sophisticated",Classic black and white contrast with modern twist
1,Alice + Olivia,Fall 2024,Feminine,"Black cape dress with white bow, Black suit with white lapels","Black platform heels, Black choker, Rings","A-line, Tailored","Chic, Monochrome, Elegant",Contrasting black and white theme
1,Alice + Olivia,Fall 2024,Feminine,"White ruffled blouse, Black asymmetrical ruffled skirt","Black knee-high boots, Black neck scarf, Hoop earrings, Pearl necklace","Asymmetrical, Layered","Chic, Monochrome, Textured",Bold contrast with ruffles and monochrome palette
1,Alice + Olivia,Fall 2024,Feminine,"White satin blouse, Black wide-leg trousers",Black neck bow,"Oversized, Relaxed","Chic, Elegant, Monochrome",High contrast with bold black and white elements
1,Alice + Olivia,Fall 2024,Feminine,"Black maxi dress with colorful abstract print, long sleeves","Red hoop earrings, black choker, yellow bracelet","Fitted, floor-length","Artistic, bold, graphic","Features vibrant abstract artwork, matching background"
1,Alice + Olivia,Fall 2024,Feminine,"Black graphic print turtleneck, Black wide-leg pants, Red dress, Black graphic print coat",Red ring,"Tailored, Flowing","Graphic, Bold, Artistic",Colorful graphic prints with a modern artistic flair.
1,Alice + Olivia,Fall 2024,Feminine,Black long-sleeve gown with colorful graphic print,Red scarf,Fitted,"Artistic, Bold, Graphic",Features a striking graphic print with vibrant colors.
