Look Number,Designer,Season,Gender Presentation,Garments,Accessories,Silhouette,Style Keywords,Notes
1,Balmain,Fall 2024,Feminine,"Beige trench coat, Black turtleneck, Beige high-waisted trousers","Gold statement earrings, Beige handbag","Structured, Oversized","Chic, Sophisticated",Classic trench with modern twist
1,Balmain,Fall 2024,Feminine,"Beige trench coat with hood, Black velvet top, Beige wide-leg pants","Black handbag, Beige platform heels with bow","Structured, Layered","Chic, Modern, Sophisticated",Elegant use of layering with a mix of textures.
1,Balmain,Fall 2024,Feminine,"Black leather coat, Gold belt","Gold earrings, Black headpiece","Structured, Oversized shoulders","Edgy, Futuristic","Strong shoulder emphasis, Monochrome look"
1,Balmain,Fall 2024,Feminine,Beige structured coat dress with button details,"Headband, earrings","Fitted, longline","Architectural, tailored",Features exaggerated shoulders and asymmetrical design
1,Balmain,Fall 2024,Feminine,"Beige structured jacket with hood, Beige wrap skirt","Mint green basket bag, Embellished belt","Tailored, Fitted","Sophisticated, Modern","Strong shoulder detail, Monochromatic look"
1,Balmain,Fall 2024,Feminine,"Green draped dress, structured bodice","Black textured clutch, headband","Fitted, Draped","Elegant, Structured","High neckline, long sleeves"
1,Balmain,Fall 2024,Feminine,"Structured beige peplum top, Beige tailored pants","Oversized sunglasses, Large cork bag, Statement earrings, Headscarf","Hourglass, Peplum","Sophisticated, Elegant, Architectural","Gold embellished belt detail, Neutral tones"
1,Balmain,Fall 2024,Feminine,"Sequin floral turtleneck top, Olive high-waisted wrap trousers","Red embellished handbag, Platform shoes","Fitted top, Tapered trousers","Elegant, Modern, Textured",Rich textures with a bold color contrast
1,Balmain,Fall 2024,Feminine,"Tan trench coat with pleated inserts, beige belt",Blue netted bag,"Structured, Layered","Elegant, Modern",Features oversized lapels and gold buttons
