Look Number,Designer,Season,Gender Presentation,Garments,Accessories,Silhouette,Style Keywords,Notes
1,By Malene Birger,Fall 2024,Feminine,"Tan faux fur hooded coat, Tan fuzzy knit skirt",Tan pointed-toe heels,"Relaxed, Layered","Cozy, Chic, Monochromatic",Warm tones and textures create a cohesive look.
1,By Malene Birger,Fall 2024,Feminine,"Fuzzy gray crop top, Fuzzy gray skirt",Brown leather handle,Fitted,"Textured, Modern","Features a cut-out detail, cozy texture"
1,By Malene Birger,Fall 2024,Feminine,"Beige turtleneck, Beige fringe vest, Beige knit pants","Brown leather bag, Sunglasses","Relaxed, Layered","Chic, Cozy, Monochrome",Neutral tones with textured layers
1,By Malene Birger,Fall 2024,Feminine,"Beige polka dot knit top, Beige polka dot knit pants","Brown sunglasses, Gold belt",Fitted,"Retro, Playful",Coordinated knit set with bold pattern
1,By Malene Birger,Fall 2024,Feminine,"Textured white jacket, Beige ribbed knit skirt, Beige knit leggings","Sunglasses, Beige pointed-toe shoes",A-line,"Minimalist, Monochrome, Textured",Neutral tones with layered knit textures
1,By Malene Birger,Fall 2024,Feminine,"Cream fuzzy hooded sweater, Black textured pants",Brown sunglasses,"Relaxed, Cozy","Minimalist, Chic",Soft textures and neutral tones
1,By Malene Birger,Fall 2024,Feminine,Brown faux fur coat,"Sunglasses, Black strappy sandals",Oversized,"Luxurious, Bold",Polka dot leggings add contrast
1,By Malene Birger,Fall 2024,Feminine,"Cream wool cape, Cream knit dress, Cream knit leggings",Black sandals,"Layered, Loose","Minimalist, Elegant",Monochromatic cream tones with a relaxed fit
1,By Malene Birger,Fall 2024,Feminine,Brown velvet dress,Brown croc-embossed handbag,"Relaxed, flowing","Elegant, vintage-inspired",Features gathered neckline and wide sleeves
