Look Number,Designer,Season,Gender Presentation,Garments,Accessories,Silhouette,Style Keywords,Notes
1,Carven,Fall 2024,Feminine,"Brown oversized coat, White shirt, Gray skirt","White clutch, Nude heels","Oversized, Layered","Minimalist, Modern","Neutral tones, Clean lines"
1,Carven,Fall 2024,Gender Neutral,"White off-shoulder top, Black textured skirt","Black gloves, Black heels","Structured, Draped","Minimalist, Modern",Contrasting textures and clean lines
1,Carven,Fall 2024,Feminine,"Plaid overcoat, Olive draped collar, Brown wide-leg trousers",White clutch,Oversized,"Tailored, Minimalist",Neutral tones with structured layering
1,Carven,Fall 2024,Feminine,"Beige sleeveless top, Light grey draped pants",Layered gold necklaces,"Loose, Relaxed","Minimalist, Elegant",Neutral tones with a focus on draping and layering.
1,Carven,Fall 2024,Feminine,"Oversized gray double-breasted blazer, Brown flared skirt","Green earrings, Brown boots","Oversized top, Flared bottom","Structured, Elegant, Modern",Neutral tones with a focus on tailored shapes
1,Carven,Fall 2024,Feminine,"Brown oversized blazer, Black top, Beige draped skirt","White necklace, White heels","Oversized, Layered","Minimalist, Contemporary",Mix of structured and fluid elements
1,Carven,Fall 2024,Unisex,"Oversized gray coat, gray trousers",Pink clutch,Oversized,"Minimalist, Structured",Neutral tones with a pop of color accessory
1,Carven,Fall 2024,Feminine,Gray wool sleeveless dress,"Black leather gloves, layered silver necklaces","Loose, draped","Minimalist, edgy",Understated elegance with a focus on texture and accessories.
1,Carven,Fall 2024,Feminine,"Gray oversized blazer, Gray flared skirt","Black leather gloves, Black boots","Oversized, Structured","Minimalist, Tailored",Neutral tones with a focus on structure and texture.
