Look Number,Designer,Season,Gender Presentation,Garments,Accessories,Silhouette,Style Keywords,Notes
1,Chloé,Fall 2024,Feminine,"Black leather cape, Cream ruffled chiffon dress","Gold statement necklace, Pink sunglasses, Black studded sandals","Flowy, Layered","Romantic, Edgy",Contrast of textures with leather and chiffon
1,Chloé,Fall 2024,Feminine,Sheer white lace dress,Gold 'Chloé' belt,A-line,"Romantic, Delicate",Paired with knee-high black boots
1,Chloé,Fall 2024,Androgynous,"White lace cape blouse, Black tailored pants",Gold chain belt,"Flowing top, Straight-leg pants","Romantic, Vintage, Elegant",Delicate lace contrasts with structured pants
1,Chloé,Fall 2024,Feminine,"Black sheer polka dot dress, Black high-waisted shorts","Fur hat, Sunglasses, Gold necklace","Flowy, Layered","Bohemian, Elegant","Sheer fabric adds a delicate touch, layered with shorts for modesty."
1,Chloé,Fall 2024,Feminine,"White lace blouse, Blue patchwork jeans","Gold chain belt, Brown clogs",Relaxed fit,"Bohemian, Vintage-inspired",Mix of textures with lace and denim
1,Chloé,Fall 2024,Feminine,White ruffled sheer dress,"Gold and black handbag, Sunglasses, Black ankle strap shoes","Flowy, Layered","Ethereal, Romantic",Ruffled texture adds volume and movement.
1,Chloé,Fall 2024,Feminine,"Black lace camisole, Black tailored trousers","Gold 'Chloé' belt, Brown sunglasses","Fitted top, Straight-leg trousers","Elegant, Modern, Chic",The look combines delicate lace with structured tailoring for a sophisticated style.
1,Chloé,Fall 2024,Feminine,"White lace sheer dress, Black leather thigh-high boots",Gold choker,"Flowy, Layered","Romantic, Ethereal",Delicate lace with bold boots contrast
1,Chloé,Fall 2024,Feminine,Black lace tiered dress,"Black headband, Gold necklace","Flowy, Layered","Romantic, Gothic",Sheer lace with ruffle details
