Look Number,Designer,Season,Gender Presentation,Garments,Accessories,Silhouette,Style Keywords,Notes
1,COS,Fall 2024,Feminine,"Gray wool coat, belted",White fluffy slippers,"Oversized, cinched waist","Minimalist, Cozy",Elegant and understated with a focus on comfort.
1,COS,Fall 2024,Feminine,"Black asymmetrical cape top, Black asymmetrical skirt","Black ankle socks, Black flats","Asymmetrical, Flowing","Minimalist, Modern",Elegant draping and clean lines
1,COS,Fall 2024,Masculine,"Black oversized coat, Black v-neck sweater, Black trousers",Black leather shoes,"Oversized, Longline","Minimalist, Monochrome",Clean lines with a focus on tailoring
1,COS,Fall 2024,Masculine,"Black cropped cape, Black tailored trousers",Black shoes,Relaxed,"Minimalist, Monochrome",Structured yet fluid design
1,Cos,Fall 2024,Feminine,Brown and white faux fur coat,None,Boxy,"Modern, Minimalist",Coat features a high collar and oversized fit
1,COS,Fall 2024,Menswear,"Olive green oversized double-breasted coat, Dark textured shirt, Olive green trousers",Black leather bag,"Oversized, Relaxed","Minimalist, Tailored","Subtle texture contrast, Neutral palette"
1,COS,Fall 2024,Feminine,"Beige oversized blazer, Cream turtleneck top, Navy wide-leg trousers",None,"Oversized, Relaxed","Minimalist, Tailored","Neutral palette, Clean lines"
1,COS,Fall 2024,Masculine,"Navy oversized blazer, Navy turtleneck sweater, Navy wide-leg trousers",None,Relaxed,"Minimalist, Tailored",Monochromatic navy ensemble with a focus on clean lines and simplicity.
1,COS,Fall 2024,Androgynous,"Navy oversized coat, Black trousers",Black belt,"Oversized, Structured","Minimalist, Contemporary",Clean lines with a focus on volume.
1,COS,Fall 2024,Menswear,"Navy double-breasted coat, navy zip-up jacket, navy wide-leg trousers",Black shoes,"Relaxed, Oversized","Minimalist, Tailored","Monochromatic navy ensemble with a classic, structured look."
1,COS,Fall 2024,Feminine,"Black wool coat, Belted, Double-breasted",Black loafers,Long and structured,"Minimalist, Elegant","High collar, Monochrome"
1,COS,Fall 2024,Menswear,"Black leather jacket, Black zip-up turtleneck, Dark denim pants",None,Relaxed,"Minimalist, Modern","Clean lines, monochrome palette"
1,COS,Fall 2024,Unisex,"Black leather jacket, Black turtleneck sweater, Black wide-leg trousers",None,Relaxed,"Minimalist, Modern","Monochromatic, understated elegance"
1,COS,Fall 2024,Masculine,"Black textured zip-up sweater, Black wide-leg trousers",Black shoes,Relaxed,"Minimalist, Monochrome",Understated elegance with a focus on texture
1,COS,Fall 2024,Feminine,Black off-the-shoulder knit dress,Embellished shoes,Bodycon,"Minimalist, Elegant",Simple yet sophisticated look
1,COS,Fall 2024,Feminine,Black oversized coat,"Black quilted clutch, Green ankle boots","Oversized, Boxy","Minimalist, Modern",Contrasting green footwear adds a pop of color
1,COS,Fall 2024,Masculine,"Gray wool overcoat, gray tailored suit, gray shirt",Black shoes,"Oversized, relaxed","Minimalist, tailored",Monochromatic gray ensemble with layered tailoring.
1,COS,Fall 2024,Feminine,"Gray oversized top, Gray knit shorts",Fringed clutch,"Relaxed, Layered","Minimalist, Modern",Pop of color with green footwear
1,COS,Fall 2024,Feminine,Camel wool coat,Green boots,Oversized,"Minimalist, Modern",Classic double-breasted design with bold color contrast in footwear.
1,COS,Fall 2024,Masculine,"Sleeveless gray wool top, Gray wool trousers",Black leather tote bag,"Boxy, Relaxed","Minimalist, Modern","Simple, elegant design with clean lines"
1,COS,Fall 2024,Feminine,"Gray ribbed knit top, Gray wide-leg trousers","Pink socks, Black shoes","Relaxed, Oversized","Minimalist, Sophisticated",Monochromatic look with a focus on texture and silhouette.
1,COS,Fall 2024,Masculine,"Olive green oversized blazer, Beige ribbed zip-up sweater, Olive green wide-leg trousers",None,Relaxed,"Minimalist, Tailored","Classic color palette, Textured knit adds depth"
1,COS,Fall 2024,Androgynous,"Black leather jacket, Gray wool trousers, Olive shirt",None,"Oversized, Relaxed","Minimalist, Contemporary",Classic color palette with a focus on texture and layering.
1,COS,Fall 2024,Feminine,"Gray button-up shirt, Gray midi skirt","Pink socks, Beige shoes","Relaxed, Structured","Minimalist, Modern","Subtle texture, Monochromatic"
1,COS,Fall 2024,Masculine,"Shearling coat, Black shirt, Black trousers",Black shoes,Relaxed,"Minimalist, Monochrome","Textured outerwear, Classic tailoring"
1,COS,Fall 2024,Unisex,"Oversized black blazer, black wide-leg trousers, black top",Embellished black shoes,"Oversized, Relaxed","Minimalist, Tailored",Monochrome look with a focus on structure and simplicity.
1,COS,Fall 2024,Feminine,"Black sleeveless jumpsuit, wool texture","Black leather gloves, black belt, oversized quilted clutch, white fluffy slippers","Relaxed, straight","Minimalist, modern, sleek",Monochrome look with contrasting textures
1,COS,Fall 2024,Masculine,"Sleeveless black top, Black wide-leg trousers",Black shoes,Relaxed,Minimalist,"Simple, elegant, monochrome"
1,COS,Fall 2024,Androgynous,"Oversized black double-breasted blazer, White shirt, Black wide-leg trousers",Black shoes,Relaxed,"Minimalist, Tailored",Classic monochrome look with a modern twist.
1,COS,Fall 2024,Feminine,"Black lace top, Black draped pants",None,"Relaxed, Draped","Minimalist, Elegant","Sheer texture, Monochrome"
1,COS,Fall 2024,Feminine,"Sleeveless black double-breasted blazer, Black wide-leg trousers","Thin black belt, Chain detail shoes","Oversized, Relaxed","Minimalist, Tailored",Sophisticated monochrome look with modern tailoring.
1,COS,Fall 2024,Feminine,"Black lace sleeveless dress, Black underlayer",Black shoes,"Straight, Sheer","Minimalist, Elegant",Sheer lace texture adds a delicate touch.
1,COS,Fall 2024,Masculine,"Sleeveless black double-breasted blazer, black wide-leg trousers",None,Relaxed,"Minimalist, Modern","Clean lines, understated elegance"
1,COS,Fall 2024,Feminine,"Black fuzzy strapless top, Sheer black skirt","Black leather gloves, Quilted clutch","A-line, Flowing","Minimalist, Elegant",Monochromatic black ensemble with textural contrast
1,COS,Fall 2024,Masculine,"Black oversized blazer, black draped top, black wide-leg trousers",None,Relaxed,"Minimalist, Modern","Monochromatic, clean lines"
1,COS,Fall 2024,Feminine,"Black lace dress, sheer overlay",None,Flowy,"Elegant, Sheer, Minimalist",Intricate lace pattern with a modern twist.
1,COS,Fall 2024,Feminine,"Black sleeveless tunic with beaded neckline, black shorts","Black sheer socks, black flats","Straight, minimal","Chic, modern, minimal",Elegant use of texture with beaded neckline
1,COS,Fall 2024,Feminine,Black textured dress,Black belt,Straight,"Minimalist, Textured",Simple yet elegant with a focus on texture.
1,COS,Fall 2024,Feminine,"Sheer black high-neck top, Sheer black skirt","Black gloves, Black quilted clutch, Black boots","Straight, Layered","Minimalist, Modern, Edgy",Monochrome look with a focus on texture and layering.
1,COS,Fall 2024,Feminine,Black satin sleeveless gown,Embellished flats,Flowing,"Minimalist, Elegant",Simple yet sophisticated design
1,COS,Fall 2024,Feminine,"Black draped dress, Asymmetrical neckline, High slit","Black socks, Black shoes","Flowing, Relaxed","Minimalist, Elegant",Monochrome look with subtle detailing
