Look Number,Designer,Season,Gender Presentation,Garments,Accessories,Silhouette,Style Keywords,Notes
1,Derek Lam 10 Crosby,Fall 2024,Feminine,"Blue floral jacket, Light blue blouse, Dark blue high-waisted jeans","Pearl necklace, Hoop earrings",Relaxed fit,"Casual, Chic",Mix of textures with denim and floral print
1,Derek Lam 10 Crosby,Fall 2024,Feminine,"White textured trench coat, Gray turtleneck","Gold statement earrings, Black leather boots","Longline, Tailored","Chic, Minimalist",Sophisticated indoor setting
1,Derek Lam 10 Crosby,Fall 2024,Feminine,"White button-up shirt, beige cardigan, mustard yellow trousers",Gold hoop earrings,Relaxed,"Chic, Minimalist",Sophisticated use of color and layering
1,Derek Lam 10 Crosby,Fall 2024,Feminine,"Patchwork dress, floral and geometric patterns","Gold earrings, layered necklaces","Fitted bodice, flared skirt","Eclectic, Bohemian",Mix of prints and textures
1,Derek Lam 10 Crosby,Fall 2024,Feminine,"White pleated midi dress, Gray knit vest","Pearl necklace, Black loafers","A-line, Layered","Chic, Minimalist",Elegant and understated with a focus on layering.
1,Derek Lam 10 Crosby,Fall 2024,Feminine,"Denim blazer, Striped button-up shirt, High-waisted denim pants","Gold earrings, Necklace",Relaxed fit,"Casual, Chic, Layered",Classic denim with a modern twist
1,Derek Lam 10 Crosby,Fall 2024,Feminine,"Black sheer blouse, Black flared pants","Gold hoop earrings, Layered necklaces","Tailored, Flared","Chic, Minimalist",Sophisticated and understated look with a focus on texture.
1,Derek Lam 10 Crosby,Fall 2024,Feminine,"Brocade jacket, White collared shirt, Dark denim pants",Gold ring,"Structured, Relaxed","Elegant, Contemporary",Rich texture with a classic silhouette
1,Derek Lam 10 Crosby,Fall 2024,Feminine,"Beige blazer, White turtleneck sweater, Dark denim wide-leg pants",Statement earrings,"Relaxed, Tailored","Chic, Modern, Minimalist",Classic color palette with bold accessories
