Look Number,Designer,Season,Gender Presentation,Garments,Accessories,Silhouette,Style Keywords,Notes
1,Diotima,Fall 2024,Feminine,"Gold crochet tank top, Black fringe skirt","Black knee-high boots, Bracelets","Fitted top, Flowing fringe skirt","Eclectic, Bohemian, Edgy",Dynamic pose highlights flexibility and movement
1,Diotima,Fall 2024,Feminine,"Knit dress, mustard, open-back",Black pointed boots,"Fitted, ankle-length","Elegant, modern, textured",Features intricate knit pattern and open-back design
1,Diotima,Fall 2024,Feminine,"Cream knit top with cutouts, Cream knit skirt with cutouts",Red chunky necklace,Fitted,"Modern, Edgy, Cutout",Innovative use of cutouts for texture and style.
1,Diotima,Fall 2024,Gender Neutral,"Black shirt, ""Pink and brown crochet dress""",Black boots,"Fitted, Layered","Eclectic, Textured",Bold crochet pattern with contrasting colors
1,Diotima,Fall 2024,Feminine,"Black blazer, Black fringe top, Black fringe pants",None,Relaxed,"Fringe, Monochrome, Edgy",Fringe details add texture and movement.
1,Diotima,Fall 2024,Feminine,"Lilac crochet dress, sheer texture",Red chunky necklace,Fitted,"Bohemian, Textured",Layered crochet design
1,Diotima,Fall 2024,Unisex,"Pink, cut-out, button-up shirt",None,Structured,"Bold, Edgy, Modern",Features geometric cut-out design
1,Diotima,Fall 2024,Feminine,"Black mesh top, Yellow and black fringed skirt, Black boots",Red necklace,"Relaxed, Flowy","Eclectic, Textured",Bold color contrast with fringe details
1,Diotima,Fall 2024,Feminine,"Gold floral embellished top, Black woven skirt",None,Fitted top with voluminous skirt,"Textured, Ornate, Elegant","Intricate floral embellishments, Unique weaving technique"
