Look Number,Designer,Season,Gender Presentation,Garments,Accessories,Silhouette,Style Keywords,Notes
1,Duro Olowu,Fall 2024,Feminine,"Black coat with leopard print collar and cuffs, striped mini skirt, burgundy tights",Gold hoop earrings,Structured,"Eclectic, Bold",Mix of patterns and textures
1,Duro Olowu,Fall 2024,Feminine,"Leopard print coat, knee-length, structured","Gold hoop earrings, platform heels",A-line,"Bold, Animal Print, Statement",Rich textures and vibrant colors
1,Duro Olowu,Fall 2024,Feminine,"Leopard print jacket, Leopard print pants, Striped sleeves","Gold hoop earrings, Black loafers",Relaxed fit,"Eclectic, Bold, Patterned","Mix of animal print and stripes, Rich color palette"
1,Duro Olowu,Fall 2024,Feminine,"Striped, multicolor, cotton dress","Gold hoop earrings, black loafers",A-line,"Bold, Retro, Striped",Rich color palette with classic silhouette
1,Duro Olowu,Fall 2024,Feminine,"Multicolored floral and geometric print dress, Long sleeves","Gold hoop earrings, Burgundy platform heels",A-line,"Eclectic, Vibrant, Retro",Bold mix of patterns and colors
1,Duro Olowu,Fall 2024,Feminine,"Leopard print trench coat, Plaid shirt","Hoop earrings, Platform sandals","A-line, Belted","Bold, Eclectic, Statement",Mix of patterns with animal print and plaid
1,Duro Olowu,Fall 2024,Feminine,"Striped blazer, striped midi skirt, leopard print blouse","Gold earrings, black loafers","Tailored, A-line","Eclectic, Bold, Patterned",Mix of patterns with vibrant stripes and animal print
1,Duro Olowu,Fall 2024,Feminine,"Striped, multicolor, button-down dress","Gold hoop earrings, platform shoes","A-line, fitted waist","Bold, retro, vibrant",Colorful stripes with a vintage flair
