Look Number,Designer,Season,Gender Presentation,Garments,Accessories,Silhouette,Style Keywords,Notes
1,Acne Studios,Spring 2024,Feminine,"White long-sleeve top, White textured mini skirt","Oversized sunglasses, Statement earrings, White pointed heels","Fitted top, A-line skirt","Minimalist, Futuristic",Monochrome palette with sleek lines
1,Acne Studios,Spring 2024,Androgynous,"Distressed denim jacket, Distressed denim pants",Cream leather bag,Slim,"Edgy, Contemporary",Monochrome distressed denim look with a minimalist bag.
1,Acne Studios,Spring 2024,Feminine,"Textured cream long-sleeve top, Draped beige skirt",Strappy sandals,"Fitted bodice, Flowing skirt","Minimalist, Textured, Draped",Neutral tones with a mix of textures
1,Acne Studios,Spring 2024,Feminine,"Gray ruched top with eyelash detail, Sheer black skirt","Oversized sunglasses, Black clutch","Fitted top, Flowing skirt","Futuristic, Edgy",Unique eyelash detail on top
1,Acne Studios,Spring 2024,Feminine,"Gray fitted top, Gray high-waisted leggings","Oversized sunglasses, Gray handbag","Slim, Streamlined","Futuristic, Monochrome","Reflective elements, Minimalist aesthetic"
1,Acne Studios,Spring 2024,Feminine,"White cropped tank, Black and gray draped skirt","White structured bag, Silver bracelet","Asymmetrical, Flowing","Modern, Edgy",Minimalist color palette with bold silhouette
1,Acne Studios,Spring 2024,Feminine,"Beige cropped top, Red bra, Black draped skirt","Futuristic sunglasses, Silver bracelet","Asymmetrical, Draped","Avant-garde, Minimalist",Layered top with bold color contrast
1,Acne Studios,Spring 2024,Feminine,"Purple textured top, Draped purple skirt",Black strappy sandals,"Fitted top, Flowing skirt","Monochromatic, Textured, Draped",Rich purple tones with a mix of textures
