Look Number,Designer,Season,Gender Presentation,Garments,Accessories,Silhouette,Style Keywords,Notes
1,Kim Shui,Fall 2024,Feminine,"Snakeskin print coat dress, beige, textured",White oversized sunglasses,"Fitted, longline","Bold, edgy, statement","High collar, front slit"
1,Kim Shui,Fall 2024,Feminine,"Green and gold satin mini dress, Pink satin tights","Gold headscarf, Pink sunglasses, Gold strappy heels","Fitted, Mini","Retro, Glamorous","Floral embroidery, Bold color contrast"
1,Kim Shui,Fall 2024,Feminine,"Snakeskin jacket, Snakeskin briefs, Black lace tights","White sunglasses, Black headscarf, Gold lace-up sandals","Fitted upper, High-cut briefs","Edgy, Bold, Textured","Mix of textures with snakeskin and lace, striking accessories"
1,Kim Shui,Fall 2024,Gender Fluid,"Green sequin and mesh corset, Green draped skirt, Pink lace tights","Cat-eye sunglasses, Gold hoop earrings, Gold cuff bracelets","Fitted top, Voluminous skirt","Eclectic, Futuristic, Bold",Mix of textures and vibrant colors
1,Kim Shui,Fall 2024,Feminine,"Green embroidered corset, black leather shorts, black shiny leggings","Black headscarf, yellow sunglasses, black bracelets",Fitted,"Futuristic, Edgy",Features white fur leg warmers
1,Kim Shui,Fall 2024,Feminine,"Green satin dress with floral embroidery, pink satin leggings","Snake print headscarf, oversized sunglasses, snake print handbag, gold choker, bangles","Fitted, asymmetrical","Eclectic, retro, bold",Mix of textures and patterns with vintage-inspired accessories.
1,Kim Shui,Fall 2024,Feminine,"Pink lace shirt, Pink mini skirt, Pink lace tights","Floral wrap, Choker, White fur-trimmed heels","Fitted, Layered","Bold, Playful, Textured",Mix of textures and vibrant colors
1,Kim Shui,Fall 2024,Feminine,"Pink corset top, Green floral sequin pants","Gold hoop earrings, Gold bangles, Fur slippers","Fitted top, Loose pants","Bold, Floral, Eclectic",Mix of textures and vibrant colors
1,Kim Shui,Fall 2024,Feminine,"Green sequin mini dress, Lace tights","Sunglasses, Pink fur heels","Fitted, Bodycon","Bold, Glamorous, Eclectic",Mix of textures and vibrant colors
