Look Number,Designer,Season,Gender Presentation,Garments,Accessories,Silhouette,Style Keywords,Notes
1,Courrèges,Spring 2024,Feminine,White long-sleeve mini dress,"Black handbag, Black strappy sandals","Loose, Mini","Minimalist, Modern",Simple yet elegant with a focus on clean lines.
1,Courrèges,Spring 2024,Feminine,"Striped white shirt dress, oversized collar, long sleeves","Black handbag, silver sandals","Loose, relaxed","Minimalist, contemporary","Crisp lines, subtle elegance"
1,Courrèges,Spring 2024,Feminine,White oversized shirt dress,"Black textured tote, Black pendant necklace, Black strappy sandals","Loose, Relaxed","Minimalist, Chic",Simple yet elegant with a focus on clean lines and subtle details.
1,Courrèges,Spring 2024,Feminine,"Black long-sleeve dress with white collar, high slit","Brown handbag, black strappy heels","Straight, relaxed","Minimalist, modern",Classic color contrast with bold slit
1,Courrèges,Spring 2024,Feminine,"White off-shoulder top, Black asymmetrical skirt","Black handbag, Black strappy sandals","Asymmetrical, Fitted","Minimalist, Modern",Clean lines with a monochrome palette
1,Courrèges,Spring 2024,Feminine,Black off-shoulder dress,"Black sunglasses, Black handbag, Strappy black heels","Asymmetrical, Fitted","Minimalist, Modern",Features a high slit and off-shoulder design.
1,Courrèges,Spring 2024,Feminine,"White oversized jacket, Black mini skirt",Black strappy heels,"Oversized top, A-line skirt","Minimalist, Modern",Off-shoulder jacket styling
1,Courrèges,Spring 2024,Feminine,"White asymmetrical blouse, Black crocodile-textured wrap skirt, Black crocodile-textured thigh-high boots",Silver pendant necklace,"Fitted, Layered","Modern, Edgy, Textured",Innovative use of textures and layering
1,Courrèges,Spring 2024,Feminine,"Striped sleeveless shirt with white collar, Black leather pants with zippers","Pendant necklace, Rings","Fitted top, Flared pants","Edgy, Modern",Asymmetrical collar detail
