Look Number,Designer,Season,Gender Presentation,Garments,Accessories,Silhouette,Style Keywords,Notes
1,Helmut Lang,Fall 2024,Feminine,"Sheer white bubble wrap shirt, Sheer white bubble wrap pants",Black pointed shoes,"Straight, Relaxed","Avant-garde, Minimalist",Unique use of bubble wrap texture
1,Helmut Lang,Fall 2024,Masculine,"Black textured sleeveless top, Black textured pants",Black shoes,Straight,Minimalist,"Futuristic, structured"
1,Helmut Lang,Fall 2024,Feminine,"Orange cut-out turtleneck, Orange textured pants",Black clutch,"Fitted top, Straight-leg pants","Bold, Modern, Edgy",Strong color contrast and texture
1,Helmut Lang,Fall 2024,Menswear,"White quilted hooded coat, white textured top, sheer textured pants",None,Oversized,"Futuristic, Minimalist",Monochromatic look with layered textures
1,Helmut Lang,Fall 2024,Feminine,"Black tailored blazer, Black sequin shirt, Black trousers",Black handbag,"Structured, Tailored","Minimalist, Edgy",Dark eye makeup adds a dramatic touch
1,Helmut Lang,Fall 2024,Masculine,"Black textured jacket, white shirt, black trousers",Black leather bag,Relaxed,"Modern, Edgy",Minimalist design with textured elements
1,Helmut Lang,Fall 2024,Masculine,"Black double-breasted blazer, White textured shirt, Black ruched pants",None,"Structured, Slim","Minimalist, Modern",Classic tailoring with a contemporary twist
1,Helmut Lang,Fall 2024,Feminine,"White sheer blouse, Black textured pants",Black belt,"Relaxed, Straight","Minimalist, Edgy","Deep V-neck blouse, Structured pants"
1,Helmut Lang,Fall 2024,Feminine,"Black tailored coat, Sheer black top, Black pants",Belt,"Structured, Longline","Minimalist, Edgy",Monochromatic look with a focus on tailoring and transparency.
