Look Number,Designer,Season,Gender Presentation,Garments,Accessories,Silhouette,Style Keywords,Notes
1,Bally,Spring 2024,Feminine,"Black tailored blazer, Black mini skirt, Light blue shirt","Black structured handbag, Black Mary Jane shoes",Boxy,"Minimalist, Chic",Classic tailoring with a modern twist
1,Bally,Spring 2024,Feminine,"Light blue short-sleeve shirt, Black wrap skirt","Black leather handbag, Black oxford shoes","Tailored, Asymmetrical","Minimalist, Chic",Classic color contrast with a modern twist
1,Bally,Spring 2024,Androgynous,"Black tailored jacket, Black tailored trousers","Black leather handbag, Black Mary Jane shoes","Structured, Relaxed","Minimalist, Sophisticated",Classic black ensemble with a modern twist
1,Bally,Spring 2024,Masculine,"Navy tailored jacket, Light blue shirt, Navy trousers","Navy leather bag, Black boots","Structured, Tailored","Classic, Minimalist",Sophisticated and clean lines
1,Bally,Spring 2024,Feminine,"Black leather blazer, Light blue shirt, Black leather shorts","Black handbag, Black loafers","Structured, Tailored","Chic, Modern, Edgy","The look combines classic tailoring with a modern, edgy twist."
1,Bally,Spring 2024,Masculine,"Black leather jacket, Navy wide-leg trousers","Yellow sunglasses, Black leather bag","Oversized, Relaxed","Modern, Sleek",Minimalist design with a focus on texture and silhouette.
1,Bally,Spring 2024,Masculine,"Light blue short-sleeve shirt, Navy pleated trousers","Blue cap, Yellow sunglasses, Navy leather briefcase","Relaxed, Tailored","Casual, Sophisticated",Classic color palette with a modern twist
1,Bally,Spring 2024,Androgynous,"Navy oversized blazer, Navy top","Burgundy structured handbag, Black studded flats","Oversized, Tailored","Minimalist, Modern","Clean lines, Neutral palette"
1,Bally,Spring 2024,Masculine,"Navy blazer, Navy trousers, White shirt",Black shoes,Tailored,"Classic, Minimalist",Simple and elegant with a focus on clean lines
