Look Number,Designer,Season,Gender Presentation,Garments,Accessories,Silhouette,Style Keywords,Notes
1,Markarian,Fall 2024,Feminine,"Blue V-neck gown with flutter sleeves, Silver sequin gown with floral shoulder detail",Earrings,"Fitted, Floor-length","Elegant, Glamorous",Contrasting textures and colors
1,Markarian,Fall 2024,Feminine,"Light blue wrap dress, long sleeves",Pearl earrings,Fitted bodice with flared skirt,"Elegant, Classic","Set in an ornate room, vintage-inspired"
1,Markarian,Fall 2024,Feminine,"White peplum jacket, Cream satin wide-leg pants, Black long coat","Silver pointed heels, Black pointed heels, Necklace","Tailored, Flared","Elegant, Minimalist",Contrasting textures and colors
1,Markarian,Fall 2024,Feminine,"Ivory gown, sequin embellishments",Drop earrings,"Fitted, floor-length","Elegant, opulent",Set in a richly decorated room
1,Markarian,Fall 2024,Feminine,"Ivory satin slip dress, sheer polka dot overlay",None visible,A-line,"Elegant, Minimalist",Features a delicate sheer overlay with polka dots
1,Markarian,Fall 2024,Feminine,"Strapless floral embroidered bodice, black satin full skirt",Earrings,"Fitted bodice, voluminous skirt","Elegant, Dramatic",Intricate embroidery with a classic silhouette
1,Markarian,Fall 2024,Feminine,"Metallic brocade mini dress, Metallic brocade off-shoulder gown",Earrings,Fitted,"Elegant, Glamorous",Rich texture with intricate patterns
1,Markarian,Fall 2024,Feminine,"Floral print dress, Burgundy strapless gown",Necklace,"A-line, Fitted","Elegant, Eveningwear",Rich textures and patterns
1,Markarian,Fall 2024,Feminine,"Red multicolor patchwork coat, White tailored suit with lace details","Earrings, Necklace","Tailored, Flowing","Elegant, Textured",Contrasting vibrant and neutral tones
