Look Number,Designer,Season,Gender Presentation,Garments,Accessories,Silhouette,Style Keywords,Notes
1,Greta Constantine,Fall 2024,Feminine,Pink satin gown with ruffled neckline,None,A-line,"Elegant, Dramatic, Statement",Features voluminous ruffles and a sleek satin finish.
1,Greta Constantine,Fall 2024,Feminine,Black velvet gown with ruffled details,None,Fitted,"Elegant, Dramatic","High neckline, long sleeves, textured embellishments"
1,Greta Constantine,Fall 2024,Feminine,Navy blue gown with green satin drape,Metallic silver heels,A-line,"Elegant, Dramatic",Features a bold green drape detail
1,Greta Constantine,Fall 2024,Feminine,"Gold sequined top, Gold sequined wide-leg pants",None,Relaxed,"Glamorous, Eveningwear",Dramatic use of gold sequins for a bold statement look.
1,Greta Constantine,Fall 2024,Feminine,"Pink satin ruffled blouse, Green full skirt",Silver pointed heels,"Voluminous, Structured","Bold, Elegant","Dramatic ruffles, Color contrast"
1,Greta Constantine,Fall 2024,Feminine,"Black sleeveless gown, Burgundy velvet cape",None,"Fitted, Floor-length","Elegant, Dramatic",Rich textures with a striking color contrast
1,Greta Constantine,Fall 2024,Feminine,"Black jumpsuit with white ruffled neckline, black ruffled cuffs",None,Wide-leg,"Dramatic, Elegant",Bold ruffle details
1,Greta Constantine,Fall 2024,Feminine,"Black and gold sequin gown, sleeveless, ruffled details",None,Column,"Elegant, Eveningwear",Intricate texture with reflective sequins
1,Greta Constantine,Fall 2024,Feminine,Black long-sleeve gown with pink structured hem,Clear heels,Fitted with dramatic hem,"Elegant, Modern",Contrast between sleek upper and voluminous lower part
