Look Number,Designer,Season,Gender Presentation,Garments,Accessories,Silhouette,Style Keywords,Notes
1,Giambattista Valli,Fall 2024,Feminine,"Black tailored coat, White turtleneck, White trousers",Black sunglasses,"Long, tailored","Chic, Minimalist",Classic black and white ensemble with a focus on clean lines.
1,Giambattista Valli,Fall 2024,Feminine,Ivory textured mini dress,Black strappy sandals,A-line,"Minimalist, Elegant",Simple yet sophisticated look
1,Giambattista Valli,Fall 2024,Feminine,"Cream double-breasted coat, wool",None,"Long, tailored","Elegant, minimalist",Classic design with modern simplicity
1,Giambattista Valli,Fall 2024,Feminine,"Ivory satin mini dress, embellished neckline","White clutch, embellished black shoes",A-line,"Elegant, Minimalist",Features intricate embellishments on neckline and cuffs
1,Giambattista Valli,Fall 2024,Feminine,"Black double-breasted coat, White turtleneck",Black strappy sandals,"Tailored, Knee-length","Chic, Minimalist",Classic black and white contrast
1,Giambattista Valli,Fall 2024,Feminine,"White embroidered mini dress, sheer white sleeves",Black embellished sandals,A-line,"Elegant, Vintage, Ornate","Intricate embroidery details, classic silhouette"
1,Giambattista Valli,Fall 2024,Gender Neutral,"Cream tailored jacket, cream straight-leg trousers","Oversized sunglasses, black loafers","Structured, elongated","Minimalist, elegant",Monochromatic look with clean lines
1,Giambattista Valli,Fall 2024,Feminine,Black sequin and sheer mini dress with gold embellishments,Black strappy shoes,"Fitted, Mini","Glamorous, Edgy",Features intricate beadwork and sheer paneling
1,Giambattista Valli,Fall 2024,Feminine,Black embellished mini dress,"Black handbag, black strappy shoes","A-line, mini","Chic, elegant",Embellished sleeves and neckline add glamour.
