Look Number,Designer,Season,Gender Presentation,Garments,Accessories,Silhouette,Style Keywords,Notes
1,Zomer,Fall 2024,Gender Neutral,"Gray wool coat, red and pink layered skirt","Silver shoulder embellishment, red embellished shoes","Structured, layered","Avant-garde, bold","Innovative shoulder detail, color block design"
1,Zomer,Fall 2024,Androgynous,"Gray and green layered wrap top, Blue sheer skirt, Multicolored leggings","Blue embellished shoes, Gold earrings","Layered, Asymmetrical","Avant-garde, Textured",Bold color blocking with unique textures
1,Zomer,Fall 2024,Gender Neutral,"Red structured long dress, leather texture",Blue bracelet,"Boxy, oversized","Futuristic, avant-garde",Features exaggerated shoulders and asymmetrical slit
1,Zomer,Fall 2024,Feminine,"Black long coat, Black padded shoulder piece","Black statement earrings, Black textured heels","Structured, Oversized shoulders","Avant-garde, Minimalist",Bold padded shoulder piece adds a dramatic element.
1,Zomer,Fall 2024,Androgynous,Burgundy and olive leather coat with metallic fringe,Sneakers with pink embellishments,"Oversized, Structured","Avant-garde, Futuristic",Bold metallic fringe detail on shoulders
1,Zomer,Fall 2024,Feminine,"Beige structured blazer with red embellishment, Black high-waisted skirt, Pink chiffon underlayer",Green textured mules,"Structured, Layered","Avant-garde, Textured",Asymmetrical shoulder embellishment adds drama.
1,Zomer,Fall 2024,Feminine,Black structured long dress,Purple textured sandals,Straight,"Minimalist, Avant-garde",Features a central slit and exaggerated shoulders.
1,Zomer,Fall 2024,Feminine,"Blue long-sleeve dress, translucent sculptural bodice",Blue textured sandals,"Fitted top, flared skirt","Avant-garde, Futuristic","Innovative use of materials, bold color"
1,Zomer,Fall 2024,Gender Neutral,"Red bodysuit, Black sculptural chest piece",White textured slippers,"Fitted, Streamlined","Avant-garde, Futuristic",Bold use of color and sculptural elements
