Look Number,Designer,Season,Gender Presentation,Garments,Accessories,Silhouette,Style Keywords,Notes
1,Fforme,Spring 2024,Gender Neutral,"Beige long coat, Black tunic, Beige wide-leg trousers",White slip-on shoes,"Relaxed, Flowing","Minimalist, Modern",Neutral palette with a focus on clean lines and layering.
1,Fforme,Spring 2024,Feminine,"Cream double-breasted blazer, Cream wide-leg trousers",Black sandals,"Relaxed, Oversized","Minimalist, Chic","Deep V-neckline, Neutral palette"
1,Fforme,Spring 2024,Gender Neutral,"Black sleeveless maxi dress, flowy, lightweight fabric",Sandals,Loose,"Minimalist, Elegant",Simple yet sophisticated design
1,FFORME,Spring 2024,Feminine,"White oversized top, White wide-leg trousers",White sandals,"Relaxed, Flowing","Minimalist, Monochrome",Clean lines with a focus on simplicity
1,Fforme,Spring 2024,Feminine,"Pink long-sleeve dress, Brown pants",White sandals,"Straight, Relaxed","Minimalist, Elegant",Simple and understated design
1,Fforme,Spring 2024,Feminine,"Brown loose-fitting top, Brown wide-leg trousers",White sandals,"Relaxed, Flowing","Minimalist, Monochromatic",Simple and elegant design with a focus on comfort.
1,Fforme,Spring 2024,Masculine,"Pink oversized top, Pink wide-leg trousers",White shoes,"Relaxed, Oversized","Minimalist, Monochrome",Simple and elegant with a focus on color and shape.
1,Fforme,Spring 2024,Feminine,"Mauve tunic, Mauve wide-leg pants",Black sandals,"Loose, Flowing","Minimalist, Elegant",Monochromatic look with simple lines
