Look Number,Designer,Season,Gender Presentation,Garments,Accessories,Silhouette,Style Keywords,Notes
1,Erdem,Fall 2024,Feminine,"Mint green oversized coat, white bustier, mint green skirt",Gold brooch,"Structured, Oversized","Elegant, Modern, Vintage-inspired","Feathered shoes, bold makeup"
1,Erdem,Fall 2024,Feminine,"Herringbone dress, grey, fringed","Black leather gloves, statement earrings","Fitted, asymmetrical","Elegant, textured",Features herringbone pattern with raw edges
1,Erdem,Fall 2024,Feminine,"Floral houndstooth coat, Floral houndstooth skirt","Pearl earrings, Black gloves, Feathered shoes, Headband","Structured, Longline","Elegant, Vintage-inspired",Bold floral and houndstooth pattern mix
1,Erdem,Fall 2024,Gender Neutral,"Herringbone coat, Grey, Wool",Gold brooch,"Oversized, Draped","Textured, Elegant","Frayed edges, Monochrome"
1,Erdem,Fall 2024,Feminine,"Floral print sheer dress, yellow and green, pleated texture","White feathered shoes, black headband","Asymmetrical, fitted","Romantic, ethereal",Delicate floral pattern with a modern twist
1,Erdem,Fall 2024,Feminine,"Mustard wool coat with wide collar, matching skirt",Gold brooch,"Structured, Midi","Elegant, Sophisticated",The coat features a unique wide collar and double-breasted design.
1,Erdem,Fall 2024,Feminine,"Floral print dress, green and yellow, strapless, pleated",Pearl earrings,A-line,"Elegant, Romantic",Features bold green stripes and floral pattern
1,Erdem,Fall 2024,Feminine,"White lace top, Sheer white skirt, Multicolor feathered coat",Feathered shoes,Flowing,"Ethereal, Avant-garde",Dramatic feather detailing
1,Erdem,Fall 2024,Feminine,"Tweed coat, Tweed skirt, Knit top",Earrings,"Layered, Longline","Textured, Elegant","Black and yellow tweed pattern, Feathered shoes"
