Look Number,Designer,Season,Gender Presentation,Garments,Accessories,Silhouette,Style Keywords,Notes
1,Frederick Anderson,Fall 2024,Feminine,"Sheer star-patterned dress, black lace",Black shoes,A-line,"Sheer, Elegant, Playful",Star pattern adds a whimsical touch
1,Frederick Anderson,Fall 2024,Feminine,"Black sequin V-neck top, Black sequin pants",None,Relaxed,"Glamorous, Eveningwear",Minimalist styling with bold makeup
1,Frederick Anderson,Fall 2024,Androgynous,"Patterned suit, Sheer star-patterned blouse",None visible,"Relaxed, Straight","Glam rock, Vintage","Bold makeup, Retro hairstyle"
1,Frederick Anderson,Fall 2024,Feminine,"Black mesh one-shoulder top, Black textured skirt",Black pointed heels,Form-fitting,"Edgy, Modern","Bold eye makeup, Minimalist accessories"
1,Frederick Anderson,Fall 2024,Feminine,"Mint green textured coat, Black lace-trimmed dress",Black pointed heels,"Flowy, Relaxed","Elegant, Retro",Bold eye makeup and blonde wig
1,Frederick Anderson,Fall 2024,Feminine,"Black, open-knit, one-shoulder dress",Black heels,Fitted,"Edgy, Modern, Textured","Sheer, bold makeup"
1,Frederick Anderson,Fall 2024,Feminine,"Mint green textured suit, open-front jacket, wide-leg pants",None visible,"Relaxed, flowing","Retro, bold, androgynous","Bold eye makeup, 80s-inspired hairstyle"
1,Frederick Anderson,Fall 2024,Feminine,"Mint satin off-shoulder top, Mint sequin pencil skirt",Black heels,Fitted,"Elegant, Glamorous",The look combines a shiny satin top with a textured sequin skirt for a sophisticated appearance.
1,Frederick Anderson,Fall 2024,Feminine,Green lace top and skirt,Black pointed heels,"Fitted, Sheer","Lace, Elegant, Evening","Bold makeup, Retro hairstyle"
