Look Number,Designer,Season,Gender Presentation,Garments,Accessories,Silhouette,Style Keywords,Notes
1,Fforme,Fall 2024,Feminine,"Brown tailored blazer, Brown draped top, Brown high-waisted trousers","White knit beanie, White shoes","Relaxed, Structured","Minimalist, Elegant",Monochromatic look with a focus on clean lines and subtle draping.
1,FFORME,Fall 2024,Feminine,"Green draped sleeveless top, Green wide-leg pants",White shoes,Flowing,"Minimalist, Elegant",Monochromatic green ensemble with draped detailing
1,Fforme,Fall 2024,Feminine,"Black leather coat, Green draped top, Black leather wide-leg pants",Green knit beanie,"Relaxed, Oversized","Minimalist, Modern",Monochrome with a pop of color
1,Fforme,Fall 2024,Gender Neutral,"White structured top, Green wide-leg pants",Silver hoop earring,"Oversized top, Relaxed pants","Minimalist, Modern",Clean lines with a bold color contrast
1,Fforme,Fall 2024,Feminine,"Green tailored suit, White oversized coat","White knit cap, Brown sunglasses, White slip-on shoes","Structured, Tailored","Minimalist, Elegant",Contrasting colors with a focus on clean lines and simplicity.
0,Fforme,Fall 2024,Feminine,"Black leather jacket, Black leather pants",Silver earrings,"Relaxed, Structured","Minimalist, Modern",Monochromatic leather ensemble with understated elegance
