Look Number,Designer,Season,Gender Presentation,Garments,Accessories,Silhouette,Style Keywords,Notes
1,Edward Crutchley,Fall 2024,Masculine,"Brown and white patterned oversized coat, Beige sweater","Patterned cowboy hat, Round sunglasses",Oversized,"Western, Avant-garde","Bold pattern, Layered textures"
1,Edward Crutchley,Fall 2024,Gender Neutral,"Oversized black bomber jacket with graphic patches, Fuzzy black and white patterned skirt","Beaded face veil, Black patent shoes","Voluminous top, Straight skirt","Avant-garde, Textured, Graphic",Dramatic proportions with a mix of textures
1,Edward Crutchley,Fall 2024,Gender Neutral,"Patterned long coat, Graphic print dress","White cowboy hat, Round sunglasses","Oversized, Layered","Eclectic, Artistic, Western",Mix of patterns and textures with a bold graphic element.
1,Edward Crutchley,Fall 2024,Gender Neutral,"Brown oversized jacket, Tapestry-patterned skirt, Graphic knit sweater","Small sunglasses, White socks, Black shoes","Oversized top, Straight skirt","Eclectic, Vintage-inspired, Artistic",Rich tapestry patterns and graphic motifs
1,Edward Crutchley,Fall 2024,Masculine,"Patchwork jacket, multicolor knit sweater, brown and beige pants","Fuzzy bucket hat, round sunglasses","Oversized, relaxed","Eclectic, layered, textured",Intricate patterns on sleeves and pants
1,Edward Crutchley,Fall 2024,Gender Neutral,"Oversized black coat, Animal print turtleneck, Patterned pants",Round sunglasses,"Oversized, Layered","Avant-garde, Bold","Mix of textures and patterns, Dramatic proportions"
1,Edward Crutchley,Fall 2024,Masculine,"Patterned long coat, Tapestry pants","Patterned cowboy hat, Round sunglasses, Necklace",Oversized,"Eclectic, Bold, Western",Features intricate tapestry patterns and a mix of textures.
1,Edward Crutchley,Fall 2024,Gender Neutral,"Oversized coat, black and beige, tapestry print",Round sunglasses,Oversized,"Eclectic, Avant-garde",Intricate pattern with historical motifs
