Look Number,Designer,Season,Gender Presentation,Garments,Accessories,Silhouette,Style Keywords,Notes
1,Matty Bovan,Fall 2024,Gender Neutral,"Oversized houndstooth coat, Layered textiles",None visible,"Voluminous, Layered","Avant-garde, Experimental","Bold use of patterns and textures, Artistic expression"
1,Matty Bovan,Fall 2024,Gender Fluid,"Patchwork coat, white and red, textured",None visible,"Oversized, layered","Avant-garde, eclectic","Mix of textures and patterns, deconstructed aesthetic"
1,Matty Bovan,Fall 2024,Gender Neutral,"Brown tweed jacket with blue fringe, Floral textured dress",Metallic tinsel headpiece,"Oversized, Layered","Avant-garde, Eclectic",Mix of textures and bold colors
1,Matty Bovan,Fall 2024,Gender Neutral,"Patchwork coat, Multicolor, Textured",None,"Oversized, Layered","Avant-garde, Eclectic",Bold use of mixed patterns and textures
1,Matty Bovan,Fall 2024,Gender Neutral,"Oversized tweed jacket, Pink layered skirt",None visible,"Voluminous, Layered","Avant-garde, Experimental",Features exaggerated proportions and mixed textures.
1,Matty Bovan,Fall 2024,Feminine,"Orange and black checkered coat and skirt, fringed edges",Colorful headpiece,"Oversized, layered","Avant-garde, eclectic","Bold pattern, intricate headpiece"
1,Matty Bovan,Fall 2024,Feminine,"Pink plaid structured top, Multicolored textured skirt, Sheer patterned tights",Multicolored headpiece,"Voluminous, Layered","Avant-garde, Eclectic",Bold textures and colors with a historical painting backdrop
1,Matty Bovan,Fall 2024,Gender Fluid,"Pink satin dress, multicolored knit shawl","Large earrings, headpiece","Layered, voluminous","Eclectic, avant-garde","Mix of textures and colors, theatrical presentation"
