Look Number,Designer,Season,Gender Presentation,Garments,Accessories,Silhouette,Style Keywords,Notes
1,Sergio Hudson,Fall 2024,Feminine,"Pinstripe suit, Tan corset",None visible,Tailored,"Power dressing, Modern",Mix of classic tailoring with modern corsetry
1,Sergio Hudson,Fall 2024,Feminine,Tan leather shirt dress,"Brown belt, Tan leather boots","Fitted, Longline","Chic, Sleek, Modern",Monochromatic leather ensemble with structured elegance.
1,Sergio Hudson,Fall 2024,Feminine,"Brown corduroy belted jacket, Houndstooth wide-leg pants",Black hijab,Tailored,"Chic, Sophisticated",Mix of textures with classic patterns
1,Sergio Hudson,Fall 2024,Feminine,Navy blue long-sleeve gown,Silver strappy heels,"Fitted, floor-length","Elegant, Minimalist",Simple yet sophisticated design
1,Sergio Hudson,Fall 2024,Feminine,"Black tailored blazer, black corset top, black wide-leg trousers",None,"Structured, Fitted","Elegant, Sophisticated",Monochromatic black ensemble with a focus on tailoring and structure.
1,Sergio Hudson,Fall 2024,Feminine,"Pinstripe jumpsuit, Navy coat",Pointed heels,"Tailored, Oversized coat","Chic, Sophisticated",Classic pinstripe with modern tailoring
1,Sergio Hudson,Fall 2024,Feminine,"Black turtleneck bodysuit, Black fitted pants","Wide black belt, Black knee-high boots","Fitted, Sleek","Chic, Modern, Monochrome",Elegant all-black ensemble with a focus on silhouette and minimalism.
