Look Number,Designer,Season,Gender Presentation,Garments,Accessories,Silhouette,Style Keywords,Notes
1,Ashlyn,Spring 2024,Feminine,"Black long-sleeve top with ruffled hem, Black skirt",Black leather shoes,"Fitted top, Flared skirt","Minimalist, Modern",Monochrome look with subtle texture contrast
1,Ashlyn,Spring 2024,Feminine,"Black pleated blazer, White ruffled shorts",Black ankle boots,"Structured, Flared","Modern, Edgy",Playful contrast with structured blazer and ruffled shorts
1,Ashlyn,Spring 2024,Feminine,"Black pleated blazer, Black pleated skirt",Black knee-high boots,"Structured, Pleated","Modern, Chic",Monochrome black ensemble with a tailored fit
1,Ashlyn,Spring 2024,Feminine,"Black pleated jacket, black pleated top with white ruffle detail, black wide-leg pants",Black slide sandals,"Relaxed, Flowing","Minimalist, Elegant",Monochrome with subtle contrast detail
1,Ashlyn,Spring 2024,Feminine,"Black sleeveless jumpsuit, White floral detail","Gold ring, White shoes","Straight, Long","Minimalist, Modern",Elegant use of floral detail and clean lines
1,Ashlyn,Spring 2024,Feminine,"White sleeveless blouse with ruffled hem, Black maxi skirt",Black patent leather shoes,Fitted top with voluminous skirt,"Minimalist, Elegant",Classic monochrome look with a modern twist
1,Ashlyn,Spring 2024,Feminine,"Black zip-up vest, white ruffled shirt, black wide-leg trousers",None,"Tailored, Flowing","Minimalist, Monochrome",Elegant contrast between structured top and flowing pants
1,Ashlyn,Spring 2024,Feminine,"White structured crop top, White wide-leg trousers",None visible,Tailored,"Minimalist, Modern",Clean lines with a focus on structure
1,Ashlyn,Spring 2024,Feminine,"Black cropped blazer, white ruffled blouse, black wide-leg pants",Black platform shoes,"Structured, Cropped","Modern, Minimalist",Monochrome palette with a focus on sharp tailoring.
