Look Number,Designer,Season,Gender Presentation,Garments,Accessories,Silhouette,Style Keywords,Notes
1,Susan Fang,Fall 2024,Feminine,"Pink and white puffy jacket, Sheer lace bra and panties","Beaded earrings, Crochet white boots","Voluminous top, Fitted bottom","Ethereal, Avant-garde, Delicate","Bubble-like texture, Playful elements"
1,Susan Fang,Fall 2024,Feminine,"Rainbow knit crop top, White lace bralette, White floral applique skirt, Light blue pants","Beaded mini bag, Statement necklace","Fitted top, Layered bottom","Playful, Layered, Textured",Mix of textures and pastel colors
1,Susan Fang,Fall 2024,Feminine,"Lavender crochet asymmetrical top, White textured maxi skirt","Gray clutch, Statement earrings","Fitted top, Flowing skirt","Ethereal, Artistic, Modern","Intricate crochet detailing, Playful textures"
1,Susan Fang,Fall 2024,Feminine,"Brown turtleneck sweater, striped mini skirt",Beaded handbag,"Fitted top, mini skirt","Eclectic, playful, layered",Mix of textures and colors
1,Susan Fang,Fall 2024,Feminine,"Blue netted dress, Sheer underlayer","Statement earrings, Beaded necklace, Pink woven shoes","Fitted, Sheer","Ethereal, Avant-garde",Incorporates bubbles as part of the presentation
1,Susan Fang,Fall 2024,Feminine,"Pink floral puffer coat, Pink tulle dress","Black woven clutch, Black crochet boots","Voluminous, Layered","Avant-garde, Playful","Textured floral design, Layered tulle"
1,Susan Fang,Fall 2024,Feminine,"Sheer, multicolored, ruffled dress","Large, transparent earrings","Loose, flowing","Ethereal, delicate",Intricate texture with layered ruffles
1,Susan Fang,Fall 2024,Feminine,"White sheer ruffled dress, Blue underlayer",Black textured handbag,"Flowy, Layered","Ethereal, Romantic","Delicate floral texture, Light and airy feel"
