Look Number,Designer,Season,Gender Presentation,Garments,Accessories,Silhouette,Style Keywords,Notes
1,ATXV,Spring 2024,Masculine,"Yellow knit sleeveless top, Beige trousers","White belt, Silver necklace, Rings",Relaxed fit,"Casual, Minimalist",Simple yet stylish with a focus on texture and color contrast.
1,ATXV,Spring 2024,Feminine,"Yellow knit dress, Mustard underlayer",Silver rings,"Fitted, Asymmetrical","Textured, Layered",Features twisted knit detail
1,ATXV,Spring 2024,Feminine,"Beige draped cut-out dress, Black bodysuit",None,"Fitted, Asymmetrical","Avant-garde, Edgy",Innovative use of draping and cut-outs
1,ATXV,Spring 2024,Feminine,"Beige draped dress, black mesh underlayer",Black sandals,"Asymmetrical, Draped","Minimalist, Avant-garde","Sheer elements, High slit"
1,ATXV,Spring 2024,Masculine,"Sheer white short-sleeve shirt, Beige trousers","White belt, Thin chain necklace, Braided headband",Relaxed fit,"Minimalist, Modern, Edgy",Subtle layering with sheer fabric
1,ATXV,Spring 2024,Feminine,"White and black bralette, White pants with black and beige fringe",Black sunglasses,"Fitted top, Loose pants","Modern, Edgy, Minimalist",Fringe detailing adds movement and texture
1,ATXV,Spring 2024,Feminine,"White cut-out dress, black underlayer","Black sunglasses, rings","Fitted, asymmetrical","Modern, edgy, minimalist",Features bold cut-outs and a high slit
1,ATXV,Spring 2024,Feminine,"White draped top, White skirt with slit",Black belt,"Asymmetrical, Fitted","Minimalist, Edgy",Clean lines with a focus on draping
