Look Number,Designer,Season,Gender Presentation,Garments,Accessories,Silhouette,Style Keywords,Notes
1,Roland Mouret,Fall 2024,Feminine,"Ribbed knit top, burgundy; Skirt, burgundy",Gold hoop earrings,"Fitted, Peplum","Elegant, Sophisticated","Rich color, Textured knit"
1,Roland Mouret,Fall 2024,Feminine,"Dark purple tailored blazer, Dark purple wide-leg trousers",Gold hoop earrings,"Structured, Tailored","Sophisticated, Elegant","Deep V-neckline, Monochromatic"
1,Roland Mouret,Fall 2024,Feminine,Black velvet strapless gown,Gold hoop earrings,Fitted,"Elegant, Sophisticated",Minimalist design with a deep V-neckline
1,Roland Mouret,Fall 2024,Feminine,"Cream tailored vest, Cream tailored trousers",Gold hoop earrings,"Structured, Tailored","Minimalist, Chic",Monochrome look with clean lines
1,Roland Mouret,Fall 2024,Feminine,"Black sleeveless dress, white accent, fitted","Gold earrings, black heels","Fitted, midi length","Elegant, minimalist",Sophisticated evening wear with a monochrome palette
1,Roland Mouret,Fall 2024,Feminine,"Strapless black gown, white satin detail",Gold hoop earrings,"Fitted, Asymmetrical","Elegant, Minimalist",Features a thigh-high slit and structured waist detail.
1,Roland Mouret,Fall 2024,Feminine,"Red strapless peplum top, Red skirt",Gold hoop earrings,"Fitted, Peplum","Elegant, Sophisticated",Structured design with bold color
1,Roland Mouret,Fall 2024,Feminine,"Black off-shoulder jumpsuit, fitted, flared legs","Black belt, hoop earrings","Fitted bodice, flared legs","Chic, Elegant, Modern",Sophisticated evening wear
