Look Number,Designer,Season,Gender Presentation,Garments,Accessories,Silhouette,Style Keywords,Notes
1,Bora Aksu,Spring 2024,Feminine,"Black and white lace top, matching lace trousers","White and black patterned cap, black and white shoes","Fitted top with peplum, straight leg trousers","Intricate, Lace, Monochrome",Detailed lace pattern with a vintage-inspired silhouette
1,Bora Aksu,Spring 2024,Feminine,"Layered lace dress, white and black, embroidered tulle overlay","Patchwork hat, embellished socks, black and white shoes","A-line, tiered","Romantic, Vintage, Intricate",Delicate embroidery with floral and bow details
1,Bora Aksu,Spring 2024,Feminine,"Sheer floral embroidered blouse, Sheer floral embroidered skirt","Patterned hat, Patterned socks, Patterned shoes","A-line, Layered","Romantic, Vintage-inspired","Monochrome floral patterns, Sheer layers"
1,Bora Aksu,Spring 2024,Feminine,"Blue crochet top, sheer blouse, lace skirt","Crochet hat, gold strappy shoes","Fitted top, flared skirt","Romantic, Vintage, Whimsical","Intricate crochet details, pastel color palette"
1,Bora Aksu,Spring 2024,Feminine,"Blue lace crop top, Blue lace trousers","Crochet hat, Sunglasses, Sheer gloves, White shoes","Fitted top, Straight-leg pants","Romantic, Vintage, Feminine","Delicate lace detailing, Pastel color palette"
1,Bora Aksu,Spring 2024,Feminine,"Light blue tailored blazer, White blouse, Light blue skirt with fringe","Crochet hat, Sunglasses, White strappy shoes","Structured, Tailored","Chic, Modern, Elegant","Fringe detail adds movement, Crochet hat adds texture"
1,Bora Aksu,Spring 2024,Feminine,"Black layered coat with lace collar, White floral lace dress","Mesh hat, Black belt, Patterned socks, Embellished shoes","Layered, A-line","Victorian, Romantic, Layered",Mix of textures and patterns with a vintage-inspired look.
1,Bora Aksu,Spring 2024,Feminine,"Floral lace dress, White satin skirt","Floral headband, Gold strappy shoes","A-line, Layered","Romantic, Vintage, Elegant","Intricate lace detailing, Soft color palette"
1,Bora Aksu,Spring 2024,Feminine,"Structured jacket, patterned pants, lace sleeves","Mesh hat, floral choker","Layered, tailored","Victorian, modern, intricate",Combines historical elements with contemporary design
