Look Number,Designer,Season,Gender Presentation,Garments,Accessories,Silhouette,Style Keywords,Notes
1,Philipp Plein,Fall 2024,Feminine,"Black patterned blazer, black crop top, black patterned shorts","Black patterned cap, black sunglasses, black patterned boots, black handbag","Structured, fitted","Bold, modern, edgy","Monogram pattern throughout, coordinated accessories"
1,Philipp Plein,Fall 2024,Masculine,"White logo sweater, Distressed blue jeans","Chain belt, White sneakers","Relaxed, Casual","Streetwear, Bold","Logo-centric design, Distressed denim"
1,Philipp Plein,Fall 2024,Feminine,"Logo-patterned mini dress, navy, fitted","Silver glitter thigh-high boots, Silver and black handbag","A-line, Mini","Glam, Retro, Bold",Features chain straps and logo pattern
1,Philipp Plein,Fall 2024,Feminine,"Black long-sleeve gown, logo pattern, thigh-high slit","Black handbag, black platform heels","Fitted, high slit","Glamorous, edgy","Bold logo pattern, structured shoulders"
1,Philipp Plein,Fall 2024,Feminine,"Blue patterned coat, Black patterned mini dress","Black patterned handbag, Oversized sunglasses","Structured, Mini","Bold, Monogram, Glamorous",Coordinated monogram pattern throughout the look
1,Philipp Plein,Fall 2024,Masculine,"Distressed denim jacket, distressed denim jeans, white turtleneck sweater","Chunky chain necklace, black combat boots","Relaxed, layered","Grunge, edgy, streetwear",Denim-on-denim with distressed details
1,Philipp Plein,Fall 2024,Feminine,"Monogrammed navy blazer, Monogrammed navy wide-leg pants, Monogrammed navy long coat","Sunglasses, Statement choker","Oversized, Structured","Bold, Monogram, Glamorous",Logo-centric design with a strong visual impact.
1,Philipp Plein,Fall 2024,Menswear,"Patterned suit, black turtleneck","Sunglasses, chain belt","Relaxed, tailored","Bold, monogram, modern",Features a monogram pattern with a casual yet sophisticated vibe.
