Look Number,Designer,Season,Gender Presentation,Garments,Accessories,Silhouette,Style Keywords,Notes
1,Chanel,Spring 2024,Feminine,"Tweed jumpsuit, multicolor, textured","Layered necklaces, statement glasses","Relaxed, flowing","Chic, modern, elegant","Deep V-neckline, classic Chanel tweed"
1,Chanel,Spring 2024,Feminine,"Multicolor tweed coat, Pink bralette","Sunglasses, Layered necklaces","Long, Straight","Chic, Elegant",Classic Chanel tweed with modern accessories
1,Chanel,Spring 2024,Feminine,"Blue textured swimsuit, ""Multicolored geometric coat""","Black glasses, Black crossbody bag, Black bracelet, Black sandals",Fitted swimsuit with oversized coat,"Chic, Modern, Vibrant",Bold geometric patterns with classic swimwear
1,Chanel,Spring 2024,Feminine,"Striped white blouse, Multicolored knit pants",Beaded necklace,Relaxed,"Bohemian, Chic","Open blouse, vibrant pattern"
1,Chanel,Spring 2024,Feminine,"White pleated dress with black trim, deep V-neck, sheer fabric","Black quilted bag, chain belt, long necklace, black gloves","Flowy, A-line","Elegant, Modern, Chic","The look combines classic Chanel elements with a modern twist, featuring a mix of textures and accessories."
1,Chanel,Spring 2024,Feminine,"Plaid blazer, Striped blouse, Black shorts","Layered necklaces, Black headband","Relaxed, Layered","Chic, Modern, Sophisticated",Mix of patterns with classic Chanel elements
1,Chanel,Spring 2024,Feminine,"Red plaid tweed jacket, White striped asymmetrical top, Blue denim jeans","Chain belt, Small black and white bag, Black sandals","Relaxed, Casual","Chic, Casual, Modern",Classic Chanel tweed with a casual twist
1,Chanel,Spring 2024,Feminine,"Denim tunic, Blue denim jeans","Chain strap bag, Sunglasses, Beaded necklace, Bracelets",Relaxed fit,"Casual, Denim, Chic",Classic denim ensemble with modern accessories
1,Chanel,Spring 2024,Feminine,"Pink plaid tweed coat, Pink plaid tweed skirt","Plaid handbag, Black sandals, Gold bracelet","Straight, Long","Classic, Elegant, Tweed",Features signature Chanel tweed with a modern twist.
