Look Number,Designer,Season,Gender Presentation,Garments,Accessories,Silhouette,Style Keywords,Notes
1,Marco Rambaldi,Fall 2024,Feminine,"Blue velvet jacket, Sheer black top, Metallic pleated skirt","Black clutch, Statement earrings","Structured top, A-line skirt","Edgy, Textured, Layered","Mix of textures with a bold, modern aesthetic"
1,Marco Rambaldi,Fall 2024,Feminine,"Gray crop top, Gray mini skirt, Black embellished long coat","Mint green handbag, Black loafers, Gray socks","Structured, Layered","Chic, Modern, Elegant",Subtle sparkle on coat adds a touch of glamour
1,Marco Rambaldi,Fall 2024,Feminine,"White crochet sweater, Gray leather skirt","Choker necklace, Mint green boots","Fitted top, Pencil skirt","Eclectic, Textured, Layered",Mix of textures with crochet and leather
1,Marco Rambaldi,Fall 2024,Feminine,"Blue crushed velvet jacket and skirt, Black knit sweater","Black choker, Black leather clutch","Structured, Layered","Edgy, Textured, Modern","Mix of textures with velvet and knit, bold red hair"
1,Marco Rambaldi,Fall 2024,Feminine,"Knit dress, black and green, graphic print",Silver choker,Fitted,"Contemporary, Artistic, Bold",Features a trompe-l'œil effect with lingerie print
1,Marco Rambaldi,Fall 2024,Gender Fluid,"Gray leather shirt, Black wool vest, Brown leather mini skirt","Green knit scarf, Brooch","Fitted top, A-line skirt","Eclectic, Layered, Textured",Mix of textures with a vintage-inspired brooch
1,Marco Rambaldi,Fall 2024,Feminine,"Gray zip-up jacket, Cream mini skirt with black lace detail","Black scarf with blue detail, Black fur-trimmed boots","Boxy top, Fitted skirt","Modern, Edgy, Layered",Playful mix of textures and patterns
1,Marco Rambaldi,Fall 2024,Feminine,Black velvet dress,Mint green shoes,Fitted,"Elegant, Minimalist",Simple yet sophisticated with a focus on texture.
1,Marco Rambaldi,Fall 2024,Masculine,"Graphic knit cardigan, black velvet pants","Black leather shoes, black leather bag","Relaxed, straight","Textured, graphic, layered",Mix of textures with bold graphic patterns
