Look Number,Designer,Season,Gender Presentation,Garments,Accessories,Silhouette,Style Keywords,Notes
1,APOTTS,Spring 2024,Unisex,"Yellow oversized top, Yellow drawstring pants, Yellow jumpsuit","Red sunglasses, White shoes","Loose, Relaxed","Casual, Monochrome, Minimalist","Bright color palette, Comfortable fit"
1,APOTTS,Spring 2024,Gender Neutral,"Yellow oversized jacket, Yellow loose pants","Chunky necklace, White open-toe sandals","Oversized, Relaxed","Minimalist, Monochrome",Bold color choice with a focus on comfort and simplicity.
1,APOTTS,Spring 2024,Feminine,"Olive green midi dress, fitted, sleeveless",White strappy sandals,Bodycon,"Minimalist, Elegant",Model holding a magenta transparent panel
1,APOTTS,Spring 2024,Masculine,"Orange textured shirt, Orange tank top, Orange drawstring shorts",Pendant necklace,"Relaxed, Layered","Bold, Monochromatic, Sporty",Bright orange ensemble with a casual yet stylish vibe.
1,APOTTS,Spring 2024,Unisex,"Orange textured coat, Orange textured dress","Green flower bouquet, Necklace","Loose, Flowing","Bold, Monochrome, Statement","Bright orange color, Coordinated look"
1,APOTTS,Spring 2024,Feminine,Orange textured mini dress,White ankle strap heels,"Voluminous, A-line","Playful, Bold, Modern",Features oversized sleeves and ruffled hem.
1,APOTTS,Spring 2024,Gender Neutral,"White textured oversized top, White textured wide-leg pants",Green translucent panel,"Oversized, Relaxed","Minimalist, Futuristic",Artistic shoe design adds contrast
1,APOTTS,Spring 2024,Feminine,"White maxi dress, crinkled texture",Yellow translucent clutch,"Voluminous, A-line","Minimalist, Modern",Features a bold color contrast with the clutch
1,APOTTS,Spring 2024,Gender Neutral,"White long-sleeve shirt with gathered sleeves, White maxi skirt","Floral bouquet, Printed shoes","Loose, Flowing","Minimalist, Elegant",Clean white ensemble with artistic footwear
