Look Number,Designer,Season,Gender Presentation,Garments,Accessories,Silhouette,Style Keywords,Notes
1,Jacquemus,Fall 2024,Feminine,"Cream, textured, off-shoulder coat",Yellow shoes,"Relaxed, wrapped","Elegant, Cozy","Minimal accessories, focus on texture"
1,Jacquemus,Fall 2024,Masculine,"Beige structured short-sleeve top, Beige high-waisted trousers, Beige blazer","Blue headscarf, Black loafers","Tailored, Relaxed","Minimalist, Elegant",Sophisticated use of neutral tones with a pop of color in the headscarf
1,Jacquemus,Fall 2024,Feminine,White sleeveless draped dress,"Blue handbag, gold earrings","Flowy, relaxed","Minimalist, elegant","Soft fabric, beachside setting"
1,Jacquemus,Fall 2024,Masculine,"Blue oversized top, Blue wide-leg trousers, White undershirt","Turquoise belt, Turquoise bag","Relaxed, Oversized","Monochromatic, Minimalist",Bright blue palette with contrasting accessories
1,Jacquemus,Fall 2024,Feminine,Sheer blue sleeveless dress,Red clutch,Column,"Elegant, Minimalist",Features a side slit and zebra-striped sandals
1,Jacquemus,Fall 2024,Feminine,Red suede coat dress,"Brown handbag, pink sandals","Structured, oversized collar","Elegant, bold",Minimal accessories enhance the bold color of the coat.
1,Jacquemus,Fall 2024,Gender Neutral,"Beige button-up shirt, Beige trousers","Red headscarf, Red sunglasses, Yellow belt, Tan bag, Zebra print shoes",Relaxed fit,"Chic, Minimalist, Elegant",Bold use of color contrast with accessories
1,Jacquemus,Fall 2024,Feminine,Black halter-neck gown,Gold hoop earrings,Flowing,"Minimalist, Elegant",Simple yet sophisticated design
1,Jacquemus,Fall 2024,Feminine,"Yellow strapless top, Sheer yellow skirt","White sunglasses, Zebra print bag, Yellow headscarf","Flowy, A-line","Elegant, Minimalist",Soft color palette with a beachside vibe
