Look Number,Designer,Season,Gender Presentation,Garments,Accessories,Silhouette,Style Keywords,Notes
1,Fendi,Fall 2024,Feminine,"Black tailored coat dress, black leather boots",Tan clutch,"Fitted, Asymmetrical","Chic, Minimalist",Elegant and streamlined design with a modern twist.
1,Fendi,Fall 2024,Feminine,"Black structured jacket, Black tailored trousers","Brown clutch, Gold earrings","Tailored, Fitted","Minimalist, Elegant","High collar, Monochrome"
1,Fendi,Fall 2024,Feminine,"Black turtleneck, black pants, yellow waist cincher","Blue clutch, hoop earrings","Tailored, cinched waist","Modern, sleek, sophisticated",Contrasting colors with a focus on the waist
1,Fendi,Fall 2024,Feminine,"Navy pinstripe dress, High-neck, Long sleeves","Black boots, Bangles","Fitted, Knee-length","Elegant, Minimalist","Subtle pinstripe pattern, Sophisticated look"
1,Fendi,Fall 2024,Feminine,"Dark pinstripe blazer, Black knit top, Navy cropped pants","Brown clutch, Black knee-high boots, Statement earrings","Structured, Layered","Modern, Elegant, Tailored",Rich textures with a focus on layering and contrast.
1,Fendi,Fall 2024,Feminine,"Black knit top, Yellow and black color-blocked skirt, Black tights",Blue clutch,"Fitted, Layered","Modern, Sleek, Color-blocking",Features a balaclava-style headpiece and over-the-knee black boots.
1,Fendi,Fall 2024,Feminine,"White shirt with black knit overlay, black skirt","Blue clutch, gold earrings","Fitted top, straight skirt","Modern, Layered, Chic",Contrasting textures and colors
1,Fendi,Fall 2024,Feminine,"Black and green wool coat, Olive green knit top, Black leather pants","Chunky necklace, Olive green knit cap","Oversized, Layered","Chic, Modern, Layered",Rich textures with a sophisticated color palette
1,Fendi,Fall 2024,Feminine,"Navy pinstripe tunic, Navy pinstripe trousers","Beige mini bag, Green gloves, Silver sunglasses","Relaxed, Layered","Modern, Minimalist","Subtle pinstripe pattern, Monochrome look"
