Look Number,Designer,Season,Gender Presentation,Garments,Accessories,Silhouette,Style Keywords,Notes
1,Giada,Spring 2024,Feminine,Black tailored blazer dress,"White pointed-toe heels, statement earrings","Structured, fitted","Minimalist, modern",Sculptural details on shoulder
1,Giada,Spring 2024,Feminine,"Sheer black blazer, Sheer black skirt",White pointed flats,"Oversized, Flowing","Minimalist, Elegant",Sheer layering with a modern twist
1,Giada,Spring 2024,Feminine,"Black strapless top, Gray floral sheer skirt","Black handbag, White sandals","Fitted top, Flowing skirt","Minimalist, Elegant",Subtle floral print adds interest to the monochrome palette.
1,Giada,Spring 2024,Feminine,"White tailored blazer, White fitted pants",Gold necklace,"Structured, Fitted","Minimalist, Elegant",Monochrome look with clean lines
1,Giada,Spring 2024,Feminine,"Gray strapless dress with floral print, sheer overlay",White structured handbag,A-line,"Minimalist, Elegant",Subtle floral motif with sheer layering
1,Giada,Spring 2024,Feminine,"Black oversized blazer, black sheer panel top, black tailored pants",Black leather clutch with chain,"Oversized, tailored","Minimalist, chic",Monochrome look with a focus on structure and simplicity.
1,Giada,Spring 2024,Feminine,"Off-the-shoulder white crop top, Black skirt with white floral print, Black flared pants",White open-toe heels,"Fitted top, Flared pants","Elegant, Minimalist, Modern",Monochrome palette with floral detail
1,Giada,Spring 2024,Feminine,"Off-shoulder crop top, White A-line skirt",White pointed heels,"A-line, Minimalist","Chic, Elegant",Features a minimalist design with subtle gold detail on the skirt.
1,Giada,Spring 2024,Feminine,"White and yellow floral textured top, Black structured skirt, Black pants","Yellow clutch, Yellow pointed shoes","Structured, Layered","Elegant, Modern",The floral top adds texture and contrast to the sleek black ensemble.
1,Giada,Spring 2024,Feminine,"Strapless black bodice, White and yellow floral textured skirt",Black pointed flats,Column,"Elegant, Textured, Minimalist",Contrasting textures with a sleek silhouette
1,Giada,Spring 2024,Feminine,"White cut-out top, Yellow wide-leg trousers",White and yellow geometric bag,"Relaxed, Flowing","Minimalist, Modern",Clean lines with a pop of color
1,Giada,Spring 2024,Feminine,"White tailored shirt, Yellow and white textured mini skirt","Yellow mini handbag, Yellow pointed flats","Structured, Fitted","Chic, Modern, Elegant",Clean lines with a pop of texture and color
1,Giada,Spring 2024,Feminine,"White strapless top, Yellow skirt with white floral appliqué, Slit detail","White earrings, White open-toe heels","Fitted bodice, Straight skirt","Elegant, Minimalist, Textured",Contrasting textures with a clean color palette
1,Giada,Spring 2024,Feminine,"Yellow sleeveless midi dress, cut-out detail","Black handbag, gold bracelet","Straight, relaxed","Minimalist, Elegant",Subtle cut-out adds modern touch
1,Giada,Spring 2024,Feminine,White tailored coat dress,"Woven brown clutch, Brown pointed heels","Structured, Longline","Minimalist, Elegant",Clean lines with a focus on tailoring
1,Giada,Spring 2024,Feminine,"White structured shirt, White ombre mini skirt","White pointed flats, Minimalist earring","A-line, Tailored","Minimalist, Elegant",Clean lines with a focus on simplicity and subtle details.
1,Giada,Spring 2024,Feminine,White and brown gradient dress with sheer black shoulder detail,White open-toe heels,Straight,"Minimalist, Elegant","Subtle gradient effect, sheer shoulder adds interest"
1,Giada,Spring 2024,Feminine,"Olive green blazer with sheer sleeves, matching flared trousers",White strappy heels,Tailored,"Minimalist, Elegant",Belted waist adds definition
1,Giada,Spring 2024,Feminine,Off-the-shoulder brown mini dress,Green woven clutch,A-line,"Minimalist, Elegant",Simple yet sophisticated design with a focus on clean lines.
1,Giada,Spring 2024,Feminine,"Green oversized blazer, White shirt, Black mini skirt","Small green handbag, Black pointed flats","Oversized blazer, Mini skirt","Chic, Minimalist",Elegant color contrast with structured tailoring
1,Giada,Spring 2024,Feminine,Sheer black and green off-the-shoulder dress,Black flats,A-line,"Elegant, Minimalist",Features sheer layers with subtle green accents
1,Giada,Spring 2024,Feminine,"Green belted coat with sheer sleeves, Brown leggings",Green strappy heels,"Structured, Flowing","Elegant, Minimalist",The look features a sophisticated blend of textures with a focus on clean lines.
1,Giada,Spring 2024,Feminine,"White dress with green sheer panel, spaghetti straps","White clutch, green flats","Straight, midi","Minimalist, elegant",Clean lines with a subtle color contrast
1,Giada,Spring 2024,Feminine,"White shirt, White midi skirt","Geometric tote bag, White flats","Structured, Clean lines","Minimalist, Elegant",Monochromatic white ensemble with subtle geometric accents
1,Giada,Spring 2024,Feminine,Green ribbed dress with unique buttons,Beige structured handbag,"Fitted, Longline","Elegant, Minimalist",Features sculptural buttons and a sleek silhouette
1,Giada,Spring 2024,Androgynous,"Brown and green sleeveless top, Brown leather wide-leg pants",Brown leather shoulder bag,"Relaxed, Flowing","Minimalist, Modern",Subtle color blocking with a focus on texture.
1,Giada,Spring 2024,Feminine,"Brown ribbed top, Sheer brown skirt",Brown pointed shoes,"Fitted top, Flowing skirt","Elegant, Minimalist",Features unique button details
1,Giada,Spring 2024,Feminine,"Brown sheer blazer, White shirt, Sheer black skirt","Green mini handbag, White open-toe heels","Straight, Layered","Minimalist, Elegant",Sheer layering with structured blazer
1,Giada,Spring 2024,Feminine,"Gray silk shirt, Gray silk trousers","Green geometric bag, Black sandals","Tailored, Straight","Minimalist, Elegant","Subtle sheen on fabric, Clean lines"
1,Giada,Spring 2024,Feminine,"Sleeveless ivory blazer, Sheer white skirt",White pointed shoes,"Straight, Layered","Minimalist, Elegant",Subtle layering with sheer elements
1,Giada,Spring 2024,Feminine,"Gray sheer overlay dress, black sheer underlayer","White structured handbag, black pointed shoes","Straight, layered","Minimalist, elegant",Subtle contrast between opaque and sheer fabrics
1,Giada,Spring 2024,Feminine,"Black sleeveless dress, sheer bodice, gray panel, floral embellishments",Green strappy heels,"Column, Front slit","Elegant, Minimalist",Subtle floral detailing adds texture
1,Giada,Spring 2024,Feminine,"Black oversized blazer, black floral applique top, black trousers",White flats,"Oversized, tailored","Minimalist, elegant",Monochrome look with delicate floral details
1,Giada,Spring 2024,Feminine,"White strapless top, Beige textured overlay, White wide-leg pants",Green crossbody strap,"Straight, Relaxed","Minimalist, Elegant",Clean lines with a focus on texture contrast
1,Giada,Spring 2024,Feminine,"White cut-out top, Beige textured skirt",White clutch,"Slim, Longline","Minimalist, Elegant",Clean lines with subtle texture contrast
1,Giada,Spring 2024,Feminine,"Beige textured sleeveless coat, White leggings",White pointed heels,"Straight, Relaxed","Minimalist, Elegant",Clean lines with a focus on texture
