Look Number,Designer,Season,Gender Presentation,Garments,Accessories,Silhouette,Style Keywords,Notes
1,Vivienne Westwood,Fall 2024,Feminine,"Plaid blazer, Plaid shorts, Plaid top","Black handbag, Plaid knee-high socks","Structured, Tailored","Eclectic, Bold, Patterned","Mix of plaid patterns, Platform shoes"
1,Vivienne Westwood,Fall 2024,Masculine,"Brown tailored suit, White wide-collar shirt, Striped tie",Black loafers,"Structured, Tailored","Retro, Classic, Elegant",70s-inspired wide collar
1,Vivienne Westwood,Fall 2024,Androgynous,"Plaid jacket, white ruffled shirt, plaid skirt","Brown leather bag, mismatched plaid socks, black loafers","Layered, Asymmetrical","Eclectic, Punk, Vintage","Mix of patterns and textures, signature Westwood style"
1,Vivienne Westwood,Fall 2024,Masculine,"Khaki utility jacket, Khaki utility pants","Black gloves, Black belt, Black boots, Red socks","Boxy, Tapered","Utility, Outdoor, Military","High collar, Functional pockets"
1,Vivienne Westwood,Fall 2024,Unisex,"Textured knit tops, Beige skirt, Patterned leggings",Platform shoes,"Layered, Fitted","Eclectic, Avant-garde",Mix of textures and patterns
1,Vivienne Westwood,Fall 2024,Feminine,"Plaid draped top, Plaid asymmetrical skirt","Choker, Earrings, Belt","Asymmetrical, Layered","Punk, Eclectic","Mix of patterns and textures, bold accessories"
1,Vivienne Westwood,Fall 2024,Feminine,"Blue draped dress, Printed leggings","Red high heels, Necklace","Voluminous, Fitted waist","Eclectic, Avant-garde",Playful mix of textures and patterns
1,Vivienne Westwood,Fall 2024,Masculine,"Green trench coat, Beige distressed knit sweater, Printed leggings",Brown checkered tote bag,"Layered, Relaxed","Eclectic, Bohemian, Artistic","Mix of textures and patterns, outdoor setting"
1,Vivienne Westwood,Fall 2024,Masculine,"Plaid suit, green vest, white shirt","Brown leather bag, brown shoes",Tailored,"Eclectic, Vintage-inspired","Bold plaid pattern, layered styling"
