Look Number,Designer,Season,Gender Presentation,Garments,Accessories,Silhouette,Style Keywords,Notes
1,Heliot Emil,Spring 2024,Feminine,"Black oversized coat, black turtleneck, black pants",Black belt,"Oversized, Layered","Minimalist, Monochrome",Emphasis on dark tones and structured layering
1,Heliot Emil,Spring 2024,Feminine,"Black turtleneck dress, floor-length, fitted",None,"Slim, elongated","Minimalist, sleek","Monochromatic, understated elegance"
1,Heliot Emil,Spring 2024,Feminine,"Black cut-out top, White draped skirt",None,"Fitted top, Flowing skirt","Minimalist, Edgy",Contrast of structured and fluid elements
1,Heliot Emil,Spring 2024,Androgynous,"Black oversized jacket, Black wide-leg pants",Black structured handbag,"Oversized, Structured","Minimalist, Monochrome",Emphasis on volume and clean lines
1,Heliot Emil,Spring 2024,Masculine,"Black fitted top, Black wide-leg trousers",Black belt,"Oversized, Fitted top","Monochrome, Minimalist",Face covered with fabric
1,Heliot Emil,Spring 2024,Feminine,"White structured blazer, Beige layered trousers",None,"Asymmetrical, Layered","Minimalist, Avant-garde",Innovative cutouts and layering
1,Heliot Emil,Spring 2024,Androgynous,"Black sheer dress, layered",Bracelet,Flowing,"Minimalist, Edgy","Long hair, dark color palette"
1,Heliot Emil,Spring 2024,Feminine,"Black halter-neck dress, floor-length, cut-out details",None,"Flowing, elongated","Minimalist, edgy","Monochromatic, sleek design"
1,Heliot Emil,Spring 2024,Feminine,"White asymmetrical cut-out top, White draped wide-leg pants",None visible,"Flowing, Layered","Minimalist, Avant-garde",Features cut-out details and layered draping.
