Look Number,Designer,Season,Gender Presentation,Garments,Accessories,Silhouette,Style Keywords,Notes
1,Yuhan Wang,Fall 2024,Feminine,"Black lace cape, Black shorts, White lace tights","Black suitcase, Hair accessories","Flowing cape, Fitted shorts","Gothic, Romantic, Avant-garde","Intricate lace details, Dramatic hair styling"
1,Yuhan Wang,Fall 2024,Feminine,Black tweed dress with white lace collar and cuffs,"Statement earrings, lace tights, black heels","Fitted, A-line","Victorian, Romantic, Textured","Intricate lace details, vintage-inspired"
1,Yuhan Wang,Fall 2024,Feminine,"Black lace crop top, Black sequin skirt, White tights","Black and white handbag, Choker, Earrings","Fitted top, Asymmetrical skirt","Romantic, Edgy, Vintage",Playful mix of textures and vintage-inspired elements.
1,Yuhan Wang,Fall 2024,Feminine,"Black tweed vest, White lace blouse, Black tweed skirt, White tights","Black ribbon belt, Lace-up shoes","Fitted bodice, A-line skirt","Romantic, Textured, Vintage-inspired","Intricate lace details, Monochrome palette"
1,Yuhan Wang,Fall 2024,Feminine,"White shirt, Black sequin overlay, Black skirt","Black briefcase, Glasses","Layered, Structured","Eclectic, Avant-garde",Unique hair styling and lace tights add to the eclectic look.
1,Yuhan Wang,Fall 2024,Feminine,"Black tailored jacket, White lace asymmetrical skirt","Lace necktie, Black lace tights","Fitted top, Voluminous skirt","Victorian, Gothic, Romantic",Mix of structured tailoring with delicate lace
1,Yuhan Wang,Fall 2024,Feminine,"Black lace blouse, White lace collar, Black high-waisted skirt","Statement earrings, Strappy black heels","Fitted top, Voluminous skirt","Gothic, Romantic","Intricate lace details, Victorian influence"
1,Yuhan Wang,Fall 2024,Feminine,"White printed shirt dress, Black belt","Books, Paper sash","Structured, Voluminous","Avant-garde, Conceptual","Incorporates literary elements, Unique headpiece"
