Look Number,Designer,Season,Gender Presentation,Garments,Accessories,Silhouette,Style Keywords,Notes
1,Hodakova,Spring 2024,Feminine,"Black sleeveless top, Black long skirt","Small glasses, Black shoes with embellishments","Straight, Long","Minimalist, Monochrome",Structured and sleek look
1,Hodakova,Spring 2024,Gender Neutral,"Black sleeveless crop top, Pinstriped culottes","Black handbag, Glasses, Notebook","Relaxed, Cropped","Minimalist, Edgy",Casual yet sophisticated with a focus on accessories.
1,Hodakova,Spring 2024,Feminine,"Black asymmetrical blazer, Black mini skirt","Black handbag, Black shoes, Glasses","Oversized top, Fitted bottom","Avant-garde, Minimalist",Monochromatic black ensemble with a focus on asymmetry and texture.
1,Hodakova,Spring 2024,Feminine,"White sheer deep V-neck top, Gray wide-leg trousers","Black statement necklace, Black pointed shoes","Relaxed, Flowing","Avant-garde, Minimalist","Bold neckline, Monochrome palette"
1,Hodakova,Spring 2024,Feminine,White lace patchwork dress,"Black headband, Black pointed heels","Fitted, Asymmetrical","Avant-garde, Textured",Intricate lace detailing with a deconstructed aesthetic
1,Hodakova,Spring 2024,Feminine,"White ruched top, Black mini shorts, Black tights",Black belt,"Fitted top, Loose shorts","Edgy, Deconstructed",Asymmetrical design with layered textures
1,Hodakova,Spring 2024,Feminine,"Black cropped vest, Black low-rise pants","Glasses, Black handbag","Fitted top, Loose pants","Avant-garde, Edgy","Minimalist color palette, Futuristic elements"
1,Hodakova,Spring 2024,Feminine,"Black sleeveless top, Multi-layered trousers in brown, black, and gray",Green glasses,"Oversized, Layered","Avant-garde, Conceptual",Innovative use of multiple trousers as a skirt
1,Hodakova,Spring 2024,Unisex,"Quilted black patchwork jacket, Black wide-leg pants",Rectangular glasses,"Oversized, Layered","Avant-garde, Minimalist",Textured jacket with a deconstructed aesthetic
