Look Number,Designer,Season,Gender Presentation,Garments,Accessories,Silhouette,Style Keywords,Notes
1,Brandon Maxwell,Spring 2024,Feminine,"Cream sleeveless draped dress, satin texture","Silver belt, white handbag, black strappy heels","Flowy, asymmetrical","Minimalist, elegant",Soft color palette with modern draping
1,Brandon Maxwell,Spring 2024,Feminine,"White structured blazer, white draped top, white sheer wide-leg pants","Silver belt, statement earrings","Flowy, tailored","Minimalist, elegant",Monochromatic white ensemble with a modern touch
1,Brandon Maxwell,Spring 2024,Feminine,"White sheer blouse, White flowing skirt","White clutch, Silver belt","Flowing, Layered","Ethereal, Minimalist",Soft draping with a modern touch
1,Brandon Maxwell,Spring 2024,Feminine,"Black cape blazer, Black sheer wide-leg pants, Black turtleneck top",Silver hoop earrings,"Oversized, Flowing","Minimalist, Monochrome",Elegant and modern with a focus on clean lines.
1,Brandon Maxwell,Spring 2024,Feminine,"Black structured blazer, Black sheer wide-leg pants, Black draped top","Black handbag, Statement earrings","Flowy, Layered","Minimalist, Elegant",Monochrome black ensemble with a focus on texture and layering.
1,Brandon Maxwell,Spring 2024,Feminine,"Black off-shoulder gown, sheer panels",Black clutch,Fitted,Elegant,Minimalist design with sheer detailing
1,Brandon Maxwell,Spring 2024,Feminine,"Black one-shoulder bodysuit, Sheer black pants",Gold statement earrings, Fitted,"Chic, Modern",Elegant use of sheer fabric
1,Brandon Maxwell,Spring 2024,Feminine,"Mustard cape, Black textured skirt","Gold earrings, Black belt, Black clutch","Flowing cape, A-line skirt","Elegant, Modern, Minimalist",Sophisticated use of color contrast and clean lines.
1,Brandon Maxwell,Spring 2024,Feminine,Black V-neck gown with fringed edges,"Gold statement earrings, Black belt with gold buckle","A-line, Floor-length","Elegant, Minimalist",Sophisticated use of texture and metallic accents
