Look Number,Designer,Season,Gender Presentation,Garments,Accessories,Silhouette,Style Keywords,Notes
1,HUI,Fall 2024,Feminine,Floral embroidered white dress,"Gold clutch, Yellow pointed heels",Fitted,"Elegant, Floral, Sophisticated",Intricate floral embroidery adds a delicate touch.
1,HUI,Fall 2024,Feminine,"Floral embroidered jacket, Floral embroidered skirt, Sheer pink blouse",Statement earrings,Structured,"Elegant, Floral, Layered",Features intricate embroidery and a soft color palette.
1,HUI,Fall 2024,Feminine,"Black cropped jacket, white embroidered top, black skirt","Fur clutch, statement earrings","Structured, layered","Chic, modern, elegant",Fur accents on boots add texture
1,HUI,Fall 2024,Feminine,"Black embroidered vest, White floral embroidered top, Black wide-leg pants","Gold statement necklace, Gold earrings, Gold bracelets, Black and gold clutch","Structured, Wide-leg","Elegant, Embroidered, Sophisticated",Intricate embroidery and bold accessories
1,HUI,Fall 2024,Gender Neutral,"Patterned coat, beige sweater with panda motif, beige knit shorts","Patterned cap, black fur-trimmed boots",Relaxed,"Playful, Cozy, Chic",Animal motif adds a whimsical touch.
1,HUI,Fall 2024,Feminine,"Camel coat with fur collar, Neon yellow blouse, Yellow sequin skirt",Gold flats,"Longline, Layered","Bold, Glamorous, Elegant",Bright colors with a mix of textures
1,HUI,Fall 2024,Feminine,"Patterned oversized jacket, Yellow sheer blouse with bow, Patterned skirt","White clutch, Yellow earrings","Oversized, Layered","Bold, Textured, Elegant",Mix of bright and neutral tones
1,HUI,Fall 2024,Feminine,"Patterned jacket, striped turtleneck, green sequin shorts","Necklace, earrings","Layered, fitted","Eclectic, modern",Mix of textures and patterns with bold colors
1,HUI,Fall 2024,Feminine,Green sequin sleeveless dress with deep V-neck,"Patterned cap, statement earrings, bracelets","Loose, flowing","Glamorous, bold",Bright sequins create a striking visual impact.
