Look Number,Designer,Season,Gender Presentation,Garments,Accessories,Silhouette,Style Keywords,Notes
1,Lela Rose,Fall 2024,Feminine,Gold sequin gown,Gold bangle,Fitted,"Elegant, Glamorous",Minimal accessories enhance the gown's sparkle.
1,Lela Rose,Fall 2024,Feminine,"Gray knit top, Gray knit skirt",Hoop earrings,"Fitted, Longline","Elegant, Minimalist",Monochromatic look with textured fabric
1,Lela Rose,Fall 2024,Feminine,Floral print long-sleeve dress with slit,None,Fitted,"Elegant, Floral, Sophisticated","Set in a soft, padded environment"
1,Lela Rose,Fall 2024,Feminine,"Black long-sleeve dress, satin",Gold hoop earrings,"Fitted bodice, flowing skirt","Elegant, Minimalist",Sophisticated look with a soft draped background
1,Lela Rose,Fall 2024,Feminine,Sleeveless multicolored fringe dress,Gold bangle,A-line,"Textured, Colorful, Glamorous",Features a bold geometric pattern with shimmering fringe
1,Lela Rose,Fall 2024,Feminine,"Checkered sleeveless dress, yellow/pink/brown, satin",Brown bangle bracelet,A-line,"Bold, Graphic, Elegant",Striking use of color and pattern
1,Lela Rose,Fall 2024,Feminine,Lavender lace gown,Black pointed flats,A-line,"Elegant, Romantic",Features intricate lace detailing and cape sleeves.
1,Lela Rose,Fall 2024,Feminine,White ribbed knit gown,None,Column,"Elegant, Minimalist",Off-the-shoulder design
1,Lela Rose,Fall 2024,Feminine,"Floral print shirt dress, green and white, silky texture",Gold earrings,"Tailored, straight","Elegant, floral, sophisticated",Features a black belt accent
