Look Number,Designer,Season,Gender Presentation,Garments,Accessories,Silhouette,Style Keywords,Notes
1,Tommy Hilfiger,Fall 2024,Androgynous,"Blue striped shirt, Camel pleated trousers","Gray cap, White sneakers","Relaxed, Tailored","Casual, Preppy",Classic color palette with a sporty touch
1,Tommy Hilfiger,Fall 2024,Androgynous,"Tan double-breasted blazer, Light blue striped shirt, Navy wide-leg trousers",Black clutch,"Oversized, Structured","Preppy, Classic, Tailored",White sneakers add a casual touch
1,Tommy Hilfiger,Fall 2024,Unisex,"Black trench coat, camel cable-knit sweater, white shirt, beige trousers","Gray cap, white sneakers","Relaxed, layered","Preppy, casual",Classic Tommy Hilfiger style with a modern twist
1,Tommy Hilfiger,Fall 2024,Feminine,"Navy mini dress, Light blue shirt","Black leather clutch, Snakeskin boots",A-line,"Preppy, Chic",Layered look with bold collar
1,Tommy Hilfiger,Fall 2024,Feminine,"Navy cable-knit turtleneck sweater, Navy pleated skirt","Black leather belt, Black knee-high boots",A-line,"Preppy, Classic",Layered with a white shirt underneath
1,Tommy Hilfiger,Fall 2024,Unisex,"White cable-knit sweater vest with red trim, Grey herringbone trousers","Tan baseball cap, White sneakers, Long white cable-knit scarf","Relaxed, Oversized","Casual, Sporty, Preppy",Layered knitwear with a sporty twist
1,Tommy Hilfiger,Fall 2024,Feminine,"Tan blazer, red polo shirt, white shirt, navy pleated skirt","Black belt, black boots","Structured, layered","Preppy, classic",Mix of casual and formal elements
1,Tommy Hilfiger,Fall 2024,Masculine,"Gray herringbone coat, Navy varsity jacket, Light blue striped shirt, Khaki wide-leg trousers","Navy cap, Striped tie, White sneakers","Oversized, Layered","Preppy, Casual, Collegiate",Mix of classic and sporty elements
