Look Number,Designer,Season,Gender Presentation,Garments,Accessories,Silhouette,Style Keywords,Notes
1,Comme des Garçons,Spring 2024,Feminine,"Floral printed dress with exaggerated ruffles, pink belt","Pink textured wig, colorful sneakers","Voluminous, oversized","Avant-garde, bold, colorful",Dramatic floral patterns and textures
1,Comme des Garçons,Spring 2024,Gender Neutral,"Multicolor ruffled cape, Geometric print shorts",Embellished boots,Voluminous,"Avant-garde, Bold, Artistic",Dramatic use of color and texture
1,Comme des Garçons,Spring 2024,Gender Neutral,"Floral patchwork coat, Red velvet dress",Embellished boots,"Voluminous, Layered","Avant-garde, Bold, Artistic",Dramatic use of color and texture
1,Comme des Garçons,Spring 2024,Gender Neutral,"Multicolored geometric print cape, Multicolored geometric print dress",Pink geometric wig,"Voluminous, Oversized","Avant-garde, Bold, Artistic",Features vibrant geometric patterns and a striking pink wig.
1,Comme des Garçons,Spring 2024,Gender Neutral,"Oversized, multicolored geometric print dress","Yellow textured wig, colorful sneakers","Voluminous, cocoon","Avant-garde, playful, bold","Features a large bow detail, vibrant colors"
1,Comme des Garçons,Spring 2024,Gender Neutral,Multicolored geometric-patterned oversized dress,"Purple structured hat, Multicolored embellished shoes","Voluminous, Oversized","Avant-garde, Bold, Artistic","Playful use of color and pattern, Sculptural design"
1,Comme des Garçons,Spring 2024,Gender Neutral,"Ruffled dress, multicolored, printed","Blue headpiece, colorful sneakers","Voluminous, oversized","Avant-garde, artistic","Features classical art print, bold color contrast"
1,Comme des Garçons,Spring 2024,Gender Neutral,"Printed, textured coat with art motifs","Red belt, colorful ankle boots","Oversized, voluminous","Avant-garde, artistic, bold",Features a mix of textures and vivid colors with a striking art print.
1,Comme des Garçons,Spring 2024,Gender Neutral,"Ruched floral coat, Plaid skirt",Yellow textured wig,"Oversized, Voluminous","Avant-garde, Textured, Bold",Dramatic use of color and texture
