Look Number,Designer,Season,Gender Presentation,Garments,Accessories,Silhouette,Style Keywords,Notes
1,16Arlington,Fall 2024,Feminine,"Black coat, Black turtleneck dress",Black furry handbag,"Long, Flowing","Monochrome, Elegant",All-black ensemble with textured accessory.
1,16Arlington,Fall 2024,Feminine,"Black halter-neck gown, floor-length, fitted bodice, draped skirt",None,Hourglass,"Elegant, Minimalist, Sophisticated",Focus on clean lines and silhouette
1,16Arlington,Fall 2024,Feminine,"Black sheer sleeveless top, Black pleated skirt",Black boots,Flowy,"Minimalist, Elegant",Monochromatic black ensemble with a focus on texture and movement.
1,16Arlington,Fall 2024,Unisex,"Black tailored suit, wool",Silver metallic fringe scarf,Structured,"Avant-garde, Minimalist",Dramatic metallic accessory contrasts with classic suit
1,16Arlington,Fall 2024,Feminine,"Black sheer dress, black undergarments",Black ankle boots,"Flowy, A-line","Sheer, Edgy, Modern",Dramatic use of transparency and layering
1,16Arlington,Fall 2024,Androgynous,"Gray mohair sweater with black and white graphic, black tailored trousers",Green textured handbag with black fur detail,"Relaxed top, tailored bottom","Edgy, Graphic, Textured",Playful graphic element on sweater
1,16Arlington,Fall 2024,Feminine,"Black sheer dress, layered, flowing",None,A-line,"Elegant, Minimalist","Sheer fabric creates a delicate, ethereal effect."
1,16Arlington,Fall 2024,Unisex,"Pink fuzzy sweater with black dog motif, Black tailored trousers",Black faux fur bag,"Relaxed top, Slim trousers","Playful, Graphic, Textured",Bold graphic motif on sweater
