Website,Image URL,Look Number,Designer,Season,Gender Presentation,Garments,Accessories,Silhouette,Style Keywords,Notes
Vogue,https://www.vogue.com/fashion-shows/fall-2024-ready-to-wear/apotts, 1, APOTTS, Fall 2024,Feminine,"Black cropped top, Black oversized blazer, Black asymmetrical skirt, Black tights","Black beanie, Black oversized scarf, Black patent leather ankle boots","Layered, Oversized","Monochrome, Edgy",Dramatic layering with a focus on texture and silhouette
Vogue,https://www.vogue.com/fashion-shows/fall-2024-ready-to-wear/apotts,1,APOTTS,Fall 2024,Feminine,"Black cropped top, black oversized blazer, black asymmetrical skirt, black tights","Black beanie, black oversized scarf, black patent leather ankle boots","Layered, voluminous","Monochrome, edgy, modern","Focus on texture and layering with a sleek, all-black ensemble"
Vogue,https://www.vogue.com/fashion-shows/fall-2024-ready-to-wear/apotts,1,APOTTS,Fall 2024,Masculine,"Black hooded top, Black wide-leg pants",None,Loose,Minimalist,"Monochrome, modern streetwear"
https://www.vogue.com/fashion-shows/fall-2024-ready-to-wear/apotts,https://www.vogue.com/fashion-shows/fall-2024-ready-to-wear/apotts,N/A,APOTTS,Fall 2024,Feminine,"Black oversized dress, Black wide-leg pants","Glasses, Hoop earrings, Layered necklaces, Beaded bracelets","Loose, Flowing","Minimalist, Elegant",Monochromatic black ensemble with statement accessories
Vogue,https://www.vogue.com/fashion-shows/fall-2024-ready-to-wear/apotts,1,APOTTS,Fall 2024,Feminine,"Black velvet off-shoulder top, Black wide-leg pants","Black heels, Silver jewelry","Relaxed, Flowing","Minimalist, Elegant",Sophisticated monochrome look
Vogue,https://www.vogue.com/fashion-shows/fall-2024-ready-to-wear/apotts,Unknown,Unknown,Fall 2024,Feminine,"Black oversized jumpsuit, Black bandeau top","Gold chain necklace, Gold hoop earrings","Oversized, Relaxed","Minimalist, Modern",The look features a monochromatic black palette with a focus on volume and simplicity.
Vogue,https://www.vogue.com/fashion-shows/fall-2024-ready-to-wear/apotts,1,APOTTS,Fall 2024,Masculine,"Oversized black coat, Black knit top, Black wide-leg pants",Gold rings,"Oversized, Relaxed","Minimalist, Monochrome","Textured fabric, Casual elegance"
Vogue,https://www.vogue.com/fashion-shows/fall-2024-ready-to-wear/apotts,Unknown,APOTTS,Fall 2024,Feminine,"Black hooded dress, Black pants","Black sunglasses, Black patent leather boots","Oversized, Layered","Futuristic, Edgy","Monochromatic black ensemble with sleek, modern elements"
Vogue,https://www.vogue.com/fashion-shows/fall-2024-ready-to-wear/apotts,1,APOTTS,Fall 2024,Gender Neutral,Black velvet cape,Black sunglasses,Voluminous,"Avant-garde, Minimalist",Dramatic cape with sleek accessories
Vogue,https://www.vogue.com/fashion-shows/fall-2024-ready-to-wear/apotts,1,APOTTS,Fall 2024,Feminine,"Black sleeveless hooded tunic, Black leggings",None,Relaxed,"Minimalist, Urban, Edgy",Features a large front pocket and long drawstrings
Vogue,https://www.vogue.com/fashion-shows/fall-2024-ready-to-wear/apotts,1,APOTTS,Fall 2024,Feminine,"Black textured blazer, Black button-up top, Black flared pants, Blue tied sweater","Beige clutch, Black Mary Jane flats","Relaxed fit, Layered","Chic, Modern, Layered",Blue sweater adds a pop of color
Vogue,https://www.vogue.com/fashion-shows/fall-2024-ready-to-wear/apotts,1,APOTTS,Fall 2024,Gender Neutral,"Padded coat, Black jumpsuit",Padded boots,"Oversized, Layered","Futuristic, Avant-garde","Monochrome palette, Structured design"
Vogue,https://www.vogue.com/fashion-shows/fall-2024-ready-to-wear/apotts,1,APOTTS,Fall 2024,Feminine,"Black open-back gown, long sleeves",Statement earrings,Flowing,Elegant,Outdoor setting with cityscape background
Vogue,https://www.vogue.com/fashion-shows/fall-2024-ready-to-wear/apotts,1,APOTTS,Fall 2024,Androgynous,"Navy oversized blazer, Navy trousers","Navy cap with chain, Silver chain necklaces","Oversized, Structured","Avant-garde, Bold","Dramatic makeup, Strong shoulder emphasis"
https://www.vogue.com/fashion-shows/fall-2024-ready-to-wear/apotts,https://media.vogue.com/photos/653a0e2d3b0b1e5d9e8f9c3f/master/w_1920%2Cc_limit/00001-apotts-ready-to-wear-fall-2024-credit-brand.jpg,1,Apotts,Fall 2024,Feminine,"White embroidered shirt, Silver sequin skirt","Silver sequin clutch, Pearl necklace","Fitted, Structured","Elegant, Glamorous",The look combines classic elegance with modern sparkle.
https://www.vogue.com/fashion-shows/fall-2024-ready-to-wear/apotts,,Look 1,APOTTS,Fall 2024,Feminine,"Black sleeveless dress, Multicolored sheer blouse, Multicolored patterned leggings","Ear cuff, Statement ring","A-line, Fitted","Bold, Graphic, Modern",Playful use of color and pattern
