Look Number,Designer,Season,Gender Presentation,Garments,Accessories,Silhouette,Style Keywords,Notes
1,Schiaparelli,Fall 2024,Feminine,"Gray tweed blazer, Gray tweed trousers","Gold earrings, Beige textured handbag","Oversized, Structured","Bold, Minimalist, Elegant","No shirt under blazer, Emphasis on tailoring"
1,Schiaparelli,Fall 2024,Feminine,"Black tailored blazer, Black cargo pants, White shirt",Gold hoop earrings,Structured,"Chic, Modern, Tailored",Features a braided hairstyle and minimalistic design with bold accessories.
1,Schiaparelli,Fall 2024,Androgynous,"Beige oversized blazer, White shirt, Beige wide-leg trousers","Gold hoop earrings, Brown belt","Oversized, Relaxed","Tailored, Minimalist","Classic color palette, Subtle luxury"
1,Schiaparelli,Fall 2024,Feminine,"White tank top, Beige buttoned corset, White wide-leg trousers","Gold statement earrings, Brown clutch","Fitted top, Wide-leg trousers","Elegant, Modern, Minimalist",Neutral color palette with structured corset
1,Schiaparelli,Fall 2024,Androgynous,"Denim blazer, Denim wide-leg trousers","Braided tie, Black belt","Structured, Oversized","Denim, Tailored, Bold",Innovative use of denim with a formal twist
1,Schiaparelli,Fall 2024,Feminine,"Denim jacket with gold buttons, Denim skirt with slit","Sunglasses, Blue clutch with gold chain","Structured, Fitted","Denim, Chic, Modern",Gold detailing adds luxury to classic denim.
1,Schiaparelli,Fall 2024,Feminine,"Navy coat, Black bodysuit","Black knit hat, Gold brooch, Brown clutch","Structured, Tailored","Elegant, Minimalist","Features a sleek, elongated coat with minimal embellishments."
1,Schiaparelli,Fall 2024,Feminine,"Plaid cropped jacket, Black velvet mini skirt, Black leggings","Black velvet helmet, Black patent leather boots","Structured top, Flared skirt","Chic, Equestrian, Avant-garde","Bold plaid pattern, Luxurious textures"
1,Schiaparelli,Fall 2024,Feminine,"Navy oversized double-breasted coat, Black patent leather skirt, Black turtleneck","Black cap, Black ankle boots","Structured, A-line","Chic, Modern, Edgy",Bold use of textures and structured tailoring
