Look Number,Designer,Season,Gender Presentation,Garments,Accessories,Silhouette,Style Keywords,Notes
1,Tibi,Fall 2024,Feminine,"Charcoal cropped vest, Charcoal wide-leg trousers, Charcoal long coat","Black headband, Black shoes, Navy socks","Oversized, Relaxed","Modern, Tailored, Minimalist",Monochrome look with sporty elements
1,Tibi,Fall 2024,Feminine,"Black sleeveless dress, Sheer black turtleneck",Black knee-high boots,"Straight, Loose","Minimalist, Modern",Elegant and understated with a focus on clean lines.
1,Tibi,Fall 2024,Feminine,"Plaid shirt, Plaid wide-leg trousers","Black leather belt, Black headband","Relaxed, Oversized","Minimalist, Tailored","Monochrome plaid pattern, Structured yet relaxed fit"
1,Tibi,Fall 2024,Feminine,"Gray V-neck top, Gray wide-leg pants","Brown leather belt, Black headband","Relaxed, Oversized","Minimalist, Monochrome",Simple and elegant with a focus on comfort and ease.
1,Tibi,Fall 2024,Feminine,"Oversized cream knit sweater, Cream knit skirt","White headband, White tights, White shoes","Oversized, Layered","Minimalist, Monochrome, Cozy","Textured knitwear with a soft, neutral palette"
1,Tibi,Fall 2024,Feminine,"Black cropped top, Black wide-leg trousers",Brown leather belt,"Relaxed, Cropped","Minimalist, Modern",Simple yet elegant with a focus on clean lines.
1,Tibi,Fall 2024,Androgynous,"Charcoal wool coat, White polo shirt, Blue cuffed jeans","Black headband, Brown shoes","Relaxed, Oversized","Minimalist, Casual, Tailored",Classic layering with a modern twist
1,Tibi,Fall 2024,Feminine,"Brown checkered shirt, Black patent leather skirt","White belt, Sheer headband","Fitted top, Straight skirt","Modern, Edgy, Minimalist","Contrast of textures with a sleek, polished look"
1,Tibi,Fall 2024,Unisex,"Black puff-sleeve polo, Black maxi skirt","Silver headband, Navy socks, Two-tone shoes","Relaxed, Straight","Minimalist, Sporty",Monochrome look with sporty elements
