Look Number,Designer,Season,Gender Presentation,Garments,Accessories,Silhouette,Style Keywords,Notes
1,Talia Byre,Fall 2024,Feminine,"Striped pink and white top, Black and white patterned skirt",White pointed heels,A-line,"Eclectic, Bold, Patterned",Mix of stripes and animal prints
1,Talia Byre,Fall 2024,Feminine,"Beige knit vest, Striped long-sleeve shirt, White collared shirt, Black pinstripe skirt",Black and white clutch,"Layered, A-line","Eclectic, Layered, Modern",Mix of patterns and textures
1,Talia Byre,Fall 2024,Feminine,"Black pinstripe shirt, Blue leather skirt","Polka dot belt, White tights, White strappy heels","Structured top, Flared skirt","Chic, Modern, Edgy",Bold makeup with dark lipstick
1,Talia Byre,Fall 2024,Feminine,"Cow-print jacket, Animal-print skirt",White boots,"Layered, A-line","Eclectic, Bold",Mix of animal prints
1,Talia Byre,Fall 2024,Feminine,"Striped shirt, Striped dress","White tights, White heels","Structured, Layered","Modern, Minimalist",Monochrome stripes with contrasting directions
1,Talia Byre,Fall 2024,Feminine,"Striped shirt dress, Gray knit sweater","Wide black belt, White heels","Layered, A-line","Chic, Modern, Layered",Contrasting textures and patterns with a structured silhouette.
1,Talia Byre,Fall 2024,Feminine,"Red crinkled jacket, Red and white striped dress, Red skirt","White tights, White heels","Structured, Layered","Bold, Contemporary",Red and white color scheme with a mix of textures.
