Look Number,Designer,Season,Gender Presentation,Garments,Accessories,Silhouette,Style Keywords,Notes
1,Mark Fast,Fall 2024,Feminine,"Beige shearling coat, Ruched gray top, Beige textured pants",None visible,"Oversized coat, Slim pants","Casual, Layered, Textured",Neutral tones with a focus on texture and layering.
1,Mark Fast,Fall 2024,Feminine,"Shearling coat, Denim jacket, Beige sweater, White shirt, Navy skirt",Light blue boots,"Layered, Relaxed","Casual, Layered, Textured","Mix of textures with a casual, layered look"
1,Mark Fast,Fall 2024,Feminine,"Blue velvet jacket, White t-shirt, Blue denim jeans",None,"Relaxed, Layered","Casual, Chic",Layered textures with a focus on blue tones.
1,Mark Fast,Fall 2024,Masculine,"Denim jacket with green sleeves, Black cargo pants",Black patent leather boots,"Structured, Layered","Urban, Edgy",Mix of textures with denim and patent leather
1,Mark Fast,Fall 2024,Feminine,"Black puffer vest, Graphic print top, Graphic print skirt","Silver knee-high boots, Black gloves","Layered, Fitted","Streetwear, Futuristic",Bold prints with metallic accents
1,Mark Fast,Fall 2024,Feminine,"Graffiti-print oversized t-shirt, Beige distressed jeans",Necklace,"Relaxed, Layered","Streetwear, Edgy","Bold graphic elements, Casual yet artistic"
1,Mark Fast,Fall 2024,Masculine,"White long coat, white cropped zip-up top, white wide-leg pants","White sunglasses, white sneakers","Relaxed, layered","Monochrome, modern, sleek",All-white ensemble with a contemporary edge
1,Mark Fast,Fall 2024,Feminine,"White quilted jacket, White ruched skirt",White knee-high boots,"Fitted, Streamlined","Monochrome, Textured",Elegant winter look with a focus on texture and warmth.
1,Mark Fast,Fall 2024,Feminine,"Black velvet coat, Black textured skirt","Sunglasses, Silver ankle boots","Straight, Layered","Chic, Modern, Edgy",Monochromatic look with metallic accents
