Look Number,Designer,Season,Gender Presentation,Garments,Accessories,Silhouette,Style Keywords,Notes
1,Thom Browne,Fall 2024,Feminine,"White quilted coat with black and pink tweed, Black textured skirt, White tuxedo shirt with black trim","Black top hat with veil, Clear platform boots","Oversized coat, Fitted skirt","Avant-garde, Dramatic, Textured",Mix of classic and modern elements with a theatrical twist
1,Thom Browne,Fall 2024,Gender Neutral,"White coat with black bird motifs, Black suit, White shirt, Black tie","Veil, Black boots","Structured, Layered","Avant-garde, Dramatic","Bold bird motifs, Monochrome palette"
1,Thom Browne,Fall 2024,Masculine,"Black and white tailored coat, white shirt, black tie, black pants","Silver handbag, black veil","Oversized, structured","Avant-garde, formal",Dramatic use of contrast and layering
1,Thom Browne,Fall 2024,Feminine,"Black double-breasted coat, White shirt, Black layered skirt","Veil, Braided hair, Heeled boots","Structured, Layered","Avant-garde, Dramatic",Bold use of layering and texture with a theatrical presentation.
1,Thom Browne,Fall 2024,Gender Neutral,"Black dress, Black and white checkered coat","Veil, Silver shoes","Layered, Structured","Avant-garde, Monochrome",Dramatic headpiece with braided detail
1,Thom Browne,Fall 2024,Feminine,"Black sequin jacket, multicolored tweed skirt","Veil, striped ribbons, knee-high boots","Structured, layered","Avant-garde, eclectic","Floral tights, contrasting textures"
1,Thom Browne,Fall 2024,Androgynous,"White tweed coat with black trim, Plaid suit, White shirt, Black tie","Green bag with striped strap, Veil","Structured, Oversized","Avant-garde, Monochrome, Textured","Bold makeup, Layered look"
1,Thom Browne,Fall 2024,Feminine,"White shirt, Black tie, Black textured cardigan, Black high-waisted skirt","Veil, Metallic boots","Fitted, Layered","Avant-garde, Monochrome",Dramatic use of black and white with textural contrasts
1,Thom Browne,Fall 2024,Gender Neutral,"White and black checkered coat, black textured skirt, white shirt, black tie","Veil headpiece, small dog-shaped handbag","Structured, layered","Avant-garde, monochrome, tailored",Mix of textures and patterns with a classic yet edgy vibe.
