Look Number,Designer,Season,Gender Presentation,Garments,Accessories,Silhouette,Style Keywords,Notes
1,Lou Dallas,Fall 2024,Feminine,"Brown suede cropped jacket, Pink long-sleeve top, Red and green floral skirt",Brown wrapped boots,"Asymmetrical, Fitted","Eclectic, Avant-garde",Mix of textures and vibrant colors
1,Lou Dallas,Fall 2024,Feminine,"Patchwork hoodie, graphic bodysuit, brown suede pants with blue fringe",Platform sandals,Layered and eclectic,"Bohemian, Eclectic, Artsy",Mix of textures and prints with vibrant colors
1,Lou Dallas,Fall 2024,Feminine,"Layered dress, multicolor, lace and sheer textures",Striped stockings,"Fitted, layered","Eclectic, whimsical, avant-garde","Mix of textures and colors with a playful, artistic vibe"
1,Lou Dallas,Fall 2024,Feminine,"Denim corset top with lace trim, Striped distressed jeans",Patterned headscarf,"Fitted top, Slim pants","Eclectic, Edgy, Avant-garde","Mix of textures and patterns, Bold makeup"
1,Lou Dallas,Fall 2024,Feminine,"Blue velvet cape, multicolor corset, green mini skirt",Blue thigh-high stockings,"Fitted, layered","Eclectic, vibrant",Mix of textures and bold colors
1,Lou Dallas,Fall 2024,Feminine,"Green faux fur coat, Blue ruched top, Striped mini skirt, Fishnet stockings",Embellished heels,"Layered, Textured","Eclectic, Bold, Avant-garde",Mix of textures and vibrant colors
1,Lou Dallas,Fall 2024,Feminine,"White sheer tank top, Denim and white layered mini skirt, White leggings",Black ribbon-tied boots,"Fitted top, Layered bottom","Eclectic, Layered, Avant-garde",Playful mix of textures and layers
1,Lou Dallas,Fall 2024,Feminine,Red floral sheer dress with ruffled trim,None visible,Flowy,"Romantic, Bohemian","Paired with red boots, layered textures"
1,Lou Dallas,Fall 2024,Feminine,"Sheer blue long-sleeve top, Green paneled pants with lace detail",Green cowboy boots,"Fitted top, Slim pants","Eclectic, Layered, Playful","Mix of textures and colors, Western influence"
