Look Number,Designer,Season,Gender Presentation,Garments,Accessories,Silhouette,Style Keywords,Notes
1,Nanushka,Fall 2024,Feminine,"Black leather coat with shearling lining, Beige wide-leg pants",None,Oversized,"Minimalist, Modern",Contrasting textures with a focus on warmth and comfort.
1,Nanushka,Fall 2024,Feminine,"Blue long-sleeve top, Blue leather corset, Blue maxi skirt","Black sunglasses, Statement necklace, Patterned bag","Fitted top, Flowing skirt","Modern, Chic, Minimalist",Monochromatic blue with textural contrast
1,Nanushka,Fall 2024,Unisex,"Black patterned sweater, black wide-leg pants",Black leather handbag,"Relaxed, Oversized","Casual, Edgy","Graphic patterns on sweater, minimalistic accessories"
1,Nanushka,Fall 2024,Unisex,"Cream shaggy fur coat, Yellow t-shirt, Dark green wide-leg pants",None,Relaxed,"Casual, Cozy, Textured","Minimal accessories, Focus on texture"
1,Nanushka,Fall 2024,Androgynous,"Light blue denim jacket, Light blue denim pants, Black turtleneck","White shaggy bag, Necklace","Oversized, Relaxed","Casual, Modern, Layered",Denim on denim with textural contrast from accessories.
1,Nanushka,Fall 2024,Female,"Cream cable-knit sweater and pants, Black leather cape",Shell belt,"Oversized, Layered","Textured, Minimalist",Contrasting textures with a focus on layering
1,Nanushka,Fall 2024,Feminine,"One-shoulder black cutout top, Yellow and brown abstract print skirt",White cat-eye sunglasses,"Fitted, Asymmetrical","Modern, Edgy, Artistic",Bold print with a sleek silhouette
1,Nanushka,Fall 2024,Androgynous,"Black leather coat with shearling lapels, beige trousers",Earrings,"Oversized, Longline","Minimalist, Modern","Contrasting textures with a sleek, structured look"
1,Nanushka,Fall 2024,Androgynous,"Sleeveless beige textured vest, ""tie-dye"" wide-leg pants",Statement necklace,"Relaxed, Boxy","Modern, Artistic, Casual",Neutral tones with bold patterns
