Look Number,Designer,Season,Gender Presentation,Garments,Accessories,Silhouette,Style Keywords,Notes
1,Michael Kors,Fall 2024,Feminine,"Black double-breasted blazer, Black skirt with slit","Black handbag, Black pointed heels","Structured, Tailored","Chic, Minimalist",Classic black ensemble with a modern twist
1,Michael Kors,Fall 2024,Feminine,Black satin dress with lace overlay,"Small black handbag, black pointed heels",Fitted,"Elegant, Sophisticated",Lace detailing adds a delicate touch
1,Michael Kors,Fall 2024,Feminine,"Black tailored blazer, Black knee-length shorts","Black handbag, Black pointed heels","Structured, Tailored","Chic, Minimalist",Classic black ensemble with a modern twist
1,Michael Kors,Fall 2024,Feminine,"White ribbed tank top, Black high-waisted slit skirt","Black leather belt, Black leather tote bag","Fitted top, Flowing skirt","Minimalist, Modern, Chic",Classic black and white ensemble with sleek lines
1,Michael Kors,Fall 2024,Feminine,Gray herringbone coat dress,"Black handbag, Black pointed heels","Structured, Knee-length","Classic, Sophisticated","Double-breasted design, Minimalist aesthetic"
1,Michael Kors,Fall 2024,Masculine,"Black oversized trench coat, White shirt, Charcoal wide-leg trousers","Black textured handbag, Black glasses","Oversized, Relaxed","Chic, Modern, Minimalist",Classic monochrome palette with a sophisticated urban vibe.
1,Michael Kors,Fall 2024,Feminine,Black lace slip dress,"Black clutch, Black pointed heels","Asymmetrical, Fitted","Elegant, Sophisticated",Features lace detailing and a belted waist
1,Michael Kors,Fall 2024,Masculine,"Black and white tweed coat with fur collar, black turtleneck, black wide-leg trousers",Black structured handbag,"Longline, Oversized","Elegant, Sophisticated",Classic monochrome look with luxurious textures
1,Michael Kors,Fall 2024,Feminine,Black sequined turtleneck dress with thigh-high slit,Black knee-high boots,Bodycon,"Elegant, Glamorous","Minimal accessories, focus on dress"
