Look Number,Designer,Season,Gender Presentation,Garments,Accessories,Silhouette,Style Keywords,Notes
1,Hervé Léger,Spring 2024,Feminine,"Blue striped bodycon dress, Black leggings","Black sunglasses, Silver rings",Fitted,"Chic, Modern",Minimalist styling with a sleek silhouette
1,Hervé Léger,Spring 2024,Feminine,Beige bandage mini dress,"Brown gloves, Black tights, Black pointed heels","Fitted, Bodycon","Chic, Modern",Classic Hervé Léger bandage style with a contemporary twist
1,Hervé Léger,Spring 2024,Feminine,White long-sleeve bodycon dress,"White handbag, Black sunglasses, White heels","Fitted, Midi","Minimalist, Modern, Sleek",Monochromatic look with structured lines
1,Herve Leger,Spring 2024,Feminine,Neon green ribbed knit dress,"Black sunglasses, Silver rings","Fitted, Bodycon","Futuristic, Minimalist",Sleek and modern aesthetic
1,Hervé Léger,Spring 2024,Feminine,"Black off-the-shoulder crop top, Black wide-leg pants",White pointed-toe shoes,"Fitted top, Wide-leg pants","Modern, Minimalist, Chic","Cut-out detail on top, Monochrome look"
1,Hervé Léger,Spring 2024,Feminine,"Red bandage dress, sheer red long sleeves",None,Form-fitting,"Bold, Modern, Sleek","Monochromatic red look, architectural lines"
1,Hervé Léger,Spring 2024,Feminine,"Nude sheer top, nude corset",None,Fitted,"Minimalist, Elegant",Focus on texture and layering
1,Hervé Léger,Spring 2024,Feminine,"White fringe dress, Black leggings",White fringe clutch,Fitted,"Modern, Chic",Minimalist design with fringe details
1,Hervé Léger,Spring 2024,Feminine,"Green fringe mini dress, Black tights","Green gloves, White pointed heels","Fitted, Mini","Bold, Playful, Modern",Fringe detailing adds movement and texture.
