Look Number,Designer,Season,Gender Presentation,Garments,Accessories,Silhouette,Style Keywords,Notes
1,Kiko Kostadinov,Fall 2024,Feminine,"Yellow textured sweater, Olive green cut-out pants","Yellow fur hat, Black belt","Loose pants, Fitted top","Eclectic, Layered, Textured",Brown thigh-high boots with red soles
1,Kiko Kostadinov,Fall 2024,Feminine,"Sheer black blouse, black voluminous shorts","Red belt, red clutch","Voluminous shorts, fitted top","Edgy, modern, layered",Layered textures with a bold color accent
1,Kiko Kostadinov,Fall 2024,Feminine,"Red textured knit sweater, Olive cargo pants",Orange belt bag,"Structured shoulders, Tapered pants","Futuristic, Sporty","Bold color contrast, Utilitarian elements"
1,Kiko Kostadinov,Fall 2024,Feminine,Black and brown velvet dress,"Silver bracelets, long earrings",Fitted,"Edgy, Modern",Textured fabric with contrasting panels
1,Kiko Kostadinov,Fall 2024,Feminine,Brown and pink velvet dress,Gold bracelet,"Fitted, Asymmetrical","Modern, Bold",Color-blocked design with contrasting textures
1,Kiko Kostadinov,Fall 2024,Feminine,"Black cut-out dress, Black boots","Chain necklace, Bracelets","Flowing, Asymmetrical","Edgy, Modern",Dramatic cut-outs and layered details
1,Kiko Kostadinov,Fall 2024,Feminine,"Blue and pink striped dress, ruched texture","Silver shoulder bag, gold hoop earrings","Fitted, ruched","Bold, graphic, modern",Paired with green and purple boots
1,Kiko Kostadinov,Fall 2024,Feminine,"Blue draped top, Multicolored layered skirt",Green textured hat,"Layered, Asymmetrical","Avant-garde, Textured",Playful use of color and texture
